"EVENT NAME","VENUE NAME","ORGANIZER NAME","START DATE","START TIME","END DATE","END TIME","ALL DAY EVENT?","CATEGORIES","EVENT COST","EVENT WEBSITE","SHOW MAP LINK?","SHOW MAP?","EVENT DESCRIPTION","EVENT IMAGE"
"Raval Street Art Tour","Plaza Universitat","Alternative Barcelona","10/01/2017","","","",1,"Exposición, Espacios alternativos","0","https://www.facebook.com/events/849238021905619/",1,1,"<p><img src='http://scontent.xx.fbcdn.net/v/t1.0-9/20476039_264614064023825_5037802706654046665_n.jpg?oh=a57167fd20fa0ba838caa67c06fd7760&oe=5A4D7288' width='228' height='182' alt='Raval Street Art Tour' />Join Alexandra on her Street Art Tour through the Raval area! <br /><br />We'll learn all about the street art and graffiti scene in Barcelona and admire a variety of installations along the way!<br /><br />We'll also be visiting el Raval's ""Montana Shop"" and ""Las Tres Chimeneas"" (a public space where Grafitti/Street Artists can paint legally)<br /><br />* Meeting point: Plaza Universitat (outside red metro line)<br />* The tour is free, but we do work off tips :)</p>","https://scontent.xx.fbcdn.net/v/t1.0-9/20476039_264614064023825_5037802706654046665_n.jpg?oh=a57167fd20fa0ba838caa67c06fd7760&oe=5A4D7288"
"Street Art Bike Tour (Poble Nou)","Green Bikes Barcelona - Rentals & Tours","Alternative Barcelona","09/30/2017","","","",1,"Exposición, Espacios alternativos","0","https://www.facebook.com/events/139520279968198/",1,1,"<p><img src='http://scontent.xx.fbcdn.net/v/t1.0-9/s720x720/20430043_264620444023187_9048662838472580390_n.jpg?oh=4f493df147c97341a9e9003608d28cf7&oe=5A1D2A8D' width='228' height='182' alt='Street Art Bike Tour (Poble Nou)' />Join our street art expert and hunt for Poble Nou's larger Street Art and Murals!<br /><br />* Price: 18€ / per person (Bike included)<br />* Tour is in ENGLISH (guide also speaks: Spanish & French)<br />* Click to link to reserve: https://www.journeyofanartstigator.com/contact/</p>","https://scontent.xx.fbcdn.net/v/t1.0-9/s720x720/20430043_264620444023187_9048662838472580390_n.jpg?oh=4f493df147c97341a9e9003608d28cf7&oe=5A1D2A8D"
"Entre-zones. Presentació del projecte EMIA","Experimentem amb l'Art","Experimentem amb l'Art","10/04/2017","","","",1,"Exposición, Espacios alternativos","0","https://www.facebook.com/events/2061365940556071/",1,1,"<p><img src='http://scontent.xx.fbcdn.net/v/t31.0-8/q81/s720x720/21316464_1737122236329714_1607935076379203777_o.jpg?oh=255931477205b34802ee167743738449&oe=5A497348' width='228' height='182' alt='Entre-zones. Presentació del projecte EMIA' />Dimecres 4 d’octubre de 18h a 21h<br />Experimentem amb l’ART<br />Activitat gratuïta amb aforament limitat<br />Per participar-hi cal fer la inscripció: https://docs.google.com/forms/d/e/1FAIpQLSfKarerBYeGcedo31WxYcIh-F7QaIbjPI0J91SBxbrN6XTf9Q/viewform<br /><br />Entre-zones és un programa d’EART en què es comparteixen projectes culturals i artístics que es serveixen de l’art com a desencadenant per al desenvolupament social, i tenen lloc en diferents indrets d’arreu del territori i en l’àmbit internacional.<br /><br />Es tracta de mostrar i dialogar entorn a propostes de caràcter diferent que actualment s’estan realitzant, amb objectius ben distints i sovint arriscats, segons les característiques del lloc i el bagatge artístic o educatiu.<br /><br />Un conjunt de trobades, les quals, a més de donar a conèixer aquests treballs, poden facilitar la creació de xarxes de relació i d’intercanvi i, per què no, possibles projectes comuns.<br /><br />El 4 d’octubre presentem: EMIA/escola Municipal de Iniciação de São Paulo, un projecte amb més de trenta-cinc anys de trajectòria de la ciutat de São Paulo- Brasil. És un projecte públic d’ensenyança de les arts per a nens de 5 a 12 anys, basat en la interacció de diferents disciplines: arts visuals, música, teatre i dansa. Els cursos són de durada anual i els participants, que entren per sorteig públic, fan un recorregut formatiu de 6 o 8 anys. És un espai acollidor de tres cases dins d’un parc, on a banda dels cursos escolars, es fan tallers per a alumnes, ex alumnes, famílies i comunitat.<br /><br />La presentació és a càrrec de l’artista visual Julia Salgueiro (col·laboradora i ex resident d’EART), del músic i actor Celso Amancio de Melo Filho, artistes i educadors del projecte EMIA i de Andrea Fraga, directora de EMIA/escola Municipal de Iniciação de São Paulo que ens l’ explicaran a partir d’exercicis pràctics i moments de reflexions conjuntes.<br /><br />Més informació del projecte:<br />http://www.prefeitura.sp.gov.br/cidade/secretarias/cultura/formacao/index.php?p=7372<br />http://emiasp.blogspot.com.es/<br /><br />Julia Salgueiro: És artista visual, el 2008 acaba la carrera de Belles Arts a la Universidade Estadual de Campinas. La seva primera experiència amb el projecte EMIA va ser com a alumna, des del 1992 fins al 1998. Viu i treballa a Barcelona, posant l’èmfasi en l’art contemporani. Els seus treballs han estat exposat a ciutat com New York, São Paulo, Buenos Aires, Londres i Barcelona.<br />En la seva trajectòria com a mediadora dins d’institucions educatives es destaca el seu treball com a professora en el projecte EMIA i tres anys com a professora en escoles de primària i secundària a São Paulo. A Barcelona col·labora com a educadora en diferents projectes de l’entitat Experimentem amb l’ART on ha estat artista resident (2014-2016).<br /><br />Celso Amancio de Melo Filho: És music i actor. Cursa la carrera de música en la Universidade Federal de Uberlândia i el màster en Arts Escèniques a la Universidade Estadual Paulista. Ha format part de diversos grups de teatre com l’ Orquestra Camargo Guaniere, el Quinteto Miguilim, Teatro Comune i el Clã Estudio das artes cómicas.<br />És cofundador de la companyia Cia de Galhofa i actualment treballa en altres companyies de teatre amb seu a São Paulo.<br />Es va incorporar com a educador a EMIA- Escola Municipal de Iniciação Artística el 2013, on ara mateix coordina l’àrea de música. L’any 2017 va ser redactor de continguts artístics de les bases nacionals curriculars del Ministeri de Educació de Brasil</p>","https://scontent.xx.fbcdn.net/v/t31.0-8/q81/s720x720/21316464_1737122236329714_1607935076379203777_o.jpg?oh=255931477205b34802ee167743738449&oe=5A497348"
"Lorenzo Pepe. Escultura y Joyería","Begemot Art & Fashion","Begemot Art & Fashion","10/05/2017","","","",1,"Exposición, Espacios alternativos","0","https://www.facebook.com/events/166236260606208/",1,1,"<p><img src='http://scontent.xx.fbcdn.net/v/t31.0-8/s720x720/20934879_852349461599110_6625684645097265440_o.jpg?oh=c50d584aa357d9165c5527a4a73d928a&oe=5A5C1B8E' width='228' height='182' alt='Lorenzo Pepe. Escultura y Joyería' />Coincidiendo con Expo Joia de Barcelona les invitamos a la primera exposición de escultura y joyería de Lorenzo Pepe. Obra inspirada en formas orgánicas, formas que nacen en el mar...</p>","https://scontent.xx.fbcdn.net/v/t31.0-8/s720x720/20934879_852349461599110_6625684645097265440_o.jpg?oh=c50d584aa357d9165c5527a4a73d928a&oe=5A5C1B8E"
"Iñaki Bonillas: El triunfo de la vida solitaria","Projecte SD","Projecte SD","09/28/2017","","","",1,"Exposición, Espacios alternativos","0","https://www.facebook.com/events/112825359413260/",1,1,"<p><img src='http://scontent.xx.fbcdn.net/v/t1.0-9/s720x720/21370931_1698999686807716_8934924870104162427_n.jpg?oh=5ec42f169f14c1a6a3662789864cb756&oe=5A4A6D41' width='228' height='182' alt='Iñaki Bonillas: El triunfo de la vida solitaria' />OPENING, 28.09.2017, 19.00 H. <br />EXHIBITION: 29.09 > 11.11.2017<br />PART OF THE BARCELONA GALLERY WEEKEND: 28.09 > 1.10.2017<br />SAVE THE DATE!!</p>","https://scontent.xx.fbcdn.net/v/t1.0-9/s720x720/21370931_1698999686807716_8934924870104162427_n.jpg?oh=5ec42f169f14c1a6a3662789864cb756&oe=5A4A6D41"
"Diàleg amb Lita Cabellut. ""Clivellant el món""","Espais Volart","Espais Volart","10/04/2017","","","",1,"Exposición, Espacios alternativos","0","https://www.facebook.com/events/146239039306616/",1,1,"<p><img src='http://scontent.xx.fbcdn.net/v/t31.0-8/s720x720/21316489_1690880034263529_2930206120007030440_o.jpg?oh=15fd8bc4fcfadfcf4b0bd6991aff7761&oe=5A17661D' width='228' height='182' alt='Diàleg amb Lita Cabellut. ""Clivellant el món""' />[CA]<br />AFORAMENT COMPLET.<br />Tota exposició és un acte de diàleg entre obra, espectador i autor. Amb Diàlegs per [des]cobrir l’obra de Lita Cabellut busquem establir un diàleg a quatre veus entre obra, espectadors, autor i personalitats del món de la cultura que ens permetin endinsar-nos en l’univers estètic i de continguts de les seves obres. Diàlegs per descobrir i recórrer una obra i els seus significats.<br /><br />""Clivellant el món"". L’obra de Lita Cabellut va a la recerca del temps, del pas del temps sobre la vida. El clivellat típic en un retrat de meitat del segle XVII francès permet observar les esquerdes sobre la pintura. Conèixer l’obra de Lita Cabellut, que utilitza un efecte semblant en les seves obres, implica endinsar-se en el temps, entès com a generador de ruïnes i mites. L’artista com a narradora del temps.<br /><br />Més informació: https://goo.gl/cDPavF<br /><br />[ES]<br />AFORO COMPLETO.<br />Toda exposición es un acto de diálogo entre obra, espectador y autor. Con Diálogos para [des]cubrir la obra de Lita Cabellut buscamos establecer un diálogo a cuatro voces entre obra, espectadores, autor y personalidades del mundo de la cultura que nos permita adentrarnos en el universo estético y de contenidos de sus obras. Diálogos para descubrir y recorrer una obra y sus significados.<br /><br />""Agrietando el mundo"". La obra de Lita Cabellut va en búsqueda del tiempo, del paso del tiempo sobre la vida. El agrietado típico en un retrato de mediados del siglo xvii francés permite observar las grietas sobre la pintura. Conocer la obra de Lita Cabellut, que utiliza un efecto parecido en sus obras, implica adentrarse en el tiempo, entendido como generador de ruinas y mitos. La artista como narradora del tiempo.<br /><br />Más información: https://goo.gl/TJBmqS<br /><br />[EN]<br />FULL CAPACITY.<br />All exhibitions are an act of dialogue between the artwork, the viewer and the artist. The aim of Dialogues to (Dis)Cover the Work of Lita Cabellut is to establish a four-way dialogue between the works, viewers, the artist and people from the field of culture, enabling us to explore the aesthetic universe and content of her pieces.  Dialogues to discover and explore a work and its meanings.<br /><br />The world through craquelure. Lita Cabellut's output is an investigation of time, of the passage of time on life. The craquelure typical of a French portrait from the mid 17th century allows us to observe fissures in the paint.  Coming into contact with the work of Lita Cabellut, who makes use of a similar technique, means journeying into time, understood as a generator of ruins and myths.  The artist as a narrator of time. <br /><br />More information: https://goo.gl/Af9um6</p>","https://scontent.xx.fbcdn.net/v/t31.0-8/s720x720/21316489_1690880034263529_2930206120007030440_o.jpg?oh=15fd8bc4fcfadfcf4b0bd6991aff7761&oe=5A17661D"
"Raval Street Art Tour","Plaza Universitat","Alternative Barcelona","10/06/2017","","","",1,"Exposición, Espacios alternativos","0","https://www.facebook.com/events/260126947826192/",1,1,"<p><img src='http://scontent.xx.fbcdn.net/v/t1.0-9/20429876_264615420690356_2120089202364356621_n.jpg?oh=e30215b4717863335fef8f3b798cbce3&oe=5A1DE7B5' width='228' height='182' alt='Raval Street Art Tour' />Join Alexandra on her Street Art Tour through the Raval area! <br /><br />We'll learn all about the street art and graffiti scene in Barcelona and admire a variety of installations along the way!<br /><br />We'll also be visiting el Raval's ""Montana Shop"" and ""Las Tres Chimeneas"" (a public space where Grafitti/Street Artists can paint legally)<br /><br />* Meeting point: Plaza Universitat (outside red metro line)<br />* The tour is free, but we do work off tips :)</p>","https://scontent.xx.fbcdn.net/v/t1.0-9/20429876_264615420690356_2120089202364356621_n.jpg?oh=e30215b4717863335fef8f3b798cbce3&oe=5A1DE7B5"
"RebelArt Festival","Nau Bostik","RebelArt","10/14/2017","","","",1,"Exposición, Espacios alternativos","0","https://www.facebook.com/events/1902027443347605/",1,1,"<p><img src='http://scontent.xx.fbcdn.net/v/t1.0-9/20841159_167137470499910_5393017186994519828_n.jpg?oh=9c192b1373fa81f7212ad4d326a3aa87&oe=5A19FC94' width='228' height='182' alt='RebelArt Festival' />RebelArt pretén crear un espai de trobada en el qual artistes de carrer puguin presentar-nos els seus<br />projectes i idees. Un espai de convivència amb un públic de qualitat, interessat en projectes<br />alternatius lluny de la cultura de masses.<br />El festival també proposa visibilitzar la lluita de locals independents, donant a conèixer<br />els seus projectes, les seves dificultats diàries. RebelArt té com a objectiu realitzar un esdeveniment no convencional,<br />reivindicant l'art de carrer no institucionalitzat, en rebel·lió contra les normes i censures que les institucions i l'Ajuntament <br />de Barcelona exerceixen contra locals i projectes culturals, en particular els que estan basats a la música en directe, com els recents casos<br />del bar Heliogàbal, Gipsy Lou o el Arco de la Virgen. D'aquesta manera hem decidit organitzar RebelArt, amb la intenció de destinar una part de la recaptació de l'entrada a petits nous projectes com aquests.<br /><br />Contem amb 3 espais + serveis foodtruck:<br />·Sala de Concerts<br />·Sala d'Exposicions RefugiArte<br />·Sala Graffiti Kids<br /><br />·SALA CONCERTS<br />11:00 Apertura puertas<br />12:00 Apertura puertas<br />12:10 Dinamita<br />13:00 Arumbo<br />14:30 De la Carmela<br />15:45 Anto<br />17:00 Microguagua<br />18:15 Mr populus/D.kanal<br />19:45 Morosito<br />21:00 Rumbakana<br />22:00 MateoliKa<br />23.00/23.30 cierre<br /><br />·EXPOSICIÓ REFUGIARTE <br /><br />Durant tot el dia podrem gaudir de l'exposició de fotos que RefugiArte junt amb Fotomovimiento porten treballant tant de temps.<br />Són un col·lectiu de fotògrafs, amb consciència social critica. En aquesta exposició, ens mostren la realitat de les persones que es veuen forçades a buscar refugi a diferents emplaçaments de la seva ruta migratòria.<br /><br />·GRAFFITI KIDS <br /><br />La zona Graffiti Kids estarà habilitada amb el material necessari perquè nens i adults assistents al festival puguin iniciar-se en l'Art del Graffiti de la mà de dos grans artistes internacionalment coneguts, forjats als carrers d'Hospitalet i de Barcelona,<br />També s'exhibiran algunes de les obres dels artistes.<br />Així mateix, durant el dia del festival, Uriginal i Irene Lopez ens brindaran amb les seves intervencions pintant en directe una peça cada un.</p>","https://scontent.xx.fbcdn.net/v/t1.0-9/20841159_167137470499910_5393017186994519828_n.jpg?oh=9c192b1373fa81f7212ad4d326a3aa87&oe=5A19FC94"