web-scraper-order,web-scraper-start-url,event_title1,event_title2,event_image-src,event_text,event_start,event_end,event_venue,event_link,event_link-href,event_organizer__MACBA,event_category__Actividad__MACBA,event_maplink__1,event_cost__,event_id
1513978304-90,http://www.macba.cat/es/actividades,La condición de contorno. Sobre el archivo y sus límites,Seminario,/uploads/20171214/Imagen_condicion_contorno_01.0.9.jpg,"En matemáticas, las condiciones de contorno surgen en el marco de las ecuaciones diferenciales y aluden a la conexión entre un dominio ilimitado y un dominio limitado, a las condiciones de frontera y confinamiento frente a la opcionalidad infinita. Por su similitud, esta imagen puede ser empleada para pensar la compleja articulación que se produce entre tres de los elementos fundacionales y fundamentales del museo como son sus acervos artísticos, el archivo documental y la biblioteca. La delimitación entre ellos es compleja per se. Si además se tienen en consideración las prácticas artísticas conceptuales e inmateriales y con ellas el cuestionamiento de la noción tradicional de obra de arte, aventurarse a distinguir entre una obra y un documento se convierte en una tarea harto compleja. 



Los procesos burocráticos y técnicos a los que la institución arte somete a estos documentos, que acaban siendo fetichizados, auratizados y por ende mercantilizados, no ayudan a esclarecer esta cuestión. Los límites atañen no solo a este dilema entre obra y documento en el contexto de lo performativo y conceptual, entre archivo y colección de arte, sino que también hablan de la constricción de las leyes que los regulan, de las utopías y fracasos de la digitalización, así como de la incompletitud, imperfección y omisión inherente al propio concepto de archivo. Al mismo tiempo, y junto con la crisis de la noción del archivo como autoridad, especialmente en relación con los procesos coloniales, surgen aquellos modelos de archivo que atienden a las memorias no representadas por las narrativas hegemónicas, los llamados archivos autogestionados o anarchivos. 



Así pues, la condición de contorno se refiere en nuestro caso a las condiciones que se dan en la difícil delimitación del concepto de archivo en el contexto actual, en relación con las ondas incidentes y ecos que se producen entre aquello que consideremos como archivo y lo que permanece a su alrededor. 



Esta actividad se enmarca en el programa de actividades con motivo del décimo aniversario del Centro de Estudios y Documentación MACBA. 



Dirigido por Maite Muñoz. Con la participación de Tanya Barson, Mela Dávila, Alicia Escobio, Diana Franssen, Marina Gržinić, Gelen Jeleton, Pablo León de la Barra, Pablo Martínez, Miguel Morey, Muntadas, Scandinavian Institute for Computational Vandalism y Teal Triggs.",16,17 feb. 2018,Auditori Meier,,http://www.macba.cat/es/la-condicion-de-contorno-sobre-el-archivo-y-sus-limites/1//activ,null,null,null,null,/es/la-condicion-de-contorno-sobre-el-archivo-y-sus-limites/1//activ
1513978315-96,http://www.macba.cat/es/actividades,Alvin Lucier: No Ideas But In Things,Sampler Series,/uploads/20171220/Alvin_Lucier_1.3.jpg,"El compositor y artista sonoro norteamericano Alvin Lucier es uno de los autores de referencia en los ámbitos de la música experimental y de la creación sonora. Cofundador de la Sonic Arts Union junto con Robert Ashley, David Behrman y Gordon Mumma, la obra de Lucier ha estado programada y expuesta en salas de concierto y centros de arte de todo el mundo, y ha colaborado con artistas como John Ashbery, Robert Wilson o Sol LeWitt. El documental No Ideas But In Things, de Viola Rusche y Hauke Harder, nos adentra en el particular mundo de Lucier a través de su obra. Antes de la proyección del film, que presentará el director Hauke Harder, el percusionista francés Stéphane Garin interpretará dos solos para triángulo amplificado y para objetos percutidos.",19 ene. 2018,null,Auditori Meier,,http://www.macba.cat/es/alvin-lucier--no-ideas-but-in-things/1//activ,null,null,null,null,/es/alvin-lucier--no-ideas-but-in-things/1//activ
1513978308-92,http://www.macba.cat/es/actividades,La década de 1990: Rewind & Forward. Hacia una competencia pública del arte,Curso de arte y cultura contemporánea,/uploads/20171215/Seleccion_de_Euskadi_de_Arte_Conceptual.0.2.jpg,"Este curso explora, desde distintos puntos de vista, un conjunto de desplazamientos que se producen desde la década de 1990. Singularmente importante es el que afecta a la competencia pública de las prácticas creativas: cómo en aquellos años se produce un creciente interés en reflexionar y practicar el arte con una voluntad de insertarlo en la vida pública general, en la vida social, en la esfera comunicativa, en el ámbito político y micropolítico, con el objetivo último de apostar por una cultura de los procesos sociales y no de los productos de plusvalía. En los años noventa, se produce un auge claro de toda una batería de fenómenos que desean cuestionar la cultura publicitaria, nacionalista y subjetivista de los ochenta, enlazando con prácticas de los setenta y avanzando formatos, procedimientos e indagaciones que serán centrales a partir del año 2000: activismos de todo género, nuevas interpretaciones del espacio público, enunciación política, memorias históricas, mediaciones, dislocaciones, nuevas corporalidades; todo ello en el marco de una gran mutación del espectro audiovisual con la digitalización universal y la aparición de internet, paralelo a un proceso general de estetización y desregulación viral de la economía política y de la esfera pública.



El curso cuenta con la mediación activa de los asistentes, de modo que la voluntad de ampliar la «competencia pública» de lo expuesto a lo largo de las sesiones tenga lugar concreto de expresión. Para ello, se editará una publicación en la que el público asistente desplegará libremente sus respuestas, ampliaciones, críticas o derivas respecto de cada sesión o del conjunto general del curso.



Dirigido por Jorge Luis Marzo. Con la participación de Tere Badia, Cabello/Carceller, Joan Fontcuberta, Joana Masó y Patricia Mayayo. 





Dirigido a personas interesadas en el arte actual y sus narrativas.",08 feb.,15 mar. 2018,,,http://www.macba.cat/es/la-decada-de-1990-rewind--forward-hacia-una-competencia-publica-del-arte/1//activ,null,null,null,null,/es/la-decada-de-1990-rewind--forward-hacia-una-competencia-publica-del-arte/1//activ
1513978299-88,http://www.macba.cat/es/actividades,Vientos del este: comunismos futuros,PEI ABIERTO,/uploads/20171219/Tribuna_de_Lenin_003.8.jpg,"El planteamiento de este seminario se centra en el análisis de la larga tradición de los conceptos «revolución» y «comunismo», que en el siglo pasado quedaron asociados a la experiencia de la Revolución de Octubre, para repensar su uso en el presente. Tras la aniquilación de proyectos de imaginación utópica después de la caída del Muro de Berlín y el desmantelamiento de la URSS, hoy caminamos sobre las ruinas ecosociales que ha dejado aquel corto siglo XX, relacionándonos de una manera inevitablemente ambivalente con sus instituciones heredadas. Agrietadas por una profunda crisis de representación, consecuencia de haber sido el instrumento de varias décadas de desposesión de las mayorías sociales, estas instituciones tienen que ser recuperadas como una barricada democrática contra el ascenso de las diferentes versiones de la nueva extrema derecha y un instrumento redistributivo frente al fascismo de los mercados financieros.

 

Este seminario plantea una constelación de conceptos, retomando tanto algunas antiguas palabras clave como componentes sofocados o no hegemónicos de la tradición comunista, e intentando sumar, tentativamente, algunas nuevas nociones comunes: Comunismo, Estado, Partido, Materialismo, Guerra, Deuda, Expresividad, Deseo, Crisis, Trabajo, Constitución / Procesos constituyentes, Redistribución, Bienes comunes. Resulta imposible construir algo así como un sistemático diccionario en vivo; pero quizá este conjunto incompleto de definiciones de viva voz sirva como modelo para un tipo de reflexión sobre la herencia y el futuro de las luchas «comunistas» por la emancipación y la redistribución que debe ser continuada. 



Dirigido por Marcelo Expósito y Jaime Vindel. Con la participación de Athena Athanasiou, Franco Berardi –Bifo-, Jodi Dean, Nancy Fraser, Anselm Jappe, Maurizio Lazzarato, Gerardo Pisarello, César Rendueles y María Eugenia Rodríguez Palop, entre otros.",2,03 mar. 2018,,,http://www.macba.cat/es/vientos-del-este--comunismos-futuros/1//activ,null,null,null,null,/es/vientos-del-este--comunismos-futuros/1//activ
1513978302-89,http://www.macba.cat/es/actividades,"Ecologías mutantes en el arte contemporáneo: materia, ética y subjectividad",II Simposio Internacional,/uploads/20171215/Screen_Shot_2017_11_12_at_20.39.38.2.png,"¿Qué papel puede jugar la filosofía ante los desafíos desencadenados por el cambio climático, el agotamiento de los recursos naturales y las diversas crisis políticas y culturales que nuestras sociedades encaran en el siglo XXI? ¿De qué forma se puede pensar el arte, los devenires culturales y la práctica institucional en términos de sostenibilidad medioambiental en la era posnatural y poshumana, tecnológicamente mediada del Antropoceno? El Simposio ahondará en el valor y la operatividad de las aportaciones de la tradición filosófica del materialismo vitalista como modelo de ecología política no dualista para imaginar formas alternativas de relación y acción política. Este modelo nutre de forma creciente la imaginación artística actual con propuestas que ofrecen nuevas maneras de entender, interrogar y transformar nuestra relación con el planeta mediante estrategias visuales, discursivas y sensuales, experimentando más allá de confinamientos disciplinares y generando una nueva ética y política poshumana. 



Conferencia inaugural a cargo de Anne Sauvagnargues, Dra. en Filosofía y Estética en la Université Paris Ouest-Nanterre La Defénse. 



Simposio organizado por el Grupo de investigación AGI (Art, Globalization, Inteculturality) de la Universidad de Barcelona. Coordinado y moderado por Christian Alonso",21 feb. 2018,null,Auditori Meier,,http://www.macba.cat/es/ecologias-mutantes-arte-contemporaneo-materia-etica-subjectividad-simposio/1//activ,null,null,null,null,/es/ecologias-mutantes-arte-contemporaneo-materia-etica-subjectividad-simposio/1//activ
