event_category,event_title1,event_title2,event_image-src,event_text,event_start,event_end,event_venue,event_link,event_link-href,event_organizer
Exposición,Pasado inquieto,"Narrativas y fantasmas de la Exposición internacional de arte en solidaridad con Palestina, 1978",http://www.macba.cat/uploads/20141030/Invite.5.1.jpg,"La historia del arte contemporáneo no puede escribirse solo a través del análisis de obras de arte. Una disciplina historiográfica esencial para ello se dirige a investigar y narrar cómo las obras de arte han sido llevadas al ámbito del espacio público para su recepción. La historia de las exposiciones nos permite aprehender el lugar que la producción artística de nuestro tiempo concede al arte dentro del conjunto más amplio de condiciones políticas, mediáticas, económicas y culturales, esto es, cómo se construyen y se comparten los valores que el arte aporta a la vida. 



Más allá de las exposiciones más famosas, realizadas en los grandes museos de las capitales occidentales, la segunda mitad del siglo pasado vio florecer exposiciones de gran significado y relevancia que se realizaron fuera de los marcos institucionales o museísticos. La intención de crear nuevas formas de institucionalidad llevó, en muchos casos, al olvido y la destrucción física o mnemónica de esas iniciativas. Este es un intento de iniciar la lectura de otra historia del arte que reúne los anhelos y esperanzas de muchos, desde un pasado reciente que no debe permanecer fuera de las narraciones históricas del arte.



La Exposición internacional de arte en solidaridad con Palestina se inauguró en Beirut (Líbano) en marzo de 1978, con la voluntad de constituir la semilla de la colección de un museo en el exilio. Inspirado en el Museo de la Resistencia en el Exilio en Solidaridad con Salvador Allende, el museo adoptó la forma de una exposición itinerante con la misión de recorrer el mundo hasta poder ser «repatriado» a Palestina. Organizada por la OLP (Organización para la Liberación de Palestina) y formada por unas 200 obras donadas por artistas de 30 países, la exposición sigue siendo una de las más ambiciosas, por su escala y alcance, que se han podido ver hasta hoy en el mundo árabe. Trágicamente, durante el asedio de Beirut por parte del ejército israelí en 1982, los continuos bombardeos destruyeron el edificio donde se conservaban las obras, así como los archivos y los registros documentales de la exposición.



La investigación para reconstruir la narrativa y los rastros de esta exposición se inició a partir de una edición del catálogo, en el que consta una lista de los artistas participantes y de las personas e instituciones que la hicieron posible. Pasado inquieto: narrativas y fantasmas. Presentación de la investigación sobre la Exposición internacional de arte en solidaridad con Palestina es un proyecto sobre esta investigación, que repasa el compromiso político y artístico de la izquierda antiimperialista internacional durante los años setenta, revelando las extraordinarias redes de personas y prácticas subyacentes.



Representando los múltiples temas e interrogaciones que han guiado esta investigación, Pasado inquieto entrelaza las historias olvidadas y resigue las cartografías perdidas a partir de testimonios y archivos privados. La exposición explora iniciativas previas como la I Bienal de Arte Árabe en Bagdad (1974), la II Bienal de Arte Árabe en Rabat (1976), el I Festival de Assila (1976) y la Bienal de Venecia de 1976, por citar solo algunos ejemplos. Asimismo, vuelve a dibujar la complicada malla de redes de afiliación y solidaridad que unió a artistas comprometidos de todo el mundo en el contexto de la Guerra Fría. Por otro lado, recupera la historia de otras iniciativas museográficas parecidas, centradas en la apasionada defensa de causas que afloraron en el mismo terreno, como la lucha contra la dictadura de Pinochet en Chile o el apartheid en Sudáfrica. 



Pasado inquieto cuestiona la historia de las exposiciones y la historiografía de la práctica y la percepción artísticas, además de plantear la problemática de la historia oral, las trampas de la memoria y la historia escrita frente a la inexistencia de archivos sólidos y convincentes. Y por último pero no menos importante, también revisa la trascendencia del compromiso político en la década de los setenta, especialmente en universos no considerados vanguardistas ni mayoritarios, y por lo tanto raramente estudiados en las narrativas históricas contemporáneas.



Comisarias: Rasha Salti y Kristine Khouri",20 feb.,01 jun. 2015,MACBA,,http://www.macba.cat/es/expo-pasado-inquieto/1/exposiciones/expo,MACBA: Museu d'Art Contemporani de Barcelona
Exposición,Car je est un autre. Pep Dardanyà,El gran vidrio,http://www.macba.cat/uploads/20150116/Foto_16_1_15_8_00_08.0.29.jpg,"Específicamente concebida para el espacio de El Gran Vidrio, esta propuesta de Pep Dardanyà (Caldes d’Estrac, 1961) toma su título de la frase del poeta Arthur Rimbaud, «Yo es otro», y se construye como un proceso de apropiación de textos, imágenes, discursos e identidades. 



Cuatro fotografías retro iluminadas de grandes dimensiones se incrustan en las blancas estructuras de aluminio y vidrio que separan el interior del exterior del MACBA. Son imágenes de cuatro de los muchos bustos antropológicos que el escultor y etnólogo Eudald Serra i Güell modeló durante sus viajes alrededor del mundo, a la búsqueda de objetos para la colección del Museu Etnològic de Barcelona.



A estas fotografías se les han incorporado, como si fuesen escarificaciones o tatuajes, marcas de campañas promocionales de eventos organizados en la ciudad de Barcelona durante el cambio de siglo, y también pequeños «tropos» que sugieren los conflictos implícitos en la idea de sociedad multicultural. Unos textos, en forma de ficha técnica, nos explican quiénes eran estas personas y cómo han llegado hasta aquí. Al mismo tiempo, un código QR nos permite interactuar con nuestro teléfono móvil, tableta u ordenador y acceder al perfil virtual de cada una de ellas, donde no sólo reconstruyen su identidad, sino que recobran la voz crítica.



La publicación de documentos, imágenes y vídeos apropiados de otras plataformas digitales complementa y a la vez tergiversa, con discursos antagónicos, los significados aparentes. El conjunto de materiales interrelacionados genera «cortocircuitos» de mensajes. Car je est un autre nos interpela y nos cuestiona sobre las frágiles fronteras entre lo real y lo imaginado, entre lo subjetivo y lo objetivo, entre el ciudadano y el consumidor. Así, nos propone reflexiones sobre los dilemas que tienen lugar en la construcción de una hipotética identidad colectiva y los conflictos implícitos que ello conlleva. Finalmente nos sugiere algunas de las paradojas a las que se enfrenta el artista visual en el intento por representarla.



“En Barcelona, las cuestiones referentes a la construcción de la ciudad culturalmente diversa han tenido mucha presencia, sobre todo en los discursos institucionales de los últimos años. No podía ser de otro modo, dada su importancia, pero sin embargo ha sido un «tema» poco tratado por los museos y otros centros culturales. Paradójicamente, un nuevo proyecto llamado Museu de Cultures del Món de Barcelona tiene prevista su inauguración en la primavera de 2015. La controversia generada por este nuevo museo es un buen ejemplo de hasta dónde ha llegado el conflicto de intereses de las distintas administraciones respecto a la representación de esta nueva realidad y los dilemas sobre la identidad nacional que implica. Una de las colecciones que deben trasladarse al nuevo museo es la de los bustos antropológicos de Eudald Serra, actualmente en el Museu Etnològic de Barcelona, que el escultor realizó entre 1937 y 1979 en varios lugares del mundo. Un total de 53 esculturas modeladas en barro in situ, moldeadas en yeso y posteriormente producidas en la materia definitiva en Barcelona. La colección se ha convertido en un «muestrario» de muchas de las comunidades que actualmente conviven en el barrio del Raval”.



Pep Dardanyà 



Extracto de la conversación con Valentín Roma a propósito de Car je est un autre, titulada “Hacia un uso del desbordamiento”, que se publica en forma de póster y que puede descargarse aquí mismo.



Con la colaboración del Museu Etnològic de Barcelona.",15 ene.,24 mayo 2015,MACBA,,http://www.macba.cat/es/expo-pep-dardanya/1/exposiciones/expo,MACBA: Museu d'Art Contemporani de Barcelona
Exposición,Sergi Aguilar,Reverso y anverso (1972-2015),http://www.macba.cat/uploads/20150209/05.4.jpg,"La trayectoria de Sergi Aguilar (Barcelona, 1946) cuestiona algunos de los principales paradigmas que, en el contexto español, han venido narrando el lenguaje de la escultura desde principios de los setenta hasta la actualidad. Al mismo tiempo, vista en perspectiva, su obra relativiza la vigencia que tienen hoy algunas interpretaciones de corte formalista. Esta posición incómoda con el relato historiográfico y con sus códigos de lectura, con las genealogías generales y con ciertos análisis específicos, no solo afecta al escultor barcelonés, sino a toda una generación de artistas cuyo trabajo evolucionó desbordando aquellas adscripciones que un día los identificaron.



Sergi Aguilar. Reverso y anverso (1972-2015) es una exposición que recorre, como una suerte de travesía sinuosa, los más de cuarenta años de práctica escultórica de Aguilar, compilando sus investigaciones entre objeto y proceso, sus piezas de hierro y sus herramientas, sus experimentos con las nociones de escala y acumulación, sus homenajes a Blinky Palermo o Giovanni Anselmo, así como los conjuntos de dibujos, fotografías y secuencias audiovisuales desarrolladas durante toda su andadura. 



La muestra se articula a partir de cuatro episodios que invitan al diálogo entre obras y ciclos temáticos de distintas épocas. La idea de continuidad –opuesta a los tradicionales conceptos de inicio, evolución y corolario– preside esta puesta en valor museográfica, donde el artista ha tratado de «desnudar» la arquitectura del edificio del MACBA, recreando para ello las lógicas y la atmósfera de su propio espacio de trabajo.

 

Paralelamente a la exposición se publica un libro que reúne numerosas piezas significativas realizadas entre 1972 y 2015, acompañadas de un texto escrito ex profeso por el escultor donde este recapitula, a modo de dietario o cuaderno de viaje, sobre aquellas cuestiones que han orientado su trayectoria. 



Comisario: Valentín Roma

Producción: Museu d'Art Contemporani de Barcelona",null,null,MACBA,,http://www.macba.cat/es/expo-sergi-aguilar/1/exposiciones/expo,MACBA: Museu d'Art Contemporani de Barcelona
Exposición,La bestia y el soberano,,http://www.macba.cat/uploads/20150319/La_bestia_i_el_sobira.2.4.png,"Esta exposición explora cómo las prácticas artísticas contemporáneas cuestionan y deshacen la definición occidental y metafísica de la soberanía política: el modo en que estas proponen maneras de entender la libertad y la emancipación que exceden el marco de la autonomía individual, así como la forma moderna del Estado-nación.



La exposición toma el título del último seminario impartido por Jacques Derrida en 2002-2003, dedicado a analizar los límites de la soberanía política en la tradición metafísica. La bestia y el soberano encarnan, para el filósofo francés, las dos figuras alegóricas de lo político que se han situado históricamente más allá de la ley: la bestia supuestamente desconocedora del derecho y el soberano cuyo poder se define precisamente por su capacidad de suspender el derecho. Esta división ontoteológica produce una serie de oposiciones binarias de género, clase, especie, sexualidad, raza o discapacidad que estructuran relaciones de dominación. Por un lado, la bestia entendida como animalidad, naturaleza, feminidad, el sur, el esclavo, el sitio colonial, el sujeto no blanco, lo anormal. Por otro, el soberano que representa lo humano o incluso lo sobrehumano, Dios, el Estado, la masculinidad, el norte, el sujeto blanco y sexualmente normal. ¿Cómo pensar la soberanía más allá del poder? ¿Cómo producir soberanía cuestionando estas relaciones de dominación? 



Con obras de Efrén Álvarez, Ángela Bonadies y Juan José Olavarría, Peggy Buth, Martin Dammann, Ines Doujak y John Barker, Juan Downey, Edgar Endress, Oier Etxeberria, León Ferrari, Eiko Grimberg, Masist Gül (presentado por Banu Cennetoğlu y Philippine Hoegen), Ghasem Hajizadeh, Jan Peter Hammer, Geumhyung Jeong, Glenda León, Julia Montilla, Rabih Mroué, Ocaña, Genesis Breyer P-Orridge, Prabhakar Pachpute, Mary Reid Kelley, Jorge Ribalta, Hans Scheirl, Wu Tsang, Stefanos Tsivopoulos, Yelena Vorobyeva y Victor Vorobyev, Sergio Zevallos.



Comisarios: Hans D. Christ, Iris Dressler, Paul B. Preciado y Valentín Roma.

Exposición organizada y coproducida por el Museu d’Art Contemporani de Barcelona (MACBA) y el Württembergischer Kunstverein (WKV)  Stuttgart.",19 mar.,30 ago. 2015,MACBA,,http://www.macba.cat/es/expo-bestia-soberano/1/exposiciones/expo,MACBA: Museu d'Art Contemporani de Barcelona
