http://www.artssantamonica.cat/EXP/EXPOSICIONS/tabid/128/language/es-ES/Default.aspx#exposicio137,Disparos en medio del concierto - Cristina Lucas · All about color,"<p><img src='http://www.artssantamonica.cat/Portals/1/images/activitats/2015/act_trets5.jpg' width='228' height='182' alt='Disparos en medio del concierto - Cristina Lucas · All about color' /></p><p>All about color («Todo sobre el color») es una propuesta de Cristina Lucas que pone el centro en la pluralidad como condición política y confronta las representaciones pretendidamente objetivas que suponen la historia y la cartografía oficiales con las apropiaciones e interpretaciones subjetivas e ilimitadas que de ellas se pueden hacer.

  

 El título de la muestra, como el de la instalación que la preside –Pantone -500   2007– alude a la utilización simbólica del color en el marco del código cartográfico que delimita la distribución geopolítica de los territorios, y también en relación con el sistema de banderas que propicia la identificación colectiva de los ciudadanos. El espacio expositivo está habitado por una serie de individuos que, con sus cuerpos y voces, construyen narraciones con las que exploran los fundamentos de los conceptos de estado y nación, las fronteras que señalan sus límites y las banderas con las que se distinguen. Plenamente insertos en la cultura del tiempo y el espacio que les son propios, todos ellos, y ahora también el espectador, interpretan la historia desde las respectivas cosmovisiones. Así, se produce una fusión de horizontes, en términos de Hans-Georg Gadamer, entendida como la manera de aproximarse a los conocimientos y aprehenderlos a partir de unos bagajes culturales, sociales, económicos e históricos determinados.

 

  



 microRavals

 Desde microRavals, en relación con la muestra «All about color» de Cristina Lucas, tomamos como punto de partida la Declaración de Friburgo sobre los derechos culturales. El texto lo presentó en 2007 el Observatorio de la Diversidad y los Derechos Culturales, junto con la Organización Internacional de la Francofonía y la UNESCO, y contó con el apoyo de más de cincuenta expertos en derechos humanos y de una plataforma de ONG. A partir de algunos artículos que conforman la Declaración de Friburgo, microRavals trabaja con diversas comunidades culturales que conviven alrededor del Arts Santa Mònica y que no tienen visibilidad ni representación en los canales habituales hegemónicos. En este sentido, destacamos dos cuestiones que el documento plantea: el derecho a poder ser un productor cultural y no solo un consumidor, y el hecho de equiparar la cultura popular y la cultura de la excelencia</p><p><a href='http://www.artssantamonica.cat/EXP/EXPOSICIONS/tabid/128/language/es-ES/Default.aspx#exposicio137' target='_blank'>+info</a></p>",09/22/2008,,"Exposición, Arts Santa Mónica",1,Arts Santa Mónica,Arts Santa Mónica,0
http://www.artssantamonica.cat/EXP/EXPOSICIONS/tabid/128/language/es-ES/Default.aspx#exposicio130,"FIGURES DEL DESDOBLAMENT (FIGURAS DEL DESDOBLAMIENTO) - Títeres, Máquinas e Hilos","<p><img src='http://www.artssantamonica.cat/Portals/1/images/activitats/2015/act_figures.jpg' width='228' height='182' alt='FIGURES DEL DESDOBLAMENT (FIGURAS DEL DESDOBLAMIENTO) - Títeres, Máquinas e Hilos' /></p><p>La exposición está dedicada a la alteridad a través del teatro de títeres, visual y de objetos. 

El títere, como figura que representa anhelos, luchas y realidades interiores del humano, se entiende en sentido muy amplio: desde su representación de perfil realista elaborada en madera hasta los desafíos conceptuales de los robots de materiales sintéticos. 

 «Figuras del desdoblamiento» se inscribe en el marco del festival IF Barcelona - Títeres, Máquinas e Hilos, una operación de gran alcance de periodicidad anual. Este año se sostiene sobre tres bases: la exposición, una programación de espectáculos de autor y dispositivos escénicos para adultos y para todos los públicos, y una línea de investigación y desarrollo.

 La muestra ocupa las dos plantas del Arts Santa Mònica. En la primera planta puede verse «Las 7 puertas de la alteridad», un recorrido temático por siete espacios que forman un itinerario con la idea del desdoblamiento figurativo. En la segunda planta encontramos «La despensa del títere», un despliegue de los diversos ámbitos, técnicas y especificidades del teatro de títeres. 

 Buena parte de las piezas que se exponen provienen de creadores en activo, artistas individuales, compañías y asociaciones. Como patrimonio vivo que son los títeres, otra gran parte de las piezas procede de museos, muy especialmente del MAE del Instituto del Teatro y del TOPIC de Tolosa (Guipúzcoa).</p><p><a href='http://www.artssantamonica.cat/EXP/EXPOSICIONS/tabid/128/language/es-ES/Default.aspx#exposicio130' target='_blank'>+info</a></p>",10/09/2015,01/10/2016,"Exposición, Arts Santa Mónica",1,Arts Santa Mónica,Arts Santa Mónica,0
http://www.artssantamonica.cat/EXP/EXPOSICIONS/tabid/128/language/es-ES/Default.aspx#exposicio129,EN PALABRAS DE - JAIME GIL DE BIEDMA,"<p><img src='http://www.artssantamonica.cat/Portals/1/images/exposicions/2015/exp_biedma.jpg' width='228' height='182' alt='EN PALABRAS DE - JAIME GIL DE BIEDMA' /></p><p>El paso del tiempo era una de las preocupaciones vitales del poeta Jaime Gil de Biedma. Alguna vez comentó que escribía poesía porque no quería morir del todo y hoy,  al cumplirse los 25 años de su muerte, su obra sigue viva.  Es el paso del tiempo lo que pone a prueba la permanencia de una obra literaria. Decía Borges que la gloria de un poeta depende de la excitación o de la apatía de las generaciones de hombres anónimos que la ponen a prueba en la soledad de sus bibliotecas. Gil de Biedma cumple, sin duda, con esta máxima. Por él, como se dice vulgarmente, no pasan los años.



 La exposición En palabras de Jaime Gil de Biedma quiere recuperar toda su grandeza como poeta e intelectual. Oír sus palabras, su poesía, sus pensamientos, todo aquello que le ha convertido en un autor singular, recordado, leído y reinterpretado por varias generaciones. La muestra en formato conversación, otra de las grandes pasiones del poeta, es Gil de Biedma en estado puro.</p><p><a href='http://www.artssantamonica.cat/EXP/EXPOSICIONS/tabid/128/language/es-ES/Default.aspx#exposicio129' target='_blank'>+info</a></p>",09/09/2015,10/25/2015,"Exposición, Arts Santa Mónica",1,Arts Santa Mónica,Arts Santa Mónica,0
http://www.artssantamonica.cat/EXP/EXPOSICIONS/tabid/128/language/es-ES/Default.aspx#exposicio136,Frederic Perers. «Tiempo de acción» - Disparos en medio del concierto,"<p><img src='http://www.artssantamonica.cat/Portals/1/images/exposicions/2015/expo_perers.jpg' width='228' height='182' alt='Frederic Perers. «Tiempo de acción» - Disparos en medio del concierto' /></p><p>Tiempo de acción es una muestra que reúne varios proyectos de Frederic Perers en los que ofrece relecturas de la historia reciente catalana y pone en relación episodios de represión más o menos sutiles por parte del Estado español con sus repercusiones sobre la lengua y el territorio, la memoria nacional y la actualidad.

  

 El artista apela a nuestra conciencia histórica para llamarnos a la acción. Comprometido con la preservación del patrimonio cultural material e inmaterial del país, y con el ejercicio de un activismo de guante blanco, Frederic Perers hace preceder cada uno de sus trabajos de un proceso metódico y riguroso de documentación e investigación históricas con el objetivo de iluminar y significar los conflictos políticos y lingüísticos que, precisamente por su trascendencia en la actualidad, se han mantenido interesadamente en la sombra por parte del poder dominante. Diseña sus proyectos –homenajes pendientes, como él mismo los denomina–, de acuerdo con una formalización que le permita conseguir una perfecta integración en el paisaje, rural o urbano, que interviene y, al mismo tiempo, le garantice una visibilidad suficiente para tener impacto en los que lo habitan, ya que su finalidad última es sacudir la memoria colectiva, aquella que Maurice Halbwachs define como el pensamiento continuo que retiene del pasado lo que todavía está vivo en el presente, o lo que es capaz de vivir en la conciencia del grupo que la mantiene. 





Libreto</p><p><a href='http://www.artssantamonica.cat/EXP/EXPOSICIONS/tabid/128/language/es-ES/Default.aspx#exposicio136' target='_blank'>+info</a></p>",07/15/2015,09/13/2015,"Exposición, Arts Santa Mónica",1,Arts Santa Mónica,Arts Santa Mónica,0
