"EVENT NAME","VENUE NAME","ORGANIZER NAME","START DATE","START TIME","END DATE","END TIME","ALL DAY EVENT?","CATEGORIES","EVENT COST","EVENT WEBSITE","SHOW MAP LINK?","SHOW MAP?","EVENT DESCRIPTION","EVENT IMAGE"
"Cose ritrovate - Paolo Simonazzi - Art Opening","CAGE","CAGE","07/20/2018","","07/20/2018","",1,"","","https://www.facebook.com/events/270602677036297/",1,1,"<p><img src='http://scontent-mad1-1.xx.fbcdn.net/v/t1.0-0/q87/s526x296/36279822_1919261241458163_7807908862299734016_n.jpg?_nc_cat=0&oh=8448a27057788c727d31271da86f9517&oe=5BA34EC1' width='228' height='182' alt='Cose ritrovate - Paolo Simonazzi - Art Opening' />The Italian Institute of Culture in Barcelona invites us to the art exhibition opening ""Cose Ritrovate"" by Paolo Simonazzi. We wish you can join us to celebrate the photo exhibition inauguration of this consecrated artist.</p>","https://scontent-mad1-1.xx.fbcdn.net/v/t1.0-0/q87/s526x296/36279822_1919261241458163_7807908862299734016_n.jpg?_nc_cat=0&oh=8448a27057788c727d31271da86f9517&oe=5BA34EC1"
"Inauguración de la nueva expo de Emily Eldridge","null","Hotel Brummell","07/17/2018","","07/17/2018","",1,"","","https://www.facebook.com/events/452035611926439/",1,1,"<p><img src='http://scontent-mad1-1.xx.fbcdn.net/v/t1.0-0/s526x296/36678569_1113521838802224_3015904672083869696_n.jpg?_nc_cat=0&oh=5fda3c52ae8829982e9637858150e23b&oe=5BD82A1E' width='228' height='182' alt='Inauguración de la nueva expo de Emily Eldridge' />El Hotel Brummell y la galería Miscelanea Bcn se unen para una nueva serie de exposiciones de arte. Cada tres meses mostrarán nuevas propuestas creativas y expresiones artísticas contemporáneas en la ciudad condal.<br /><br />El próximo martes 17 de julio durante las Fiestas de Poble Sec, presentarán “Gloomy Girls” una serie de pinturas de la artista americana Emily Eldridge que exploran el concepto de la melancolía con un toque de humor. Cómo cuándo no--puedes-parar-de-escuchar-tu-canción-favorita-de-pop-triste.<br /><br />Mujeres tristes que se sienten melancólicas por mensajes sin contestar, relaciones falladas y rupturas amorosas, junto con flores marchitas, plantas de interior moribundas y ramos de flores destinados a la basura. Pintada en tonos brillantes eléctricos, la serie yuxtapone una paleta de colores brillantes con temas tristes, jugando con la idea de la ""fiesta de la lástima"" como una derrota auto-indulgente (incluso divertida).<br /><br />Durante la inauguración, la artista pintará un gran mural en el escaparate del hotel, DJ RadioBorneo vendrá a pinchar su selección de canciones tropicales y los asistentes podrán degustar cervezas de Moritz y tés helados de Kailani Ice Tea.<br /><br />La obras estarán en venta esa noche y durante toda la exposición.<br /><br />REGÍSTRATE AQUÍ PARA DISFRUTAR DE 1 BEBIDA GRATIS: bit.ly/expoemilyeldridgefreedrink<br /><br />Entrada libre con aforo limitado.<br /><br />emilyeldridge.com<br />miscelanea.info<br />hotelbrummell.com<br /><br />—<br /><br />1982, EEUU<br /><br />Graduada con un BFA en Ilustración del Savannah College of Art & Design (SCAD), y más recientemente realizó un Máster en Ilustración Creativa en el Centro de Diseño de la Universidad BAU en Barcelona, España. <br /><br />Con base en Hong Kong desde hace más de 10 años, actualmente reside en Barcelona, donde practica español y disfruta de una copa (o dos) de vermut con amigos.<br /><br />Su trabajo ilustrativo y de pintura abarca una variedad de medios creativos, desde murales hasta street art, ilustración editorial, merchandising, escenografía y más. Inspirada en diseños de superficies vintage, revistas de moda para adolescentes, ilustración contemporánea, feminismo y cultura pop asiática, Emily tiene como objetivo crear imágenes llamativas y visualmente audaces con un elemento de humor e ingenio.<br /><br />Entre sus clientes recientes se incluyen Lane Crawford (Hong Kong), Adidas NEO, Custo Barcelona y GU Global / Uniqlo. <br /><br />Su trabajo ha sido mostrado en exposiciones colectivas e individuales en Hong Kong, Japón, Estados Unidos, Alemania, España y China.</p>","https://scontent-mad1-1.xx.fbcdn.net/v/t1.0-0/s526x296/36678569_1113521838802224_3015904672083869696_n.jpg?_nc_cat=0&oh=5fda3c52ae8829982e9637858150e23b&oe=5BD82A1E"
"Dinosaurios, bosque de niebla de Ana Maria Londoño","Espai Souvenir","Verdandi Studio","07/19/2018","","07/19/2018","",1,"","","https://www.facebook.com/events/1550793045228260/",1,1,"<p><img src='http://scontent-mad1-1.xx.fbcdn.net/v/t1.0-0/q86/p235x350/36844798_265731820849675_1502359807586205696_n.jpg?_nc_cat=0&oh=349ea8cd3dcfbad2b742ec3595229d19&oe=5BD74B29' width='228' height='182' alt='Dinosaurios, bosque de niebla de Ana Maria Londoño' />Dinosaurios: bosque de niebla de Ana Maria Londoño<br /><br />Durante cuatro años me dediqué a visitar una reserva ecológica en Colombia. Viajé allí con una  antropóloga con quién escribí el guión para una película y con quien buscaba una locación para este proyecto. Durante estos viajes a través de la naturaleza conocimos mucho de la historia de Colombia, pues al visitar estas tierras surgen muchas preguntas y respuestas sobre la conquista de América, sobre la colonización y sus herencias en nuestro país, sobre la conservación de la naturaleza en América Latina y sobre los efectos del cambio climático en nuestra naturaleza, causado, sobre todo, por la producción de las grandes industrias en el primer mundo.<br /><br />El bosque que visite durante años es un medio mas en la cadena de producción de agua: los llamados “bosques de niebla”. Los personas que encontré y los lugares que visité  en lo que sería la preparación de la película termino siento el aprendizaje sobre la naturaleza de America, el descubrimiento se su historia y la conciencia de su devastación por el cambio climático. Ahora el guion está finalizado y en el vive el espíritu de del bosque, la idea de la naturaleza Americana como se tratara de un dinosaurio en extinción.<br /><br /><br />En “Dinosaurios: bosque de niebla” presento las fotos originales y los textos que recopilé durante los  años de investigación en la reserva.</p>","https://scontent-mad1-1.xx.fbcdn.net/v/t1.0-0/q86/p235x350/36844798_265731820849675_1502359807586205696_n.jpg?_nc_cat=0&oh=349ea8cd3dcfbad2b742ec3595229d19&oe=5BD74B29"
"Taller de pasteUp por Secle","null","Secle Style","07/20/2018","","07/20/2018","",1,"","","https://www.facebook.com/events/1716627205101267/",1,1,"<p><img src='http://scontent-mad1-1.xx.fbcdn.net/v/t1.0-0/p235x350/36919073_1636228449821881_3395202137460834304_n.jpg?_nc_cat=0&oh=4aa3b6393f02ac168092952a471bf9d1&oe=5BE67790' width='228' height='182' alt='Taller de pasteUp por Secle' />Si eres amante del streetart, si ya tienes tu alterego, si no lo tienes y lo quieres crear este es tu curso.<br /><br />Se explicarán todos los secretos para crear un Paste-up de autor, una pieza única que os podréis llevar con vosotros al terminar el curso y también cómo hacer los diferentes tipos de cola que sirven para pegar en pared u otros soportes.<br /><br /> El taller será impartido por Secle, ilustradora y  streetartist italiana residente en Barcelona que ha echo de la tecnica del paste-up su sello de reconocimiento.<br /><br />¿Cuantos seremos? min 1max 6 personas<br /><br />precio:55 euro  (material incluido) 5 euro de descuento si vienes con un amigo o has participado a otro taller impartido por mi en el 2018.</p>","https://scontent-mad1-1.xx.fbcdn.net/v/t1.0-0/p235x350/36919073_1636228449821881_3395202137460834304_n.jpg?_nc_cat=0&oh=4aa3b6393f02ac168092952a471bf9d1&oe=5BE67790"
"SUMA","Espronceda","Espronceda","07/17/2018","","07/21/2018","",1,"","","https://www.facebook.com/events/625019684542097/",1,1,"<p><img src='http://scontent-mad1-1.xx.fbcdn.net/v/t1.0-0/s526x296/36901628_1062225143936628_5495394119607910400_n.jpg?_nc_cat=0&oh=121c4b8accaf97486faeca85091ac9d5&oe=5BE44F96' width='228' height='182' alt='SUMA' />***CAST- CAT VERSIONS BELOW***<br /><br />SUMA is collaborative project by American sculptor Mia Pearlman and her husband, Catalan jazz pianist Albert Marquès. SUMA, or ""sum"" in English, means both the aggregate of two or more quantities, and the substantive meaning of a matter. As a title, it refers to the way every culture and landscape contains the entire complex history of how it came to be: all of the peoples and cultures who lived there, their stories, identities, political systems, art forms, languages, religions, built structures and use of the earth. There are no pure cultures, lands or peoples: we are all the product of countless ingredients, often forgotten by history.<br /><br />Mia Pearlman created a new site specific installation using cut paper pieces that contain reimagined Islamic, Japanese, and other patterns, as well as hand cut and painted paper, plastic garbage bags, found objects and incandescent lights. This installation will hang from the ceiling beams in the main gallery space and trail out onto the floor.<br /><br />Albert Marquès created a series of discussions and concerts with musicians from Barcelona and New York City to explore new ideas in improvised music and whether music is influenced by one's cultural identity. When three jazz drummers, an Afro-Catalan, a Spanish Jew and an Afro-Latino New Yorker get together, do they see percussion differently? Does it affect their playing? What does it mean to play this music today for musicians of different backgrounds? The concerts and discussions will be experiments in what this music can be and what it becomes when inspired by Mia's site specific installation.<br /><br />***CASTELLANO<br />SUMA es un proyecto colaborativo entre la escultora estadounidense Mia Pearlman y su marido, el pianista catalán Albert Marquès. SUMA, o ""sum"" en inglés, quiere decir simultáneamente agregar dos o más cantidades, y también quiere decir tema o asunto. Como título de la pieza se refiere a la manera como cada cultura y paisaje contiene toda la complejidad e historia de donde ha salido. Toda la gente y culturas que han vivido en un sitio concreto tienen sus historias, identidades, sistemas políticos, formas artísticas, lenguas, religiones, estructuras de los edificios, tierra... No hay culturas puras, tierras puras o gente pura. Todos somos el producto de innumerables ingredientes a menudo olvidados en nuestra propia historia.<br /><br />Mia Pearlman creó una instalación improvisada para Espronceda utilizando trozos de papel cortados que contienen patrones de origen islámico y japonés. También contienen papel pintado y cortado a mano, bolsas de plástico, objetos reciclados e iluminación.<br /><br />Albert Marquès ha creado tres charlas y conciertos de música improvisada que sucederán debajo de la escultura con músicos de Barcelona y Nueva York. Los músicos exploraran nuevas ideas y se preguntaran si su identidad cultural ha influenciado su música. Cuando tres baterías de jazz: un Afro-catalán, un judío español y un Afro-latino de Nueva York tocan juntos, ¿ven la percusión de forma diferente? Los conciertos y las charlas serán experimentos sobre qué puede ser la música y en qué se transforma cuando esta inspirada por una escultura.<br /><br />***CATALÀ<br />SUMA és un projecte col·laboratiu de l'escultora nord-americana Mia Pearlman amb el seu marit, el pianista català Albert Marquès. SUMA, o ""sum"" en anglès, vol dir simultàniament agregar dues o més quantitats, i també vol dir tema o assumpte. Com a títol de l'obra es refereix a la manera com cada cultura i paisatge conté tota la complexitat i història d'on ha sorgit. Tota la gent i cultures que han viscut en un lloc, les seves històries, identitats, sistemes polítics, formes artístiques, llengües, religions, estructures dels edificis i terra. No hi ha cultures pures, terres pures o gent pura. Tots som el producte d'innumerables ingredients sovint oblidats en la nostra pròpia història.<br /><br />Mia Pearlman ha creat una instal·lació improvisada per Espronceda utilitzant trossos de paper tallat que contenen sanefes d'origen islàmic i japonès. També contenen paper pintat prèviament i tallat a mà, bosses de plàstic, objectes reciclats i il·luminació.<br /><br />Albert Marquès ha creat tres xerrades i concerts de música improvisada que succeiran davant l'escultura amb músics de Barcelona i Nova York. Els músics exploraran noves idees i es preguntaran si la seva identitat cultural influencia la seva música. Quan tres bateries de jazz: un Afro-català, un Afro-latino de Nova York i un jueu català toquen junts, veuen la percussió de forma diferent? Efecte la seva manera de tocar? Què vol dir tocar jazz per músics amb experiències tan diferents? Els concerts i les xerrades seran experiments on sobre que pot ser la música i en què es transforma quan està inspirada per una escultura.</p>","https://scontent-mad1-1.xx.fbcdn.net/v/t1.0-0/s526x296/36901628_1062225143936628_5495394119607910400_n.jpg?_nc_cat=0&oh=121c4b8accaf97486faeca85091ac9d5&oe=5BE44F96"
"Visita guiada a l'exposició ""Poupées"" amb Neus Solà","Centre Cívic Can Basté","Espai Fotografic Can Basté","07/21/2018","","07/21/2018","",1,"","","https://www.facebook.com/events/1017983781691745/",1,1,"<p><img src='http://scontent-mad1-1.xx.fbcdn.net/v/t1.0-0/p235x350/37076076_1449365901830618_3386658691594846208_n.jpg?_nc_cat=0&oh=3926a832f895b4fa143fa37d8d7697c5&oe=5BE1F400' width='228' height='182' alt='Visita guiada a l'exposició ""Poupées"" amb Neus Solà' />Visita guiada a l'exposició ""Poupées"" amb Neus Solà, dissabte 21 de juliol a les 12 h. <br />Si et vas perdre la inauguració, agenda't aquesta data!!!<br /><br />L'autora ens explicarà de primera mà el projecte fotogràfic i expositiu de ""Poupées"", unes imatges que ens traslladen a la infantesa de les nenes gitanes al suburbi de La Cité a Perpignan. Un món hermètic subjecte a les friccions culturals entre tradició i modernitat, control patriarcal i llibertat individual.<br /><br />""Poupées"" va rebre una Menció especial al 14è Fòrum Fotográfic Can Basté.<br /><br />Aquesta exposició es podrà visitar fins el 8 de setembre de 2018 // a la SALA CAVA del Centre Cívic Can Basté.<br /><br />canbaste.com<br />neussola.com<br /><br />#noubarris  Nou Barris  Centres Cívics de Barcelona  #fotografia  #photobcn  #fotobcn  #fòrumfotogràfic  #barcelona  #fotografiadocumental  #beca  #exposició  #salacava</p>","https://scontent-mad1-1.xx.fbcdn.net/v/t1.0-0/p235x350/37076076_1449365901830618_3386658691594846208_n.jpg?_nc_cat=0&oh=3926a832f895b4fa143fa37d8d7697c5&oe=5BE1F400"
"Inauguración ""Future Relics"" de Elena Lavellés","Blueproject Foundation","Blueproject Foundation","07/13/2018","","07/13/2018","",1,"","","https://www.facebook.com/events/403735813466426/",1,1,"<p><img src='http://scontent-mad1-1.xx.fbcdn.net/v/t1.0-0/p280x280/36854806_2161951280691133_8935291512112021504_n.jpg?_nc_cat=0&oh=e5695fff330a4d2ac45aefd5596d5a06&oe=5BA024A4' width='228' height='182' alt='Inauguración ""Future Relics"" de Elena Lavellés' />[ESP]<br /><br />La Blueproject Foundation presenta la exposición ""Future Relics"" de Elena Lavellés, la tercera artista residente de 2018, que se podrá ver en la Sala Project del 13 de julio al 30 de septiembre de 2018. <br /><br />""Para este nuevo cuerpo de trabajo Elena Lavellés continúa su anterior investigación en torno a las tres formas de oro (mineral, hidrocarburo y metal precioso) para desarrollar un discurso que desvela las interacciones entre procesos de transformación, las historias locales y las relaciones de poder del imperialismo corporativo.<br /><br />En esta ocasión, el discurso juega con una suerte de realismo especulativo donde subyace una lectura en clave biopolítica que revela cómo la explotación del territorio va unida a la explotación de la cultura. [...]<br /><br />A partir de aquí se despliegan todas las obras agrupadas en torno a tres bloques principales: una serie de esculturas-reliquia, un conjunto de dibujos intervenidos sobre mapas topográficos, y una selección de fotografías. La artista nos invita a re-imaginar entre dos aguas, la del territorio imaginado y el real. La de la utopía y la distopía, una aproximación que lleva implícita la resistencia social y alternativas a los procesos establecidos y dominantes en la actualidad.""<br />Texto de Blanca de la Torre<br /><br />[CAT]<br /><br />La Blueproject Foundation presenta l’exposició “Future Relics” d’Elena Lavellés, la tercera artista resident de 2018, que es podrà veure a la Sala Project del 13 de juliol al 30 de setembre de 2018. <br /><br />Per a aquest nou cos de treball, Elena Lavellés continua la seva anterior investigació al voltant de les tres formes d'or (mineral, hidrocarbur i metall preciós) per desenvolupar un discurs que revela les interaccions entre processos de transformació, les històries locals i les relacions de poder del capitalisme corporatiu.<br /><br />En aquesta ocasió, el discurs juga amb una mena de realisme especulatiu on rau una lectura en clau biopolítica que revela com l'explotació del territori va lligada a l'explotació de la cultura. [...]<br /><br />A partir d'aquí es despleguen totes les obres agrupades al voltant de tres blocs principals: una sèrie d'escultures-relíquia, un conjunt de dibuixos intervinguts sobre mapes topogràfics, i una selecció de fotografies. L'artista ens convida a re-imaginar entre dues aigües, la del territori imaginat i el real. La de la utopia i la distopia, una aproximació que porta implícita la resistència social i les alternatives als processos establerts i dominants en l'actualitat.""<br />Text de Blanca de la Torre<br /><br />[ENG]<br /><br />The Blueproject Foundation presents the exhibition ""Future Relics"" by Elena Lavellés, the third resident artist of 2018, which can be seen at the Sala Project from July 13 to September 30, 2018.<br /><br />In this new body of work, Elena Lavellés continues her previous exploration on the three forms of gold (mineral, hydrocarbon and precious metal) to develop a discourse which reveals the interactions between transformation process, local history and the power relations of corporate capitalism.<br /><br />In this case, the discourse plays with a sort of speculative realism beneath which lies a biopolitic reading which uncovers the connection between the exploitation of the territory and the exploitation of culture. [...]<br /><br />The other works unfolding after this one are grouped in three sections: a series of relic-sculptures, a set of drawings over topographic maps and a selection of photographs. The artist invites us to re-imagine in between two waters, the land of the imaginary and that of the real. The land of utopia and that of dystopia, an approximation which implies social resistance and the alternatives to contemporary established and dominant processes.""<br />Text by Blanca de la Torre</p>","https://scontent-mad1-1.xx.fbcdn.net/v/t1.0-0/p280x280/36854806_2161951280691133_8935291512112021504_n.jpg?_nc_cat=0&oh=e5695fff330a4d2ac45aefd5596d5a06&oe=5BA024A4"