"EVENT NAME","VENUE NAME","ORGANIZER NAME","START DATE","START TIME","END DATE","END TIME","ALL DAY EVENT?","CATEGORIES","EVENT COST","EVENT WEBSITE","SHOW MAP LINK?","SHOW MAP?","EVENT DESCRIPTION","EVENT IMAGE"
"Las grandes civilizaciones de Europa. El siglo XIX, 1: La época romántica - Curso dirigido por Jordi Llovet","CCCB","CCCB","01/03/2006","","","",1,"CCCB, Exposición","6","http://www.cccb.org/es/actividades/ficha/las-grandes-civilizaciones-de-europa-el-siglo-xix-1-la-epoca-romantica/226990",1,1,"<p><img src='http://www.cccb.org/rcs_gene/epoca_romantica_web.png' width='228' height='182' alt='Las grandes civilizaciones de Europa. El siglo XIX, 1: La época romántica - Curso dirigido por Jordi Llovet' />El Institut d’Humanitats de Barcelona ofrece, con el título Las grandes civilizaciones de Europa, una serie de cursos dedicados a las culturas y las civilizaciones de nuestro continente que han sobresalido en notables y diversos aspectos: organización política, religión, cultura literaria, arquitectura y artes plásticas, filosofía e historia de la ciencia.</p>","http://www.cccb.org/rcs_gene/epoca_romantica_web.png"
"Las cubiertas verdes, elementos clave para conseguir una ciudad más verde y sostenible","CCCB","CCCB","02/08/2018","","","",1,"CCCB, Exposición","6","http://www.cccb.org/es/actividades/ficha/las-cubiertas-verdes-elementos-clave-para-conseguir-una-ciudad-mas-verde-y-sostenible/227639",1,1,"<p><img src='http://www.cccb.org/rcs_gene/cobertes-verdes-ok.jpg' width='228' height='182' alt='Las cubiertas verdes, elementos clave para conseguir una ciudad más verde y sostenible' />En este coloquio representantes del Ayuntamiento de Barcelona y de empresas que trabajan en torno a los beneficios de las cubiertas verdes nos hablarán de cómo incrementando el verde en las azoteas podemos mejorar la salud y la calidad de vida de la ciudadanía. Además, esto se convierte en un elemento central de la transformación del espacio público con un fuerte impacto paisajístico.</p>","http://www.cccb.org/rcs_gene/cobertes-verdes-ok.jpg"
"La Grecia antigua en la literatura y el pensamiento de la modernidad - Seminario a cargo de Bashkim Shehu","CCCB","CCCB","01/22/2005","","","",1,"CCCB, Exposición","6","http://www.cccb.org/es/actividades/ficha/la-grecia-antigua-en-la-literatura-y-el-pensamiento-de-la-modernidad/227911",1,1,"<p><img src='http://www.cccb.org/rcs_gene/Antigona_webCCCB.jpg' width='228' height='182' alt='La Grecia antigua en la literatura y el pensamiento de la modernidad - Seminario a cargo de Bashkim Shehu' />Los personajes mitológicos y literarios de la antigüedad griega irrumpen en la modernidad, especialmente en el Romanticismo, pero también en el punto culminante representado por las vanguardias. No obstante, este retorno del mundo griego es muy distinto al que se había producido durante el Renacimiento. Por un lado, el arte se aleja del ideal clásico de la belleza; por el otro, el pensamiento se adentra en los dominios de lo irracional, lo instintivo y lo inconsciente. Por decirlo de acuerdo con Foucault, el otro de la razón accede al ámbito del saber.</p>","http://www.cccb.org/rcs_gene/Antigona_webCCCB.jpg"
"El pensamiento tentacular de Donna Haraway. Una aproximación - Seminario a cargo de Helen Torres","CCCB","CCCB","02/07/2007","","","",1,"CCCB, Exposición","6","http://www.cccb.org/es/actividades/ficha/el-pensamiento-tentacular-de-donna-haraway-una-aproximacion/228017",1,1,"<p><img src='http://www.cccb.org/rcs_gene/Seminari_HelenTorresDonnaHaraway_webCCCB.jpg' width='228' height='182' alt='El pensamiento tentacular de Donna Haraway. Una aproximación - Seminario a cargo de Helen Torres' />En este seminario nos acercaremos al pensamiento imprescindible de la bióloga y filósofa de la ciencia Donna Haraway para explorar su crítica radical al pensamiento científico occidental y al excepcionalismo humano.</p>","http://www.cccb.org/rcs_gene/Seminari_HelenTorresDonnaHaraway_webCCCB.jpg"
"Conversación con George Monbiot - Debate por videoconferencia con Carlos Delclós","CCCB","CCCB","02/05/2018","","","",1,"CCCB, Exposición","6","http://www.cccb.org/es/actividades/ficha/conversacion-con-george-monbiot/228150",1,1,"<p><img src='http://www.cccb.org/rcs_gene/George_Monbiot_1000.jpg' width='228' height='182' alt='Conversación con George Monbiot - Debate por videoconferencia con Carlos Delclós' />George Monbiot, periodista y ensayista especializado en medio ambiente, defensará que es necesario que los ecosistemas dañados sean liberados de la intervención humana para que la flora y la fauna puedan desarrollarse libremente y se recuperen los procesos ecológicos naturales y salvajes, tal y como él mismo ha propuesto en el ensayo Salvaje. Renaturalizar la tierra, el mar y la vida humana (Capitán Swing, 2017).</p>","http://www.cccb.org/rcs_gene/George_Monbiot_1000.jpg"
"Conferencia de Byung-Chul Han - La expulsión de la diferencia y el valor de la hospitalidad","CCCB","CCCB","02/06/2018","","","",1,"CCCB, Exposición","6","http://www.cccb.org/es/actividades/ficha/conferencia-de-byung-chul-han/228169",1,1,"<p><img src='http://www.cccb.org/rcs_gene/BCH_1000.jpg' width='228' height='182' alt='Conferencia de Byung-Chul Han - La expulsión de la diferencia y el valor de la hospitalidad' />El tiempo en que el otro existía ha pasado. El otro como misterio, como amigo, como deseo, como pesadilla se va desvaneciendo, y en su lugar se instala un infierno en el que todo es igual, indiferente. Según el filósofo coreano Byung-Chul Han, ya sea porque nos prestamos una atención excesiva, convertidos en una especie de «emprendedores de nosotros mismos», o porque negamos frontalmente lo que nos es ajeno, esta condición nos condena a la soledad, la depresión y el odio. Sin el acicate de la extrañeza, solo hay acumulación. La única alternativa posible es recuperar la comunicación con el otro, exponerse a su mirada, su voz y su pensamiento, y recordar que ello significa, necesariamente, la interpelación y la respuesta.</p>","http://www.cccb.org/rcs_gene/BCH_1000.jpg"
"Una filosofía de la delicadeza - Seminario a cargo de Xavier Rubert de Ventós","CCCB","CCCB","02/08/2018","","02/15/2018","",1,"CCCB, Exposición","6","http://www.cccb.org/es/actividades/ficha/una-filosofia-de-la-delicadeza/228383",1,1,"<p><img src='http://www.cccb.org/rcs_gene/Seminari-Xavier-Rubert-de-Ventos_webCCCB.jpg' width='228' height='182' alt='Una filosofía de la delicadeza - Seminario a cargo de Xavier Rubert de Ventós' />En este pequeño seminario nos aproximaremos a una filosofía de la delicadeza, a partir de citas como:</p>","http://www.cccb.org/rcs_gene/Seminari-Xavier-Rubert-de-Ventos_webCCCB.jpg"