http://www.barcelonagalleryweekend.com/en/expositions/white-clothes/,Antoni Tàpies - Roba blanca,<p><img src='http://www.artbarcelona.es/bgw/wp-content/uploads/sites/7/2016/04/samarreta-blanca-low.jpg' width='228' height='182' alt='Antoni Tàpies - Roba blanca' />The exhibition proposed by Galeria Toni Tàpies for the Barcelona Gallery Weekend project is titled Roba blanca (White Clothes) which wants to reflect upon the value and meaning of the most intimate objects within Antoni Tàpies work. A...</p><p><a href='http://www.barcelonagalleryweekend.com/en/expositions/white-clothes/' target='_blank'>+info</a></p>,09/29/2016,10/02/2016,"Exposición, Galerías, galleryweekend",Galeria Toni Tàpies,Galeria Toni Tàpies,0,1,1,1,,
http://www.barcelonagalleryweekend.com/en/expositions/pep-agut/,Pep Agut - Penélope,"<p><img src='http://www.artbarcelona.es/bgw/wp-content/uploads/sites/7/2016/04/angels-barcelona-pep_agut_las_horas_de_penelope_2016_detalle.jpg' width='228' height='182' alt='Pep Agut - Penélope' />During 30 years, while Penelope was weaving, Pep Agut worked on generic pliable models and, like Ulyses, travelled the world. The outcome is Penelope’s cloth rather than Pep Agut’s work...</p><p><a href='http://www.barcelonagalleryweekend.com/en/expositions/pep-agut/' target='_blank'>+info</a></p>",09/29/2016,10/02/2016,"Exposición, Galerías, galleryweekend",àngels barcelona,àngels barcelona,0,1,1,1,,
http://www.barcelonagalleryweekend.com/en/expositions/international-art-paper-en/,"Alberto García-Alix, Antoine d'Agata, Bosco Sodi, Cornelia Parker, Javier Pérez, Jordi Colomer, Julio Vaquero, Keith Tyson, Michael Joo, Miguel Ángel Campano, Santi Moix, Sean Scully, Tony Cragg - International Art Paper","<p><img src='http://www.artbarcelona.es/bgw/wp-content/uploads/sites/7/2016/04/Keith-Tyson-low.jpg' width='228' height='182' alt='Alberto García-Alix, Antoine d'Agata, Bosco Sodi, Cornelia Parker, Javier Pérez, Jordi Colomer, Julio Vaquero, Keith Tyson, Michael Joo, Miguel Ángel Campano, Santi Moix, Sean Scully, Tony Cragg - International Art Paper' />Coinciding with the second edition of Barcelona Gallery Weekend, the Galeria Carles Taché is proud to present International Art Paper, where most of the artists represented by the gallery shall exhibit their work as well as some other guest artists...</p><p><a href='http://www.barcelonagalleryweekend.com/en/expositions/international-art-paper-en/' target='_blank'>+info</a></p>",09/29/2016,10/02/2016,"Exposición, Galerías, galleryweekend",Galeria Carles Taché,Galeria Carles Taché,0,1,1,1,,
http://www.barcelonagalleryweekend.com/en/expositions/anthony-goicolea/,Anthony Goicolea - Simulacrum,"<p><img src='http://www.artbarcelona.es/bgw/wp-content/uploads/sites/7/2016/04/Anthony-Goicolea-FINAL-low.jpg' width='228' height='182' alt='Anthony Goicolea - Simulacrum' />Simulacrum is Anthony Goicolea’s second solo exhibition at Galeria Senda. Known for his versatile profile, this artist focuses on a wide spectrum of medium in his creation that range from digitally manipulated landscapes to paintings that reflect beautiful bodylines...</p><p><a href='http://www.barcelonagalleryweekend.com/en/expositions/anthony-goicolea/' target='_blank'>+info</a></p>",09/29/2016,10/02/2016,"Exposición, Galerías, galleryweekend",Galeria Senda,Galeria Senda,0,1,1,1,,
http://www.barcelonagalleryweekend.com/en/expositions/expo-nogueras-blanchard/,Jacopo Miliani - A Slow Dance Without Name,"<p><img src='http://www.artbarcelona.es/bgw/wp-content/uploads/sites/7/2016/04/1-LOW.jpg' width='228' height='182' alt='Jacopo Miliani - A Slow Dance Without Name' />Jacopo Miliani works mostly with photography, installation and performance. These different media have allowed him to develop a research concerning the way the viewer/spectator creates personal images, as well as meaning, through communication and language. The artist's use...</p><p><a href='http://www.barcelonagalleryweekend.com/en/expositions/expo-nogueras-blanchard/' target='_blank'>+info</a></p>",09/29/2016,10/02/2016,"Exposición, Galerías, galleryweekend",Nogueras Blanchard,Nogueras Blanchard,0,1,1,1,,
http://www.barcelonagalleryweekend.com/en/expositions/abans-que-me-noblidi/,Ana Jotta - Abans que me n’oblidi,<p><img src='http://www.artbarcelona.es/bgw/wp-content/uploads/sites/7/2016/04/Cloud-low1.jpg' width='228' height='182' alt='Ana Jotta - Abans que me n’oblidi' />Ana Jotta is one of the most relevant Portuguese artists of recent decades who has gradually drawn the attention of the international art circuits. The artist’s singular spaces are curiously characterized by an apparent nonchalance when it comes to...</p><p><a href='http://www.barcelonagalleryweekend.com/en/expositions/abans-que-me-noblidi/' target='_blank'>+info</a></p>,09/29/2016,10/02/2016,"Exposición, Galerías, galleryweekend",ProjecteSD,ProjecteSD,0,1,1,1,,
http://www.barcelonagalleryweekend.com/en/expositions/expo-galeria-barbie-en/,"Alexander Calder, André Masson, Baltasar Lobo, Claudio Bravo, Domenico Gnoli, Fernand Léger, Gaston-Louis Roux, Giorgio de Chirico, Jean Arp, Jean Dubuffet, Joan Miró, Julio González, Óscar Domínguez, Salvador Dalí, Valerio Adami - The irrational imaginary","<p><img src='http://www.artbarcelona.es/bgw/wp-content/uploads/sites/7/2016/04/El-sue--o-de-la-razon_dormeuse.jpg' width='228' height='182' alt='Alexander Calder, André Masson, Baltasar Lobo, Claudio Bravo, Domenico Gnoli, Fernand Léger, Gaston-Louis Roux, Giorgio de Chirico, Jean Arp, Jean Dubuffet, Joan Miró, Julio González, Óscar Domínguez, Salvador Dalí, Valerio Adami - The irrational imaginary' />The irrational imaginary brings together around twenty pieces from the 20th century, ranging from the early twenties to the end of the seventies. What is the common denominator? The surrealist component that prevails in all of them be it because...</p><p><a href='http://www.barcelonagalleryweekend.com/en/expositions/expo-galeria-barbie-en/' target='_blank'>+info</a></p>",09/29/2016,10/02/2016,"Exposición, Galerías, galleryweekend",Galeria Barbié,Galeria Barbié,0,1,1,1,,
http://www.barcelonagalleryweekend.com/en/expositions/kendell-geers-en/,Kendell Geers - ProPaganDaDa,"<p><img src='http://www.artbarcelona.es/bgw/wp-content/uploads/sites/7/2016/04/Geers2-PARA-WEB-JUNIO.jpg' width='228' height='182' alt='Kendell Geers - ProPaganDaDa' />Text by Pierre Olivier Rollin, «Corps-à-corps».

To understand an exhibition of South African artist Kendell Geers (May 1968) no attempt should be made to find an explanation but rather allow a body to body (Corps-à-corps) encounter with his...</p><p><a href='http://www.barcelonagalleryweekend.com/en/expositions/kendell-geers-en/' target='_blank'>+info</a></p>",09/29/2016,10/02/2016,"Exposición, Galerías, galleryweekend",ADN Galeria,ADN Galeria,0,1,1,1,,
http://www.barcelonagalleryweekend.com/en/expositions/soul-dialogues/,"Mario Dilitz, Salustiano - Dialogues from the Soul","<p><img src='http://www.artbarcelona.es/bgw/wp-content/uploads/sites/7/2016/04/Projecte-Victor-Lope-Arte-Contemporaneo1.jpg' width='228' height='182' alt='Mario Dilitz, Salustiano - Dialogues from the Soul' />Curated by Julieta Luna.

Dialogues from the soul, a curated exhibition to be shown at the gallery, is the work of artists Salustiano (Seville, 1965) and Mario Dilitz (Innsbruck, 1973).

Salustiano’s pictorial work, meant to be a homage to...</p><p><a href='http://www.barcelonagalleryweekend.com/en/expositions/soul-dialogues/' target='_blank'>+info</a></p>",09/29/2016,10/02/2016,"Exposición, Galerías, galleryweekend",Víctor Lope Arte Contemporáneo,Víctor Lope Arte Contemporáneo,0,1,1,1,,
http://www.barcelonagalleryweekend.com/en/expositions/hacer-cosas-do-things/,Víctor Jaenada - Hacer cosas – Doing things,"<p><img src='http://www.artbarcelona.es/bgw/wp-content/uploads/sites/7/2016/04/cartel-hacer-cosas-gallery-weekend-LOW.jpg' width='228' height='182' alt='Víctor Jaenada - Hacer cosas – Doing things' />A multi-disciplinary exhibition-work, heterogeneous in appearance with different levels of emission, where the concept of “Time” is the common denominator of the pieces. “Time” understood in the broadest sense, free of complexes, from the most superficial (hanging out...</p><p><a href='http://www.barcelonagalleryweekend.com/en/expositions/hacer-cosas-do-things/' target='_blank'>+info</a></p>",09/29/2016,10/02/2016,"Exposición, Galerías, galleryweekend",Galeria Balaguer,Galeria Balaguer,0,1,1,1,,
http://www.barcelonagalleryweekend.com/en/expositions/the-reunion/,"Alexander Calder, Joan Miró, Julio González, Pablo Picasso - Art Revolutionaries. Homage to the Pavilion of the Spanish Republic, 1937","<p><img src='http://www.artbarcelona.es/bgw/wp-content/uploads/sites/7/2016/04/CALDER.The-red-base.-1969.jpg' width='228' height='182' alt='Alexander Calder, Joan Miró, Julio González, Pablo Picasso - Art Revolutionaries. Homage to the Pavilion of the Spanish Republic, 1937' />Curated by Juan Manuel Bonet.

The Mayoral art gallery presents “Art revolutionaires”, a museum quality artistic project featuring works by Pablo Picasso, Joan Miró, Alexander Calder and Julio González at the Barcelona Gallery Weekend. This exhibition has been the...</p><p><a href='http://www.barcelonagalleryweekend.com/en/expositions/the-reunion/' target='_blank'>+info</a></p>",09/29/2016,10/02/2016,"Exposición, Galerías, galleryweekend",Mayoral,Mayoral,0,1,1,1,,
http://www.barcelonagalleryweekend.com/en/expositions/bewilderment-en/,Samuel Salcedo - Bewilderment,"<p><img src='http://www.artbarcelona.es/bgw/wp-content/uploads/sites/7/2016/04/ALTA-3-Punts-Galeria-Samuel-Salcedo-1-LOW.jpg' width='228' height='182' alt='Samuel Salcedo - Bewilderment' />With this installation, Samuel Salcedo talks to us of human relations, isolation, groups, the relations of couples, friendship, violence…To do so, he places 16 large spherical sculptures on which he has modelled a facial expression, arranged as if a...</p><p><a href='http://www.barcelonagalleryweekend.com/en/expositions/bewilderment-en/' target='_blank'>+info</a></p>",09/29/2016,10/02/2016,"Exposición, Galerías, galleryweekend",3 Punts Galeria,3 Punts Galeria,0,1,1,1,,
http://www.barcelonagalleryweekend.com/en/expositions/patricia-esquivias-exhibition/,"Patricia Esquivias - Rueda, repite, mujer","<p><img src='http://www.artbarcelona.es/bgw/wp-content/uploads/sites/7/2016/04/Patricia-Esquivias-----Walking-Still-----instalacio--n-low.jpg' width='228' height='182' alt='Patricia Esquivias - Rueda, repite, mujer' />Patricia Esquivia’s work evolves around building stories based on actual anecdotes.

Departing from her research of apparently banal information she establishes a series of links between the elements that crop up along her investigation which, in turn, allow the...</p><p><a href='http://www.barcelonagalleryweekend.com/en/expositions/patricia-esquivias-exhibition/' target='_blank'>+info</a></p>",09/29/2016,10/02/2016,"Exposición, Galerías, galleryweekend",Galeria Estrany – de la Mota,Galeria Estrany – de la Mota,0,1,1,1,,
http://www.barcelonagalleryweekend.com/en/expositions/blanca-munoz-exhibition/,Blanca Muñoz - Recapitulación,"<p><img src='http://www.artbarcelona.es/bgw/wp-content/uploads/sites/7/2016/04/Mu--oz-B-Buj--a-2013-low.jpg' width='228' height='182' alt='Blanca Muñoz - Recapitulación' />Marlborough is pleased to announce Blanca Muñoz’s first individual exhibition in Barcelona. The twelve works in stainless steel and ceramic ranging from 2005 to today manifest the artist’s interest in light, cosmology and Nature’s organic shapes...</p><p><a href='http://www.barcelonagalleryweekend.com/en/expositions/blanca-munoz-exhibition/' target='_blank'>+info</a></p>",09/29/2016,10/02/2016,"Exposición, Galerías, galleryweekend",Galeria Marlborough,Galeria Marlborough,0,1,1,1,,
http://www.barcelonagalleryweekend.com/en/expositions/magia-de-granada/,Manuel Ángeles Ortiz - The magic of Granada,"<p><img src='http://www.artbarcelona.es/bgw/wp-content/uploads/sites/7/2016/04/albaycin1.jpg' width='228' height='182' alt='Manuel Ángeles Ortiz - The magic of Granada' />Manuel Ángeles Ortiz (Jaén 1895 – París 1984) was an outstanding member of the historical, Spanish avant-garde. A contemporary, and friend, of Falla, Lorca and Picasso, he collaborated with all of them on various several occasions.

The exhibition...</p><p><a href='http://www.barcelonagalleryweekend.com/en/expositions/magia-de-granada/' target='_blank'>+info</a></p>",09/29/2016,10/02/2016,"Exposición, Galerías, galleryweekend",Sala Dalmau,Sala Dalmau,0,1,1,1,,
http://www.barcelonagalleryweekend.com/en/expositions/amorfa/,Pep Duran - Amorfa,"<p><img src='http://www.artbarcelona.es/bgw/wp-content/uploads/sites/7/2016/07/PEP-DURAN_SUITE-MAGMA-09-low.jpg' width='228' height='182' alt='Pep Duran - Amorfa' />These latest assembled works titled MAGMA (S) / NUCLI (S) present in the AMORFA exhibition, have to be understood as a sequential mural, as if one were reading them through a magnifying glass…
Fragments which are enlarged, blown-up, misshapen, crumpled...</p><p><a href='http://www.barcelonagalleryweekend.com/en/expositions/amorfa/' target='_blank'>+info</a></p>",09/29/2016,10/02/2016,"Exposición, Galerías, galleryweekend",RocioSantaCruz,RocioSantaCruz,0,1,1,1,,
http://www.barcelonagalleryweekend.com/en/expositions/erick-beltran-exhibition/,Erick Beltrán - El doble no existe / El doble de las mil caras,"<p><img src='http://www.artbarcelona.es/bgw/wp-content/uploads/sites/7/2016/04/cara-d.jpg' width='228' height='182' alt='Erick Beltrán - El doble no existe / El doble de las mil caras' />El doble no existe (Galeria Joan Prats) / El doble de las mil caras (Joan Prats Warehouse)

There is always a suspicion behind all our actions and wills. Someone is watching us all the time from ourselves. The one who does...</p><p><a href='http://www.barcelonagalleryweekend.com/en/expositions/erick-beltran-exhibition/' target='_blank'>+info</a></p>",09/29/2016,10/02/2016,"Exposición, Galerías, galleryweekend",Galeria Joan Prats,Galeria Joan Prats,0,1,1,1,,
http://www.barcelonagalleryweekend.com/en/expositions/xavier-escriba-exhibition/,"Xavier Escribà - D’on venim, on som","<p><img src='http://www.artbarcelona.es/bgw/wp-content/uploads/sites/7/2016/04/Foto-1-LOW.jpg' width='228' height='182' alt='Xavier Escribà - D’on venim, on som' />This is a unique, ephemeral project made up with forty-seven correlative paintings which, in a continuum sequence, run along the entire space of the gallery.

This work will exist during the 47 days of the exhibition and it’s...</p><p><a href='http://www.barcelonagalleryweekend.com/en/expositions/xavier-escriba-exhibition/' target='_blank'>+info</a></p>",09/29/2016,10/02/2016,"Exposición, Galerías, galleryweekend",Galeria Marc Domènech,Galeria Marc Domènech,0,1,1,1,,
http://www.barcelonagalleryweekend.com/en/expositions/robert-janz-en/,Robert Janz,"<p><img src='http://www.artbarcelona.es/bgw/wp-content/uploads/sites/7/2016/04/JanzU02press-LOW.jpg' width='228' height='182' alt='Robert Janz' />Robert Janz is a painter, sculptor and graffiti artist born in Belfast in 1932. He lives and works in New York.

“Out in the urban landscape walls strewn with tags and posters serve me as ravines and caves did for...</p><p><a href='http://www.barcelonagalleryweekend.com/en/expositions/robert-janz-en/' target='_blank'>+info</a></p>",09/29/2016,10/02/2016,"Exposición, Galerías, galleryweekend",A|34,A|34,0,1,1,1,,
http://www.barcelonagalleryweekend.com/en/expositions/laercio-redondo-en/,Laercio Redondo - Restauro / Restoration,"<p><img src='http://www.artbarcelona.es/bgw/wp-content/uploads/sites/7/2016/04/Ana-Mas-Projects-Laercio-Redondo-1-low.jpg' width='228' height='182' alt='Laercio Redondo - Restauro / Restoration' />Ana Mas Projects presents the work of Brazilian artist Laercio Redondo (Parnavaí, 1967). Desvios (Detours) and Lembrança de Brasilia (Memory of Brazil) are two installations where his usual conceptual and esthetic discourses are present through subjects related to the...</p><p><a href='http://www.barcelonagalleryweekend.com/en/expositions/laercio-redondo-en/' target='_blank'>+info</a></p>",09/29/2016,10/02/2016,"Exposición, Galerías, galleryweekend",Ana Mas Projects,Ana Mas Projects,0,1,1,1,,
http://www.barcelonagalleryweekend.com/en/expositions/natural-park/,"Jan Monclús, Jerónimo Hagerman, José Díaz, José Ramón Ais, Rosa Amorós - Natural Park","<p><img src='http://www.artbarcelona.es/bgw/wp-content/uploads/sites/7/2016/04/Jos---Ramon-Ais-LOW.jpg' width='228' height='182' alt='Jan Monclús, Jerónimo Hagerman, José Díaz, José Ramón Ais, Rosa Amorós - Natural Park' />Curated by Frederic Montornés.

According to Georges Perec the countryside is the playground around the second residence of some of his fellow countrymen where there is more space available than in the city. However, despite its qualities, the countryside...</p><p><a href='http://www.barcelonagalleryweekend.com/en/expositions/natural-park/' target='_blank'>+info</a></p>",09/29/2016,10/02/2016,"Exposición, Galerías, galleryweekend",Galeria Trama,Galeria Trama,0,1,1,1,,
http://www.barcelonagalleryweekend.com/en/expositions/june-crespos-exhibition-en/,June Crespo - Chance Album nº1,"<p><img src='http://www.artbarcelona.es/bgw/wp-content/uploads/sites/7/2016/04/etHALL-----June-Crespo-1-low.jpg' width='228' height='182' alt='June Crespo - Chance Album nº1' />Presented at etHALL, the exhibition Chance Album nº 1 by basque artist June Crespo depicts her most recent explorations in her practice: an encounter between the artist’s imaginary place and her material, sensitive universe where both worlds overlap without...</p><p><a href='http://www.barcelonagalleryweekend.com/en/expositions/june-crespos-exhibition-en/' target='_blank'>+info</a></p>",09/29/2016,10/02/2016,"Exposición, Galerías, galleryweekend",etHALL,etHALL,0,1,1,1,,
http://www.barcelonagalleryweekend.com/en/expositions/exposicio-de-pieter-vermeersch/,Pieter Vermeersch - The Great Invisible Battle,"<p><img src='http://www.artbarcelona.es/bgw/wp-content/uploads/sites/7/2016/06/IMG_0773-low.jpg' width='228' height='182' alt='Pieter Vermeersch - The Great Invisible Battle' />The Blueproject Foundation presents Pieter Vermeersch, the new solo exhibition which will be shown at Il Salotto from May 20th to October 9th2016. The renowned Belgian artist has built a new installation for the occasion, designed in situ for the...</p><p><a href='http://www.barcelonagalleryweekend.com/en/expositions/exposicio-de-pieter-vermeersch/' target='_blank'>+info</a></p>",09/29/2016,10/02/2016,"Exposición, Galerías, galleryweekend",Blueproject Foundation,Blueproject Foundation,0,1,1,1,,
http://www.barcelonagalleryweekend.com/en/expositions/solids/,"Bruno Ollé, Julia Mariscal - Sólids en un líquid","<p><img src='http://www.artbarcelona.es/bgw/wp-content/uploads/sites/7/2016/04/Bruno-Olle-Archivo-ano--nimo-1.jpg' width='228' height='182' alt='Bruno Ollé, Julia Mariscal - Sólids en un líquid' />“A soap bubble usually bursts before time. It’s a quick, unforeseeable process.” Daston Lorraine, Things that talk, 2002.

The pieces that conform the exhibition Solids in a liquid, assume the dichotomy implicit in a soap bubble. Popularly, this iconic...</p><p><a href='http://www.barcelonagalleryweekend.com/en/expositions/solids/' target='_blank'>+info</a></p>",09/29/2016,10/02/2016,"Exposición, Galerías, galleryweekend",The Laboratory (Galeria Miquel Alzueta),The Laboratory (Galeria Miquel Alzueta),0,1,1,1,,