"EVENT NAME","VENUE NAME","ORGANIZER NAME","START DATE","START TIME","END DATE","END TIME","ALL DAY EVENT?","CATEGORIES","EVENT COST","EVENT WEBSITE","SHOW MAP LINK?","SHOW MAP?","EVENT DESCRIPTION","EVENT IMAGE"
"GUZZO LIVE Painting: GOMEZ","Guzzo","Guzzo","05/28/2018","","05/28/2018","",1,"","","https://www.facebook.com/events/164404137604447/",1,1,"<p><img src='http://scontent-mad1-1.xx.fbcdn.net/v/t1.0-0/s552x414/30741338_1719389664808759_7239684259265367838_n.jpg?_nc_cat=0&oh=1bb539e25fc2223834d21fa6b4a4a952&oe=5B675A8C' width='228' height='182' alt='GUZZO LIVE Painting: GOMEZ' />Street Art Barcelona and Guzzo are glad to present the street artist GÔMEZ for a new live painting session. Luis Gomez de Teran was born in Caracas, Venezuela but grew up in Rome, Italy. He began at an early age dabbling in street art, with the first tags in the suburbs of the Italian capital. After experimenting with oil on canvas, Gomez went back to walls, with huge murals whose themes predominantly stemed from classic mythology and stories belonging to the ancient Greeks. Master of the light and ""chiaroscuro"" technique, we will enjoy his art in direct at Guzzo, Monday 29th May from 18:00.<br /><br />Our resident Blaze Sound will be in charge of the music for a new Hip-Hop, Soul, Funk & Rare Grooves session. <br />www.mixcloud.com/blazesounds<br /><br />www.guzzoclub.es<br />www.streetartbcn.com</p>","https://scontent-mad1-1.xx.fbcdn.net/v/t1.0-0/s552x414/30741338_1719389664808759_7239684259265367838_n.jpg?_nc_cat=0&oh=1bb539e25fc2223834d21fa6b4a4a952&oe=5B675A8C"
"Taller de cine táctil: apropiación, intervención y distorsión","Crater Lab","Crater Lab","05/19/2018","","05/20/2018","",1,"","","https://www.facebook.com/events/944683489041667/",1,1,"<p><img src='http://scontent-mad1-1.xx.fbcdn.net/v/t1.0-0/p526x296/30727293_1794107267307522_1736699992124424192_o.jpg?_nc_cat=0&oh=9e3edff05173b1c354f768365e282c83&oe=5B689E2C' width='228' height='182' alt='Taller de cine táctil: apropiación, intervención y distorsión' />Una iniciación a distintas técnicas de intervención manual de celuloide: animación, adición y sustracción en y de la emulsión. A partir del tratamiento de película encontrada en 16mm (found footage), película trasparente y película opaca.<br /><br />Este taller busca activar la comprensión y sensibilidad hacia el cine analógico y su relación con las artes plásticas, haciendo un acercamiento a los orígenes del cine y la experimentación cinematográfica a través del aprendizaje de ejemplos históricos (tanto del origen del cine y pre-cine, como del cine experimental), pero centrándose en especial en aportar las técnicas y materiales para trabajar con la práctica, impulsando la experiencia directa y material de relación y creación manual sobre celuloide. <br /><br />Un taller en el que se entrará en contacto con distintos tipos de película en formatos cinematográfico (35mm, 16mm y super8), el origen y desarrollo de proyección de la luz y la imagen en movimiento, así como la creación del sonido óptico dibujado o pintado sobre la película.<br /><br />El objetivo principal de este taller es crear una pequeña pieza experimental colectiva en 16mm, realizada manual y artesanalmente por los participantes.<br /><br />Más información <br />http://crater-lab.org/cine-sin-camara-cine-tactil/<br /><br /><br />Fecha: Sábado 19 y Domingo 20 de Mayo Horarios: 10h-20h (con pausa para comer)<br />Participantes: Taller limitado a 12 participantes <br />Requisitos para participar: No requiere ningún conocimiento previo. Se aportarán todos los materiales necesarios en el taller.<br /><br />Escribir a info@crater-lab.org</p>","https://scontent-mad1-1.xx.fbcdn.net/v/t1.0-0/p526x296/30727293_1794107267307522_1736699992124424192_o.jpg?_nc_cat=0&oh=9e3edff05173b1c354f768365e282c83&oe=5B689E2C"
"OFFF Barcelona 2018","MAY24jue11:00","HelloMuller Ltd.","05/24/2018","","05/26/2018","",1,"","","https://www.facebook.com/events/998316113650492/",1,1,"<p><img src='http://scontent-mad1-1.xx.fbcdn.net/v/t1.0-0/s526x296/27658093_1617183065028468_7445688170541075648_n.jpg?_nc_cat=0&oh=8dae8f91b52276bae3a627b507195c53&oe=5B558068' width='228' height='182' alt='OFFF Barcelona 2018' />OFFF is a three-day journey of conferences, workshops, activities and performances that takes place in Barcelona annually, while it tours the world as OFFF on Tour for the rest of the year.</p>","https://scontent-mad1-1.xx.fbcdn.net/v/t1.0-0/s526x296/27658093_1617183065028468_7445688170541075648_n.jpg?_nc_cat=0&oh=8dae8f91b52276bae3a627b507195c53&oe=5B558068"
"Rose Madone meets Jantus","Mostrar mapa","Jantus","04/24/2018","","04/29/2018","",1,"","","https://www.facebook.com/events/433401643773993/",1,1,"<p><img src='http://scontent-mad1-1.xx.fbcdn.net/v/t1.0-0/p280x280/31144096_10214117681473469_3345196477478600704_n.jpg?_nc_cat=0&oh=8c2c41910de806e3fa37017ee3ecb403&oe=5B67CB37' width='228' height='182' alt='Rose Madone meets Jantus' />Rose Madone (France, 1993) meets Jantus (Argentina, 1994) at Galería COR. <br />Galería COR es un espacio dedicado al arte contemporáneo. En ésta exhibición tenemos un face a face entre Rose Madone y Jantus dos artistas de la escena de Barcelona.</p>","https://scontent-mad1-1.xx.fbcdn.net/v/t1.0-0/p280x280/31144096_10214117681473469_3345196477478600704_n.jpg?_nc_cat=0&oh=8c2c41910de806e3fa37017ee3ecb403&oe=5B67CB37"
"Ausencias: Exposición Carlos Herraiz","Mostrar mapa","Carlos Herraiz","05/24/2018","","05/26/2018","",1,"","","https://www.facebook.com/events/432360223871143/",1,1,"<p><img src='http://scontent-mad1-1.xx.fbcdn.net/v/t1.0-9/s720x720/30728209_1843032345721086_5950803218246621361_n.jpg?_nc_cat=0&oh=fa64688e1d30131c85061d29355c84fb&oe=5B6385B0' width='228' height='182' alt='Ausencias: Exposición Carlos Herraiz' />El 24-25-26 de mayo Carlos Herraiz presenta ""Ausencias"" en Barcelona. Una exposición que recoge muchos de los cuadros realizados en los últimos años explorando ideas como la soledad, el aislamiento, el olvido y la presencia y ausencia de las personas con el paso del tiempo. <br /><br />Horario: <br />- Jueves 24: (INAUGURACIÓN) a partir de las  19:00 horas.  <br />- Viernes 25: De 10:00 a 19:00<br />- Sábado 26: De 10:00 a 19:00<br /><br />¿Como llegar? <br />Metro: L1 parada Glòries</p>","https://scontent-mad1-1.xx.fbcdn.net/v/t1.0-9/s720x720/30728209_1843032345721086_5950803218246621361_n.jpg?_nc_cat=0&oh=fa64688e1d30131c85061d29355c84fb&oe=5B6385B0"
"Taller de Acuarela","MAY24jue11:00","Casa Piera","05/24/2018","","05/24/2018","",1,"","","https://www.facebook.com/events/166778300817649/",1,1,"<p><img src='http://scontent-mad1-1.xx.fbcdn.net/v/t31.0-8/s720x720/30425285_2155218938039172_3138523943343200501_o.jpg?_nc_cat=0&oh=deaa7fb1036d5b2bad8c897b906a12a4&oe=5B5B8BAD' width='228' height='182' alt='Taller de Acuarela' />Masterclas de Miguel Torrús. Dos turnos. Plazas LIMITADAS. Totalmente GRATUITO.<br /> Para más información... llamar/acudir a la tienda de Casa Piera en Pintor Fortuny.</p>","https://scontent-mad1-1.xx.fbcdn.net/v/t31.0-8/s720x720/30425285_2155218938039172_3138523943343200501_o.jpg?_nc_cat=0&oh=deaa7fb1036d5b2bad8c897b906a12a4&oe=5B5B8BAD"
"We Love T-shirts : 27 de Mayo","CREC Coworking","Estació Disseny Barcelona","05/27/2018","","05/27/2018","",1,"","","https://www.facebook.com/events/1070989659715655/",1,1,"<p><img src='http://scontent-mad1-1.xx.fbcdn.net/v/t1.0-0/s526x296/30725497_351766725312841_5172890183606992896_n.jpg?_nc_cat=0&oh=246ead7433973fa10f7084cbaf454bae&oe=5B5EC9FC' width='228' height='182' alt='We Love T-shirts : 27 de Mayo' />La 1ª Edición de We love T-shirts llega a Barcelona!<br />Empezamos una nueva, fresca y diferente propuesta que seguro que te gustará! La primera feria especializada en T-shirts (camisetas) de Barcelona.<br /><br />Desmárcate y consigue las novedades para este Verano!<br />Podrás disfrutar de workshops, tiendas, exposiciones y música!<br /><br />¿Donde? en Crec C/ Blesa 27 de Poble Sec.<br />¿Cuando? 27 de Mayo de 11h a 20h<br />Entrada 2€<br />Entrada menores de 12 años gratuita</p>","https://scontent-mad1-1.xx.fbcdn.net/v/t1.0-0/s526x296/30725497_351766725312841_5172890183606992896_n.jpg?_nc_cat=0&oh=246ead7433973fa10f7084cbaf454bae&oe=5B5EC9FC"