web-scraper-order,web-scraper-start-url,event_title1,event_title2,event_image-src,event_text,event_start,event_end,event_venue__MACBA,event_link,event_link-href,event_organizer__MACBA,event_category__Exposición__MACBA__Arte contemporáneo__Próximas inauguraciones,event_maplink__1,event_cost__10,event_id
1521214442-78,http://www.macba.cat/es/exposiciones,Domènec. Ni aquí ni en ningún lugar,,http://www.macba.cat/uploads/20180111/domenec_Baladia_3.6.jpg,"La exposición individual de Domènec (Mataró, 1962) plantea un recorrido por su trabajo, desde finales de los años noventa hasta la actualidad, e incluye nuevos proyectos. A partir de varios edificios o monumentos emblemáticos de la modernidad, Domènec analiza las propuestas del movimiento moderno y su legado en la contemporaneidad, utilizando como soporte de su investigación proyectos in situ, instalaciones, maquetas, fotografías, workshops, seminarios y vídeos. Su trabajo parte de los diferentes contextos locales y establece un diálogo con otros ámbitos internacionales, con el fin de plantear el impacto actual de propuestas utópicas surgidas a raíz de la revolución industrial y en contraposición al capitalismo.



El crecimiento de un proletariado urbano en el siglo XIX supuso la articulación de discursos y modelos sociales que planteaban propuestas basadas en la justicia social y el igualitarismo. El comunismo y el socialismo utópicos desarrollaron modelos arquitectónicos que reflejaban un concepto de convivencia dentro del espacio urbano centrado en el servicio a la comunidad y la mejora de las condiciones de vida. Domènec trabaja sobre esos dispositivos ejemplares y la ruptura de lo que él mismo califica de «frágil contrato entre el capital y el cuerpo social». La transformación de las circunstancias sociopolíticas que generan esos dispositivos comporta también, a veces, cambios de uso y la instauración de modelos distópicos.



Edificios de viviendas sociales convertidos en cuarteles militares o campos de internamiento; estatuas de héroes circunstanciales, derruidas por su significado y contrasentido; o el absurdo de una ciudad fantasma de entrenamiento militar para atacar núcleos urbanos enemigos, nunca reconocida oficialmente, son algunos de los casos que le sirven a Domènec para investigar sobre las disfunciones de los procesos de la modernidad y los relatos políticos que marginan a estas historias; en definitiva, sobre la ruptura de un proyecto social que en el neoliberalismo se convierte en la exacerbación del individualismo. Su obra da voz a los protagonistas, a los discursos no oficiales, y se aleja de los relatos dominantes para restituir la memoria.



La exposición se acompaña de una publicación con textos de Teresa Grandas, Martí Peran y Jeff Derksen.



Comisaria: Teresa Grandas",19 abr.,11 sep. 2018,null,,https://www.macba.cat/es/expo-domenec-ni-aqui-ni-en-ningun-lugar/1/exposiciones/expo,null,null,null,null,/es/expo-domenec-ni-aqui-ni-en-ningun-lugar/1/exposiciones/expo
1521214435-74,http://www.macba.cat/es/exposiciones,Raqs Media Collective – In the Open or in Stealth,,http://www.macba.cat/uploads/20180122/raqs_Ivana_Franke_Disorientation_Station__Black___2016.2.jpg,"Se dice que tenemos más conocimientos de lejanas galaxias que del fondo de los océanos. Y algo parecido podríamos decir sobre nuestra relación con el futuro: el futuro lejano puede resultarnos más familiar que el presente profundo. 



Estamos rodeados por una expresiva e infinita pluralidad de posibilidades. Una línea, como nos enseñan las matemáticas, no tiene necesariamente un final. Es el futuro que avanza, o el pasado retrocediendo. Desde otra perspectiva, una línea puede convertirse en un punto fijo, y en el punto de unión para una infinidad de líneas, de posibilidades distintas. Una línea puede transformarse en una ola. Una ola, en un océano. Buscar en la arena sumidos en la oscuridad submarina apela al arte.



Esta exposición es como un yacimiento en múltiples estratos que explora un concepto de futuro en el que dialogan una miríada de historias y geografías. De ese modo se genera una pluralidad de posibilidades e indagaciones que siguen caminos que se entrelazan, se entretejen y exponen relaciones entre objetos, sentimientos y conceptos, al tiempo que trazan espacios indeterminados entre ellos. 



Se presentan obras de más de veinte artistas ―incluidos algunos proyectos de nueva creación― entre los que se cuentan Liao Fei, NTU, Ivana Franke, Marzia Farhana, Lantian Xie, John Gerrard, Mehreen Murtaza, Geumhyung Jeong, The Archive of Lost Cosmonauts, así como intervenciones de los miembros de Raqs Media Collective. 



La exposición tendrá una extensión en forma de programa de mediación ―denominado Personae Project― que explorará el tejido urbano de nuestra sociedad a través de relatos en directo de habitantes de Barcelona, y que pondrá de relieve el carácter polifacético de la ciudad. El proyecto pone en diálogo el museo con la ciudad, y se plasmará en una colección de crónicas urbanas en forma de publicación en línea, y en una serie de encuentros informales. A través de los relatos de los demás reflexionamos sobre nuestras propias vidas, profundizamos en nuestra vida en común y exploramos los caminos para mejorarla. 



Raqs Media Collective fue fundado en 1992 por Jeebesh Bagchi, Monica Narula y Shuddhabrata Sengupta, Los miembros de Raqs son artistas, comisarios de exposiciones, investigadores, editores y agents provocateurs filosóficos. La obra del colectivo aborda temas como la conectividad, la temporalidad y la plenitud, y los sitúa en la intersección del arte, la investigación histórica y la especulación filosófica. Raqs Media Collective ha expuesto internacionalmente con gran éxito. Su última contribución como comisarios ha sido para la 11 Bienal de Shanghái en 2016.",null,null,null,,https://www.macba.cat/es/expo-raqs-media-collective-in-the-open-or-in-stealth/1/exposiciones/expo,null,null,null,null,/es/expo-raqs-media-collective-in-the-open-or-in-stealth/1/exposiciones/expo
