event_image-src,event_venue,event_link,event_link-href,event_title1,event_start,event_end,event_organizer,event_title2,event_text,event_cost__0,event_category__Exposición__Galerías,event_maplink__1,event_id
http://www.artbarcelona.es/wp-content/uploads/2017/10/Instal--lacio--_31.jpg,Galería Toni Tàpies,,,"Christine Borland, Susy Gómez, Alex Katz, Antoni Tàpies",28.09.17 – 12.01.18,28.09.17 – 12.01.18,Galería Toni Tàpies,Sombras en el Gineceo,,null,null,null,http://www.artbarcelona.es/es/exposiciones/sombras-en-el-gineceo/
http://www.artbarcelona.es/wp-content/uploads/2017/09/jc.jpg,ADN Galería,,,Jordi Colomer,28.09.17 – 18.11.17,28.09.17 – 18.11.17,ADN Galería,baixar al carrer / bajar a la calle / descendre dans la rue / going down into the street,,null,null,null,http://www.artbarcelona.es/es/exposiciones/baixar-al-carrer-bajar-a-la-calle-descendre-dans-la-rue-going-down-into-the-street/
http://www.artbarcelona.es/wp-content/uploads/2017/10/Instal--lacio--_31.jpg,Galería Toni Tàpies,,http://www.artbarcelona.es/es/exposiciones/sombras-en-el-gineceo/,"Christine Borland, Susy Gómez, Alex Katz, Antoni Tàpies",,28.09.17 – 12.01.18,Galería Toni Tàpies,Sombras en el Gineceo,"El gineceo es el conjunto de órganos femeninos de una flor. El nombre proviene del griego antiguo gynaeceum que era la parte de la casa reservada a las mujeres, habitualmente el aposento más interior del edificio. En ella se reunían y pasaban una buena parte del día las mujeres de la casa, tanto las doncellas como las esclavas y recibían también a menudo la visita de la dueña de la casa las noches en qué esta no estaba con su marido. Podemos imaginar que era aquí donde las mujeres intercambiaban conversaciones, a veces alegres a veces tristes, bromas sobre los hombres, penas de amor, deseos y anhelos. Todas estas voces femeninas se han perdido en el tiempo, pero no debían ser muy diferentes de lo que hoy podemos imaginar.
En la exposición Sombras en el Gineceo, presentamos obras de Christine Borland, Susy Gómez, Alex Katz y Antoni Tàpies. En todas ellas, desde la perspectiva de cada artista, hay una reflexión sobre el mundo femenino: la belleza de la juventud, el paso del tiempo, los elementos eróticos como los cabellos, la maternidad…",null,null,null,http://www.artbarcelona.es/es/exposiciones/sombras-en-el-gineceo/
http://www.artbarcelona.es/wp-content/uploads/2017/10/Richard-Estes-The-L-Train-2016-oil-on-canvas-94.6-x-127.3-cm.jpg,Galería Marlborough,,,Richard Estes,05.10.17 – 04.11.17,05.10.17 – 04.11.17,Galería Marlborough,Richard Estes. Obra reciente,,null,null,null,http://www.artbarcelona.es/es/exposiciones/richard-estes-obra-reciente/
http://www.artbarcelona.es/wp-content/uploads/2017/09/jc.jpg,ADN Galería,,http://www.artbarcelona.es/es/exposiciones/baixar-al-carrer-bajar-a-la-calle-descendre-dans-la-rue-going-down-into-the-street/,Jordi Colomer,,28.09.17 – 18.11.17,ADN Galería,baixar al carrer / bajar a la calle / descendre dans la rue / going down into the street,"Jordi Colomer (1962) presenta una serie de trabajos que orbitan alrededor de la ciudad y los modos de percibirla. La circulación de personas y vehículos, los edificios que aparecen o desaparecen, los barrios que cambian su propósito, o las poblaciones que desplazan a otras marcan la formación de una ciudad: este flujo de movimientos también la moldea. La actividad constante de la urbe, que es lo que convierte la ciudad en un ente en perpetua transformación, escribe una historia de construcción de memoria, pero también de devenir, de futuro. La muestra reflexiona acerca de este fenómeno; especialmente en la forma en que las imágenes construyen un imaginario compartido y lo modifican con el paso del tiempo. También señala cómo los imaginarios son también una forma de transformación urbana.
En “Svartlamon Parade”, Colomer parte de imágenes documentales de los desfiles organizados por los estudiantes de la UKA, la Universidad de Trondheim (Noruega) que tuvieron lugar entre 1910 y finales de los 80. Colomer la pone a la prueba de la ciudad contemporánea con una acción colectiva que restituye el recorrido que estos dibujaban en la ciudad. Igualmente en “Lessons”, la actriz Laura Weissmahr revisita un sketch teatral realizado en los años 50 por los estudiantes de esa universidad, una parodia del dispositivo que organiza la relación entre profesores y estudiantes, señalando una analogía entre teatro y discurso político y los roles de estudiantes y público.",null,null,null,http://www.artbarcelona.es/es/exposiciones/baixar-al-carrer-bajar-a-la-calle-descendre-dans-la-rue-going-down-into-the-street/
http://www.artbarcelona.es/wp-content/uploads/2017/10/Richard-Estes-The-L-Train-2016-oil-on-canvas-94.6-x-127.3-cm.jpg,Galería Marlborough,,http://www.artbarcelona.es/es/exposiciones/richard-estes-obra-reciente/,Richard Estes,,05.10.17 – 04.11.17,Galería Marlborough,Richard Estes. Obra reciente,"Richard Estes, uno de los padres de la pintura hiperrealista americana, llega a Marlborough Barcelona
La Galeria Marlborough de Barcelona presenta una exposición donde se podrán ver catorce obras de Richard Estes, uno de los fundadores del movimiento pictórico fotorrealista que nació en los Estados Unidos a finales de los años sesenta del siglo XX. Es su primera exposición individual en Barcelona diez años después de la gran retrospectiva que le dedicó el Museo Thyssen-Bornemisza de Madrid en el año 2007.
La obra de Estes está marcada por una meticulosa descripción de los edificios, de los cruces urbanos con sus rótulos y señaléticas y, por encima de todo, por su énfasis en plasmar los reflejos de las superficies tanto metálicas como vítreas, estudiando también la ambigüedad de estas últimas que unas veces transparentan y otras proyectan la imagen frente a ellas. El artista da vida a obras que la mirada no se cansa de escudriñar por su multiplicación de perspectivas, de manera que los cuadros se convierten en un juego de espejos en los que Estes estudia el efecto distorsionador de la luz sobre las superficies reflectantes. A este respecto, Guillermo Solana señala en el prólogo del catálogo de la exposición: “En la pintura de Estes, veo la Nada irisar el mundo y relumbrar sobre las cosas”.
Dejando de lado los rígidos y vertiginosos ángulos metropolitanos, presentaremos en la muestra dos obras que forman parte de una extensa serie dedicada a la Antártida, en la que Estes crea magníficos efectos tanto de las aterciopeladas extensiones de agua como de los reflejos de los glaciares en las olas de los barcos de ese mundo semi-congelado, y que seran expuestas por primera vez en la península íberica.
 
Richard Estes nació en Kewanee, Illinois en 1932. De 1952 a 1956 estudió en el Instituto de Arte de Chicago. Se mudó a Nueva York en 1959 donde tuvo lugar su primera exposición individual en 1967. En 1996 fue galardonado con el Premio MECA como artista visual en el Maine College of Art en Portland. En 2007 se celebró en el Museo Thyssen-Bornemisza de Madrid y el Palazzo Magnani en Reggio Emilia, Italia una retrospectiva de la obra del artista, Richard Estes: La sensualidad de lo real. Actualmente vive y trabaja entre Nueva York y Maine.
La obra del artista, uno de los más importantes de la segunda mitad del siglo XX, se puede encontrar en numerosas colecciones y museos incluyendo: Académie Française, París, Francia; The Art Institute of Chicago, EEUU; Des Moines Art Center, Des Moines, EEUU; Detroit Institute of Arts, Detroit, EEUU; The Solomon R. Guggenheim Museum, Nueva York, EEUU; High Museum of Art, Atlanta, EEUU; Hirshhorn Museum and Sculpture Garden, Washington, EEUU; Museum of Contemporary Art, Chicago, EEUU; Museum Ludwig, Alemania; The Museum of Modern Art, Nueva York, EEUU;  Nelson-Atkins Museum of Modern Art, Kansas City, EEUU; Neue Galerie der Stadt Aachen, Ludwig Collection, Aquisgrán, Alemania;  Teheran Museum of Contemporary Art, Teheran, Irán;  Toledo Museum of Art, Toledo, EEUU; Whitney Museum of American Art, Nueva York, EEUU;  The Brooklyn Museum of Art, Nueva York, EEUU;  Smithsonian National Air and Space Museum, Smithsonian Institution, Washington, EEUU y el Museo Thyssen-Bornemisza, Madrid.",null,null,null,http://www.artbarcelona.es/es/exposiciones/richard-estes-obra-reciente/
