web-scraper-order,web-scraper-start-url,event_link,event_link-href,event_image-src,event_start,event_end,event_text,event_category__CaixaForum__Exposición__Próximas inauguraciones,event_maplink__1,event_organizer__CaixaForum,event_venue__CaixaForum,event_cost__4,event_id,event_title1
"1534433726-29","https://caixaforum.es/es/barcelona/exposiciones?p_p_id=webcentrosexposicioneslistportlet_WAR_webcentrosexposicioneslistportlet&p_p_lifecycle=1&p_p_state=normal&p_p_mode=view&p_p_col_id=column-1&p_p_col_count=1&_webcentrosexposicioneslistportlet_WAR_webcentrosexposicioneslistportlet_javax.portlet.action=searchLandingFormAction","Joseph Beuys. Instalación permanente","https://caixaforum.es/es/barcelona/fichaexposicion?entryId=33465","/documents/20924/24359/Beuys+web+cxf+mini+ok/422fb933-8b02-4d35-a45c-4bb422cd4876?t=1490804839000","Espacio permanente","Espacio permanente","El discurso de Joseph Beuys (Krefeld, 1921 – Düsseldorf, 1986) parte de la creencia en el poder universal de la creación humana y del convencimiento de que el arte puede provocar cambios revolucionarios. Según él, ""todo ser humano es un artista en potencia"", en alusión al hecho de que todas las personas deberían poder desarrollar su propia creatividad. Defensor de la noción de escultura social (según la cual la escultura no necesita producir objetos, sino realizar acciones o comunicar pensamientos que modelen la conciencia de las personas), Beuys acuñó el concepto de ""arte ampliado"", con el que fomentó la integración del arte y la vida para alcanzar un estado en el que el individuo pudiese vivir en armonía con el entorno social y natural.","null","null","null","null","null","fichaexposicion?entryId=33465","Joseph Beuys. Instalación permanente"
"1534433733-31","https://caixaforum.es/es/barcelona/exposiciones?p_p_id=webcentrosexposicioneslistportlet_WAR_webcentrosexposicioneslistportlet&p_p_lifecycle=1&p_p_state=normal&p_p_mode=view&p_p_col_id=column-1&p_p_col_count=1&_webcentrosexposicioneslistportlet_WAR_webcentrosexposicioneslistportlet_javax.portlet.action=searchLandingFormAction","Una cierta oscuridad","https://caixaforum.es/es/barcelona/fichaexposicion?entryId=426986","/documents/20924/24359/comisart+cast+mini/72260af2-d860-8543-8410-fb7a5fce3c73","Del 20 de junio de 2018 al 5 de enero de 2019","Del 20 de junio de 2018 al 5 de enero de 2019","Mientras en el Louvre se reunían visitantes para ver el vacío en la pared de La Gioconda desaparecida, fuera del museo, a imagen de la obra de Da Vinci se hacía rotundamente presente en muchas esferas de la vida pública, reproducida sobre infinidad de soportes: en periódicos y revistas, en los cines, en postales y carteles, e incluso en cajas de bombones. Una cierta oscuridad toma como punto de partida simbólico ese espacio negro y vacío que deja en la sala expositiva el cuadro robado de La Gioconda para especular sobre conceptos relacionados con la mirada y con nuestros modos de ver –y de no ver– imágenes.","null","null","null","null","null","fichaexposicion?entryId=426986","Una cierta oscuridad"
"1534433744-33","https://caixaforum.es/es/barcelona/exposiciones?p_p_id=webcentrosexposicioneslistportlet_WAR_webcentrosexposicioneslistportlet&p_p_lifecycle=1&p_p_state=normal&p_p_mode=view&p_p_col_id=column-1&p_p_col_count=1&_webcentrosexposicioneslistportlet_WAR_webcentrosexposicioneslistportlet_javax.portlet.action=searchLandingFormAction","Faraón. Rey de Egipto","https://caixaforum.es/es/barcelona/fichaexposicion?entryId=384223","/documents/20924/24359/faraon+expo+cast+mini/a4e4b268-6838-7825-5735-e21e73efc73d","Del 8 de junio al 16 de septiembre de 2018","Del 8 de junio al 16 de septiembre de 2018","Tras las imágenes y los objetos del antiguo Egipto que han llegado hasta nuestros días se esconde la realidad de un imperio que ha fascinado al hombre a lo largo de la historia. ""Faraón. Rey de Egipto"" presenta dichos objetos para explicar la vida en esos tiempos, prestando especial atención a distintos aspectos del monarca egipcio como el carácter divino de los faraones, la simbología de las vestimentas y las joyas, la religiosidad, los rituales, la organización administrativa del país, las guerras expansivas y de protección y, por supuesto, la vida de palacio.","null","null","null","null","null","fichaexposicion?entryId=384223","Faraón. Rey de Egipto"
"1534433723-27","https://caixaforum.es/es/barcelona/exposiciones?p_p_id=webcentrosexposicioneslistportlet_WAR_webcentrosexposicioneslistportlet&p_p_lifecycle=1&p_p_state=normal&p_p_mode=view&p_p_col_id=column-1&p_p_col_count=1&_webcentrosexposicioneslistportlet_WAR_webcentrosexposicioneslistportlet_javax.portlet.action=searchLandingFormAction","null","","","","","","","","","","","null","null"
"1534433723-28","https://caixaforum.es/es/barcelona/exposiciones?p_p_id=webcentrosexposicioneslistportlet_WAR_webcentrosexposicioneslistportlet&p_p_lifecycle=1&p_p_state=normal&p_p_mode=view&p_p_col_id=column-1&p_p_col_count=1&_webcentrosexposicioneslistportlet_WAR_webcentrosexposicioneslistportlet_javax.portlet.action=searchLandingFormAction","null","","","","","","","","","","","null","null"
"1534433739-32","https://caixaforum.es/es/barcelona/exposiciones?p_p_id=webcentrosexposicioneslistportlet_WAR_webcentrosexposicioneslistportlet&p_p_lifecycle=1&p_p_state=normal&p_p_mode=view&p_p_col_id=column-1&p_p_col_count=1&_webcentrosexposicioneslistportlet_WAR_webcentrosexposicioneslistportlet_javax.portlet.action=searchLandingFormAction","Turbulencias. Colección ""la Caixa"" de Arte Contemporáneo","https://caixaforum.es/es/barcelona/fichaexposicion?entryId=540192","/documents/20924/24359/turbulencias+cast+mini/c0915809-6cb4-38b6-a4e6-f6a184cb48eb","Del 20 de julio al 21 de octubre de 2018","Del 20 de julio al 21 de octubre de 2018","A lo largo de la historia los artistas se han preguntado de qué es capaz el arte. Esta exploración de la potencia del arte como herramienta transformadora sigue vigente hoy en día. Los artistas trabajan con representaciones de la realidad que, de forma más o menos poética, manifiestan su visión sobre la vida que les rodea, generando obras con el poder de una turbulencia, es decir, como un detonante capaz de abrir los ojos de la sociedad ante realidades desconocidas.","null","null","null","null","null","fichaexposicion?entryId=540192","Turbulencias. Colección ""la Caixa"" de Arte Contemporáneo"
"1534433729-30","https://caixaforum.es/es/barcelona/exposiciones?p_p_id=webcentrosexposicioneslistportlet_WAR_webcentrosexposicioneslistportlet&p_p_lifecycle=1&p_p_state=normal&p_p_mode=view&p_p_col_id=column-1&p_p_col_count=1&_webcentrosexposicioneslistportlet_WAR_webcentrosexposicioneslistportlet_javax.portlet.action=searchLandingFormAction","Paseos de Nobel","https://caixaforum.es/es/barcelona/fichaexposicion?entryId=377366","/documents/20924/24359/expo+paseos+nobel+cast+mini/fd7ec350-3728-1d85-c8dd-b3f5ff62663a","Del 16 de abril al 2 de septiembre de 2018","Del 16 de abril al 2 de septiembre de 2018","El ojo de Kim Manresa y la perspicacia de Xavi Ayén consiguen captar de manera espontánea la relación de los escritores con su entorno. Les vemos en acción; escribiendo, corriendo, comprando o charlando con amigos, pero sobre todo, fundiéndose con un paisaje que sus obras han hecho universal. El conjunto de los retratos, acompañados de breves reflexiones sobre esos encuentros íntimos, dibujan un mapamundi literario con el México del colombiano García Márquez; la Nigeria de Wole Soyinka; la Nueva York de Toni Morrison; o la China de Gao Xingjian, entre otros muchos escenarios.","null","null","null","null","null","fichaexposicion?entryId=377366","Paseos de Nobel"
