web-scraper-order,web-scraper-start-url,event_organizer,event_venue,event_text,event_title,event_link,event_link-href,event_facebooktime,event_maplink__1,event_cost__,event_category__,event_id,event_image-src
"1535191453-6","https://www.artssspot.com/barcelona/face-pages-prov/","Popeye loves Olive Art Space","Museu del Disseny de Barcelona","null","Popeye loves Olive Art Space at Joya Barcelona 2018","https://www.facebook.com/events/271812896948651/","https://www.facebook.com/events/271812896948651/","2018-10-04T01:00:00-07:00 to 2018-10-06T12:00:00-07:00","null","null","null","https://www.facebook.com/events/271812896948651/","https://scontent-mad1-1.xx.fbcdn.net/v/t1.0-0/s526x296/38136045_2148358858736977_526444951903404032_n.jpg?_nc_cat=0&oh=67cd71ccf67ac0617fe4bfb04105d0e9&oe=5BF3ADAE"
"1535191450-5","https://www.artssspot.com/barcelona/face-pages-prov/","Ús Barcelona","Centre Penitenciari La Modelo","null","Ús Barcelona, el festival d’art i espai públic - La MODEL","https://www.facebook.com/events/638180359877494/","https://www.facebook.com/events/638180359877494/","2018-10-02T07:00:00-07:00 to 2018-10-07T09:00:00-07:00","null","null","null","https://www.facebook.com/events/638180359877494/","https://scontent-mad1-1.xx.fbcdn.net/v/t1.0-0/p235x350/37074010_1984543008244485_6518618800265363456_n.jpg?_nc_cat=0&oh=4429cec560de8b30258f39c8c4a16154&oe=5BF99135"
"1535191446-4","https://www.artssspot.com/barcelona/face-pages-prov/","BAU","BAU","Ya queda menos de 1 mes para #BAUDesignForum, las jornadas sobre diseño y comunicación que en esta 4ª edición pretenden reflexionar en torno a los modos, a los retos y a las oportunidades de un diseño (cosmo)político: http://www.baudesignforum.com/ ¡Entradas* ya a la venta!

*Atención: los estudiantes, los alumni y el profesorado de BAU pueden conseguir su entrada gratuita con el código que se les proporcionará via email a principios de septiembre.","BAU Design Forum 2018","https://www.facebook.com/events/2062090093812093/","https://www.facebook.com/events/2062090093812093/","2018-09-19T07:00:00-07:00 to 2018-09-20T11:00:00-07:00","null","null","null","https://www.facebook.com/events/2062090093812093/","https://scontent-mad1-1.xx.fbcdn.net/v/t1.0-0/p526x296/39913968_10155794744428481_8474661483706318848_n.jpg?_nc_cat=0&oh=f6429f2ccd607c468038c94b71f84e58&oe=5BF2241D"
"1535191419-2","https://www.artssspot.com/barcelona/face-pages-prov/","Lomography Embassy Barcelona","Lomography Embassy Barcelona","¿Te gustaría poder revelar tus carretes de blanco y negro en casa, y poder experimentar con el proceso y los resultados? Si tu respuesta es sí... ¡Éste es tu taller!

El próximo sábado 8 de septiembre podrás aprender a revelar tus negativos de Blanco y Negro. Pero no solo eso, en esta ocasión revelaremos con esta fórmula de revelado experimental que usa la cerveza negra como base.

¿En qué consiste el taller?
Comenzaremos la parte teórica del taller a las 10:30h. Inmediatamente después, cargaremos nuestras Diana F+ con un rollo de película de blanco y negro para hacer unas cuantas fotos por el barrio.
Una vez terminado el carrete, regresaremos a Lomography Embassy Barcelona y en nuestro laboratorio prepararemos la fórmula experimental del “revelado Irlandés”, cargaremos los tanques de revelado y a continuación procesaremos todos los rollos.

¿Què incluye este Taller Analógico?
- La clase teórica y práctica.
- Préstamo de la cámara
- Una película
- Revelado + CD con la digitalización de las fotos - Aperitivo para recuperarse del paseo fotográfico.
¡Queremos hacerte vivir una experiencia única! ¡Te esperamos! 


Precio: 40€
Para reservar tu plaza, es muy importante que antes nos contactes diciéndonos tu nombre, teléfono y dirección de correo.
Puedes realizar el pago de la inscripción:
- Visitándonos en Carrer d’en Rosic 3
- Llamando al teléfono (+34) 935 160 545
- Transferencia Bancaria: ES55 0081 0137 2500 0164 9872
(Imprescindible presentar comprobante con un mínimo de 2 días de antelación) ¡No te quedes sin plaza en nuestros Talleres Analógicos!
¡Muchas gracias!","Taller de Revelado Experimental: Revelado Irlandés","https://www.facebook.com/events/326589711413962/","https://www.facebook.com/events/326589711413962/","2018-09-08T01:30:00-07:00 to 2018-09-08T05:00:00-07:00","null","null","null","https://www.facebook.com/events/326589711413962/","https://scontent-mad1-1.xx.fbcdn.net/v/t1.0-0/p526x296/39748368_1036731183161643_8646749501723246592_n.jpg?_nc_cat=0&oh=a63b1c6ee8ecd495176ddee23ed4be6c&oe=5C38D264"
"1535191404-1","https://www.artssspot.com/barcelona/face-pages-prov/","Art+Feminsim BCN","null","CAT// 

En una enquesta de 2011, la Fundació Wikimedia va trobar que menys del 10% dels seus contribuents eren dones. Tot i que els motius de la bretxa de gènere estan pendents de debat, l'efecte pràctic d'aquesta disparitat no ho està: el contingut es veu distorsionat per la manca de representació de les dones.

Anem a canviar això.

A partir de setembre us convidem a totis (dones, bolleres i trans) a participar a les nostres assamblees a Ca la Dona (el 1r dilluns de cada mes) i a les trobades de suport per editores de #Viquipèdia (el 3r dimecres de cada mes)

Disposem d'altres espais oberts a persones aliades pero us volem recordar que L'ASSAMBLEA ES UN ESPAI NO MIXTE. 
SI US PLAU, CONFIRMEU-NOS LA VOSTRA ASSISTÈNCIA A ARTFEMINISME@PROTONMAIL.COM


ESP//

En una encuesta de 2011, la Fundación Wikimedia encontró que menos del 10% de sus contribuyentes eran mujeres. A pesar de que los motivos de la brecha de género están pendientes de debate, el efecto práctico de esta disparidad no lo está: el contenido se ve distorsionado por la carencia de representación de las mujeres.

Vamos a cambiar esto.

A partir de septiembre os invitamos a todis (mujeres, bolleras y trans) a participar en nuestras asambleas (el 1º lunes de cada mes) y en los encuentros de apoyo para editoras de Wikipedia (el 3º miércoles de cada mes)

Disponemos de otros espacios abiertos a personas aliadas, pero os queremos recordar que LA ASAMBLEA ES UN ESPACIO NO MIXTO. POR FAVOR, CONFIRMAD ASISTENCIA ESCRIBIENDO UN CORREO A 
ARTFEMINISME@PROTONMAIL.COM","1ª Assamblea Art+Feminisme BCN","https://www.facebook.com/events/535139363585292/","https://www.facebook.com/events/535139363585292/","2018-09-03T09:00:00-07:00 to 2018-09-03T11:30:00-07:00","null","null","null","https://www.facebook.com/events/535139363585292/","https://scontent-mad1-1.xx.fbcdn.net/v/t1.0-0/s526x296/40027913_306324000174753_8768392948460027904_n.jpg?_nc_cat=0&oh=4443b256587382bc89bcc298dcc8a844&oe=5BF1E525"
"1535191433-3","https://www.artssspot.com/barcelona/face-pages-prov/","Taller de escultura Pablo Bruera.","Taller de escultura Pablo Bruera.","PRESENTACIÓN DEL TALLER DE ESCULTURA.
Realizaremos una clase abierta para explicar los contenidos del taller y el modo de funcionamiento. Con algunos ejercicios prácticos tomaremos contacto con la metodología de trabajo.

https://vimeo.com/190937349 

LOS CURSOS REGULARES COMIENZAN EN SEPTIEMBRE

Sobre los cursos regulares:

El taller de escultura se divide en una parte teórica, de dibujo y creación de maquetas. Allí estudiaremos los ""fenómenos visuales"", maneras de vincular visualmente diferentes elementos.

Una serie de sonidos se convierte en música cuando se organizan. El oído vincula un sonido con otro y los percibe como un conjunto.

Lo mismo sucede con los ojos y las artes visuales. Cuando dibujamos, pintamos o esculpimos, debemos organizar los elementos plásticos (puntos, lineas, planos, colores) de manera que el ojo los vincule formalmente.

Para esto proponemos una serie de ejercicios que nos llevarán a crear maquetas de cartón.

La otra parte del taller es la técnica. Aprenderemos a utilizar diferentes máquinas y herramientas para la creación de esculturas de metal. Corte por plasma, soldadora de arco, soldadora MIG y TIG, plegadora, curvadora y muchas otras herramientas.

No es necesaria experiencia previa. Cada alumno es tratado de manera individualizada en grupos reducidos. Existen diferentes horarios:

A- Jueves de 18 a 21 

B- Viernes de 9:30 a 12:30

C- Sábados de 10 a 13.

El precio mensual: 120 € incluye todos los materiales.

Para ver el programa de estudios:

www.pablobruera.com","Clase Abierta y Gratuita / Free Open Class","https://www.facebook.com/events/267751020526578/","https://www.facebook.com/events/267751020526578/","2018-09-10T10:00:00-07:00 to 2018-09-10T12:00:00-07:00","null","null","null","https://www.facebook.com/events/267751020526578/","https://scontent-mad1-1.xx.fbcdn.net/v/t1.0-0/p526x296/40017336_675913096114285_434901787028226048_o.jpg?_nc_cat=0&oh=35013f652b253c58c55dded9c9e7dc35&oe=5BF7A2A0"
