web-scraper-order,web-scraper-start-url,event_title1,event_title2,event_image-src,event_text,event_start,event_end,event_venue,event_link,event_link-href,event_organizer__MACBA,event_category__Actividad__MACBA,event_maplink__1,event_cost__,event_id
1534434682-113,http://www.macba.cat/es/actividades,"Anecdoteca, notas para escuchar a los objetos","Trabajo de investigación entorno a la exposición ""Francesc Torres. La campana hermética""",/uploads/20180801/ImagenGeneral_VideosTorres.6.png,"Un sinfín de artefactos despliegan un yacimiento arqueológico inexplorado. El

archivo histórico de Francesc Torres abre una multitud de interrogantes acerca de la

vida cultural del siglo XX. Entre la guerra y el olvido, la memoria y el juego, el

coleccionismo y la corrosión, los afectos y la construcción de la masculinidad, esta

serie de cápsulas detonan seis breves ensayos que exploran la visualidad y el sentir

de las cosas. Más allá de cualquier gesto hermenéutico o una interpretación de la

exposición, ¿cómo dejar espacio para que los objetos nos hablen?



Este proyecto contempla la realización de diversos vídeos próximamente publicados aquí: 

Cápsula_1 Las manos

Cápsula_2 Aura

Cápsula_3 El ADN de las cosas

Cápsula_4 Vestida de arroz

Cápsula_5 Shirley

Cápsula_6 El juego de la guerra

 

Trabajo realizado por Angelica Tognetti, Emil Becerril, Itxaso Corral Arrieta, Laura

Arensburg y Nicolás Fernández, integrantes del grupo de investigación sobre la

exposición La campana hermética de Francesc Torres, en el marco del Programa de Estudios Independientes 2017-2018.



El Programa de Estudios Independientes del MACBA es un laboratorio para la reflexión y la práctica, un lugar de experimentación sobre las nuevas formas de producción de conocimiento que tiene como objetivo fundamental movilizar el pensamiento crítico en la intersección entre prácticas artísticas, ciencias sociales e intervenciones político-institucionales.",null,null,,,https://www.macba.cat/es/trabajo-de-investigacion-entorno-a-la-exposicion-de-francesc-torres-la-campana-hermetica/1/all/activ,null,null,null,null,/es/trabajo-de-investigacion-entorno-a-la-exposicion-de-francesc-torres-la-campana-hermetica/1/all/activ
1534434554-102,http://www.macba.cat/es/actividades,Parlem de... Melanie Smith. Sentido inglés del humor mexicano,"Con Ximena Pérez Gorbet, artista gráfica",/uploads/20180725/Parlem_Melanie_web.3.0.jpg,"PARLEM DE MELANIE SMITH. FARSA Y ARTIFICIO

Con Ximena Pérez Gorbet



El ser humano tiene la necesidad natural de pertenecer. Por lo tanto, la condición de ser extranjero ―es decir, de no pertenecer a la comunidad política donde uno se encuentra― es considerado comúnmente como una desventaja. Sin embargo, el ser extranjero también tiene, como todo, sus ventajas. Cuando uno asume su condición de extranjero es como si se pusiera unas gafas de gran aumento con las que todo se ve tanto en micro como en macroescala, con una conciencia que permite observar con mayor perspectiva y detenimiento todo lo que nos rodea gracias a no estar automatizado con el entorno.



El extranjero trae de origen sus propias referencias de donde ha crecido y trabajado, que le servirán como herramientas para examinar con mayor perspectiva aquello que sobresalga o llame la atención de lo que no conoce. Melanie Smith, de origen inglés, es extranjera en México, país donde ha desarrollado gran parte de su obra. Su cultura inglesa tiene un punto en común con la cultura mexicana: el sentido del humor, una de las herramientas de trabajo de la artista, que se aprecia y emana de una manera evidente en toda su obra.",22 sep. 2018,null,,,https://www.macba.cat/es/parlem-de-melanie-smith-sentido-ingles-del-humor-mexicano/1/all/activ,null,null,null,null,/es/parlem-de-melanie-smith-sentido-ingles-del-humor-mexicano/1/all/activ
