https://hangar.org/es/programa-hangar/formacio-continua/english-taller/,Taller gratuito de Vídeo con Kdenlive,<p><img src='https://hangar.org/webnou/wp-content/uploads/2015/05/kdenlive-200x150.png' width='228' height='182' alt='Taller gratuito de Vídeo con Kdenlive' /></p><p>null</p><p><a href='https://hangar.org/es/programa-hangar/formacio-continua/english-taller/' target='_blank'>+info</a></p>,07/09/2015,,"Actividad, Hangar, Taller",1,Hangar,?
https://hangar.org/es/news/catala-el-abcde-per-a-fotografiar-la-teva-obra/,"El A,B,C,D,E para Fotografiar tu obra","<p><img src='https://hangar.org/webnou/wp-content/uploads/2015/03/Biggger-and-Unique-700pix-Rivet-200x150.jpeg' width='228' height='182' alt='El A,B,C,D,E para Fotografiar tu obra' /></p><p><a href='https://hangar.org/es/news/catala-el-abcde-per-a-fotografiar-la-teva-obra/' target='_blank'>+info</a></p>",05/18/2015,,"Actividad, Hangar, Taller",1,Hangar,?
https://hangar.org/es/news/taller-de-arduino-avancat/,Taller de Arduino Avanzado,"<p><img src='https://hangar.org/webnou/wp-content/uploads/2015/07/arduino-I-200x150.jpg' width='228' height='182' alt='Taller de Arduino Avanzado' /></p><p>En este taller intensivo se profundizará en las metodologías y técnicas de Arduino. Arduino es una plataforma de hardware libre con la que se pueden desarrollar todo tipo de proyectos de electrónica y computación física basados en microcontroladores, permite interactuar con sensores y controlar circuitos, luces y motores con sistemas inteligentes. El abanico de aplicaciones es muy amplio, tanto en el campo de la interactividad como de la robótica, la domótica, o la electróncia musical, por este motivo es una herramienta cada vez más utilizada por artistas que buscan explorar en sus obras los usos creativos de la tecnología.</p><p><a href='https://hangar.org/es/news/taller-de-arduino-avancat/' target='_blank'>+info</a></p>",12/01/2015,,"Actividad, Hangar, Taller",1,Hangar,?
https://hangar.org/es/workshops-artist2artists/espanol-taller-data-bending-o-busqueda-de-nuevas-esteticas-en-el-glitch/,Taller: Data Bending ó búsqueda de nuevas estéticas en el glitch,<p><img src='https://hangar.org/webnou/wp-content/uploads/2015/07/glitch-200x150.jpg' width='228' height='182' alt='Taller: Data Bending ó búsqueda de nuevas estéticas en el glitch' /></p><p><a href='https://hangar.org/es/workshops-artist2artists/espanol-taller-data-bending-o-busqueda-de-nuevas-esteticas-en-el-glitch/' target='_blank'>+info</a></p>,09/18/2015,,"Actividad, Hangar, Taller",1,Hangar,?
https://hangar.org/es/workshops-artist2artists/espanol-talelr-de-proteccion-digital-de-la-fuente-periodistica/,Taller de PROTECCIÓN DIGITAL DE LA FUENTE PERIODÍSTICA,<p><img src='https://hangar.org/webnou/wp-content/uploads/2015/05/protecciondigital-200x150.png' width='228' height='182' alt='Taller de PROTECCIÓN DIGITAL DE LA FUENTE PERIODÍSTICA' /></p><p>Taller intensivo de 10 horas.</p><p><a href='https://hangar.org/es/workshops-artist2artists/espanol-talelr-de-proteccion-digital-de-la-fuente-periodistica/' target='_blank'>+info</a></p>,07/11/2015,,"Actividad, Hangar, Taller",1,Hangar,?
https://hangar.org/es/news/espanol-curso-el-cine-ensayo-o-la-forma-peligrosa-de-mezclar-lo-personal-con-el-presente-a-cargo-de-andres-duque/,Curso: El cine-ensayo (o la forma peligrosa de mezclar lo personal con el presente) a cargo de Andrés Duque,<p><img src='https://hangar.org/webnou/wp-content/uploads/2015/07/tallerduque-200x150.jpg' width='228' height='182' alt='Curso: El cine-ensayo (o la forma peligrosa de mezclar lo personal con el presente) a cargo de Andrés Duque' /></p><p><a href='https://hangar.org/es/news/espanol-curso-el-cine-ensayo-o-la-forma-peligrosa-de-mezclar-lo-personal-con-el-presente-a-cargo-de-andres-duque/' target='_blank'>+info</a></p>,10/26/2015,12/14/2015,"Actividad, Hangar, Taller",1,Hangar,?
https://hangar.org/es/news/catala-taller-gratuito-vvvv-produccion-en-tiempo-real-para-presentaciones-audiovisuales/,Taller gratuito:  vvvv producción en tiempo real para presentaciones audiovisuales,<p><img src='https://hangar.org/webnou/wp-content/uploads/2015/04/4-200x150.jpg' width='228' height='182' alt='Taller gratuito:  vvvv producción en tiempo real para presentaciones audiovisuales' /></p><p>null</p><p><a href='https://hangar.org/es/news/catala-taller-gratuito-vvvv-produccion-en-tiempo-real-para-presentaciones-audiovisuales/' target='_blank'>+info</a></p>,05/09/2015,,"Actividad, Hangar, Taller",1,Hangar,?
https://hangar.org/es/hangar-sonor/catala-taller-intensiu-de-max-for-live-m4l/,Taller Intensivo de MAX FOR LIVE (M4L),<p><img src='https://hangar.org/webnou/wp-content/uploads/2015/03/m4l-200x150.jpg' width='228' height='182' alt='Taller Intensivo de MAX FOR LIVE (M4L)' /></p><p><a href='https://hangar.org/es/hangar-sonor/catala-taller-intensiu-de-max-for-live-m4l/' target='_blank'>+info</a></p>,04/11/2015,,"Actividad, Hangar, Taller",1,Hangar,?
https://hangar.org/es/news/catala-taller-intensiu-de-performance-i-art-del-cos-a-carrec-de-lartista-mexica-felipe-osornio/,Taller intensivo de performance y arte del cuerpo a cargo del artista mexicano Felipe Osornio,<p><img src='https://hangar.org/webnou/wp-content/uploads/2015/02/foto_taller_felipe_web_hangar-200x150.png' width='228' height='182' alt='Taller intensivo de performance y arte del cuerpo a cargo del artista mexicano Felipe Osornio' /></p><p><a href='https://hangar.org/es/news/catala-taller-intensiu-de-performance-i-art-del-cos-a-carrec-de-lartista-mexica-felipe-osornio/' target='_blank'>+info</a></p>,03/18/2015,03/20/2015,"Actividad, Hangar, Taller",1,Hangar,?
https://hangar.org/es/workshops-artist2artists/taller-de-arduino-basic-a-carrec-de-alex-posada/,Taller de Arduino básico a cargo de Alex Posada,"<p><img src='https://hangar.org/webnou/wp-content/uploads/2015/07/arduinobasico-200x150.jpg' width='228' height='182' alt='Taller de Arduino básico a cargo de Alex Posada' /></p><p>En este taller intensivo se explicarán las metodologías y técnicas básicas de trabajo con Arduino. Arduino es una plataforma de hardware libre con la cual se pueden desarrollar todo tipo de proyectos de electrónica y computación física basados en microcontroladores, permite interactuar con sensores y controlar circuitos, luces y motores con sistemas inteligentes. El abanico de aplicaciones es muy amplio, tanto en el campo de la interactividad como de la robótica, la domótica, o la electróncia musical, por este motivo es una herramienta cada vez más utilizada por artistas que buscan explorar en sus obras los usos creativos de la tecnología.</p><p><a href='https://hangar.org/es/workshops-artist2artists/taller-de-arduino-basic-a-carrec-de-alex-posada/' target='_blank'>+info</a></p>",10/26/2015,,"Actividad, Hangar, Taller",1,Hangar,?
https://hangar.org/es/news/catala-5a-edicio-del-taller-wearables-introduccio-a-lus-de-tecnologies-interactives-en-lambit-textil/,5a edición del Taller “WEARABLES: introducción al uso de tecnologías interactivas en el ámbito téxtil,"<p><img src='https://hangar.org/webnou/wp-content/uploads/2014/07/wearables3-200x150.jpg' width='228' height='182' alt='5a edición del Taller “WEARABLES: introducción al uso de tecnologías interactivas en el ámbito téxtil' /></p><p>Taller práctico orientado a la confección e intervención de ropa y accesorios mediante la manufactura de circuitos electrónicos con Arduino. Arduino es un diseño abierto/libre/gratuito y sobre todo una comunidad de miles de diseñadores que genera diariamente proyectos bajo la misma filosofía. La placa electrónica y el software Arduino fueron concebidos para acercar y facilitar a artistas y diseñadores la construcción y programación de pequeños circuitos electrónicos. Arduino permite el desarrollo casero (DIY, hazlo tú mismo) de pequeños proyectos reactivos e interactivos: sensores y actuadores (luces, motores, etc). Lilypad es uno dos de los proyectos derivados de Arduino, una modificación de la placa standard enfocada al uso sobre tejidos y donde las partes conductoras del circuito se pueden coser. La integración de hardware/software en el ámbito blando de los tejidos permite además, el acoplamiento de esta tecnología con la escena emergente de los nuevos materiales (conductivos, crómicos, etc). Este cruzamiento acontecerá muy probablemente una de las principales ramas de la denominado “internet de las cosas“, la ubicuidad de la información digital.</p><p><a href='https://hangar.org/es/news/catala-5a-edicio-del-taller-wearables-introduccio-a-lus-de-tecnologies-interactives-en-lambit-textil/' target='_blank'>+info</a></p>",04/18/2015,,"Actividad, Hangar, Taller",1,Hangar,?
https://hangar.org/es/news/catala-taller-de-reciclatge-i-transformacio-de-vestuari/,Taller de transformación de vestuario,<p><img src='https://hangar.org/webnou/wp-content/uploads/2014/12/chaleco-200x150.png' width='228' height='182' alt='Taller de transformación de vestuario' /></p><p><a href='https://hangar.org/es/news/catala-taller-de-reciclatge-i-transformacio-de-vestuari/' target='_blank'>+info</a></p>,02/24/2003,,"Actividad, Hangar, Taller",1,Hangar,?
https://hangar.org/es/hangar-sonor/espanol-taller-de-edicion-de-audio-basico-para-entrevistas-con-audacity/,Taller gratuito de edición de audio básico para entrevistas con AUDACITY,<p><img src='https://hangar.org/webnou/wp-content/uploads/2015/05/images.jpeg' width='228' height='182' alt='Taller gratuito de edición de audio básico para entrevistas con AUDACITY' /></p><p><a href='https://hangar.org/es/hangar-sonor/espanol-taller-de-edicion-de-audio-basico-para-entrevistas-con-audacity/' target='_blank'>+info</a></p>,07/16/2015,,"Actividad, Hangar, Taller",1,Hangar,?
https://hangar.org/es/workshops-artist2artists/english-workshop-mapping-the-vortex-mapping-and-visualisation-with-supercollider/,Workshop “Mapping the Vortex: mapping y visualización con SuperCollider”,<p><img src='https://hangar.org/webnou/wp-content/uploads/2015/08/9677OS-07-04-200x150.png' width='228' height='182' alt='Workshop “Mapping the Vortex: mapping y visualización con SuperCollider”' /></p><p>Este taller intensivo de dos días de duración impartido por Marinos Koutsomichalis va dirigido a participantes de cualquier disciplina que ya estén familiarizados con SuperCollider y deseen ampliar susconocimientos técnicos y prácticos en los campos de la cartografía y la visualización.</p><p><a href='https://hangar.org/es/workshops-artist2artists/english-workshop-mapping-the-vortex-mapping-and-visualisation-with-supercollider/' target='_blank'>+info</a></p>,12/11/2015,,"Actividad, Hangar, Taller",1,Hangar,?
https://hangar.org/es/programa-hangar/formacio-continua/catala-bricolatge-per-a-newartesans-curs-dintroduccio-a-la-construccio-i-al-muntatge/,BRICOLAJE PARA newARTESANS Curso de introducción a la construcción y al montaje,<p><img src='https://hangar.org/webnou/wp-content/uploads/2014/12/BRICO-200x150.jpg' width='228' height='182' alt='BRICOLAJE PARA newARTESANS Curso de introducción a la construcción y al montaje' /></p><p><a href='https://hangar.org/es/programa-hangar/formacio-continua/catala-bricolatge-per-a-newartesans-curs-dintroduccio-a-la-construccio-i-al-muntatge/' target='_blank'>+info</a></p>,06/08/2015,06/12/2015,"Actividad, Hangar, Taller",1,Hangar,?
https://hangar.org/es/news/espanol-diseno-de-libros-en-un-contexto-low-cost-a-cargo-de-rosa-llop/,Curso “Diseño de libros en un contexto low cost” a cargo de Rosa Llop,"<p><img src='https://hangar.org/webnou/wp-content/uploads/2015/07/onesecond_Philipp_Adrian-3-200x150.jpg' width='228' height='182' alt='Curso “Diseño de libros en un contexto low cost” a cargo de Rosa Llop' /></p><p>La producción editorial dentro del contexto artístico se mueve principalmente en tres escenarios: los catálogos de obra, los dossiers de investigación y el libro de artista. Cada tipología tiene unas particularidades formales pero las tres comparten tanto la metodología de trabajo como el potencial del libro como medio expresivo.</p><p><a href='https://hangar.org/es/news/espanol-diseno-de-libros-en-un-contexto-low-cost-a-cargo-de-rosa-llop/' target='_blank'>+info</a></p>",0/01/2015,,"Actividad, Hangar, Taller",1,Hangar,?
https://hangar.org/es/news/catala-taller-intensiu-de-arduino-basic-a-carrec-de-alex-posada/,Taller intensivo de Arduino básico a cargo de Alex Posada,"<p><img src='https://hangar.org/webnou/wp-content/uploads/2015/03/arduinocolors-200x150.jpg' width='228' height='182' alt='Taller intensivo de Arduino básico a cargo de Alex Posada' /></p><p>En este taller intensivo se explicarán las metodologías y técnicas básicas de trabajo con Arduino. Arduino es una plataforma de hardware libre con la cual se pueden desarrollar todo tipo de proyectos de electrónica y computación física basados en microcontroladores, permite interactuar con sensores y controlar circuitos, luces y motores con sistemas inteligentes. El abanico de aplicaciones es muy amplio, tanto en el campo de la interactividad como de la robótica, la domótica, o la electróncia musical, por este motivo es una herramienta cada vez más utilizada por artistas que buscan explorar en sus obras los usos creativos de la tecnología.</p><p><a href='https://hangar.org/es/news/catala-taller-intensiu-de-arduino-basic-a-carrec-de-alex-posada/' target='_blank'>+info</a></p>",05/11/2015,,"Actividad, Hangar, Taller",1,Hangar,?
https://hangar.org/es/news/espanol-taller-de-herramientas-abiertas-para-agricultores-urbanos/,Taller de herramientas abiertas para agricultores urbanos,<p><img src='https://hangar.org/webnou/wp-content/uploads/2015/02/her-200x150.jpg' width='228' height='182' alt='Taller de herramientas abiertas para agricultores urbanos' /></p><p>null</p><p><a href='https://hangar.org/es/news/espanol-taller-de-herramientas-abiertas-para-agricultores-urbanos/' target='_blank'>+info</a></p>,03/19/2015,06/04/2015,"Actividad, Hangar, Taller",1,Hangar,?
https://hangar.org/es/hangar-sonor/non-representational-spatial-sound-composition-%e2%80%a8a-workshop-by-daniel-neumann%e2%80%a8%e2%80%a8/,“El sonido no representativo y su comportamiento en el espacio” 2 talleres de Wolfgang Gil y Daniel Neumann,"<p><img src='https://hangar.org/webnou/wp-content/uploads/2015/04/DNeumannFoto1_CT-SWaM_June222014sm_photobyEmilioVavarella-200x150.jpg' width='228' height='182' alt='“El sonido no representativo y su comportamiento en el espacio” 2 talleres de Wolfgang Gil y Daniel Neumann' /></p><p>2 talleres que exploran la espacializacion del sonido a cargo de los profesores: Daniel Neumann, quien desde el virtuosismo del ingeniero de sonido utiliza el altavoz creativamente como instrumento para hacer resonar el espacio; y  Wolfgang Gil experto en métodos no-lineales para la programacion del sonido asistida por ordenador.</p><p><a href='https://hangar.org/es/hangar-sonor/non-representational-spatial-sound-composition-%e2%80%a8a-workshop-by-daniel-neumann%e2%80%a8%e2%80%a8/' target='_blank'>+info</a></p>",06/02/2015,,"Actividad, Hangar, Taller",1,Hangar,?