https://www.facebook.com/events/1263789110311493/,"Inauguración ""Emboscada"", de Stefanie Herr","<p><img src='http://scontent.xx.fbcdn.net/t31.0-8/s720x720/14231231_1480123602013249_4401112808460568202_o.jpg' width='228' height='182' alt='Inauguración ""Emboscada"", de Stefanie Herr' />[cast] 
La Plataforma presenta la exposición ""Emboscada"", de Stefanie Herr. En un mundo supeditado a los vaivenes de la economía financiera, sin reglas y carente de leyes, inspirado únicamente en la codicia y el lucro, el Mercado constituye la principal fuerza creadora y se convierte en su verdadero escultor.
Bajo una premisa tan dura pero real, la obra presentada se inspira en la fantasía neoliberal del crecimiento económico infinito en un mundo finito. La artista se ha basado en los movimientos bursátiles para crear una serie de 6 esculturas fotográficas que ofrecen una visión distorsionada del mundo de igual forma que lo hace el capitalismo.

[cat]
La Plataforma presenta l’exposició “Emboscada”, d’Stefanie Herr. En un món supeditat als vaivens de l’economia financera, sense regles i amb mancança de lleis, inspirat únicament en la cobdícia i el lucre, el Mercat constitueix la principal força creadora i es converteix en el seu veritable escultor. 
Sota una premissa tan dura però real, l’obra presentada s’inspira en la fantasia neoliberal del creixement econòmic infinit en un món finit. L’artista s’ha basat en els moviments borsaris per crear una sèrie de 6 escultures fotogràfiques que ofereixen una visió distorsionada del món de la mateixa manera que ho fa el capitalisme. 

[eng]
La Plataforma presents the exhibition “Emboscada” (Ambush), by Stefanie Herr. In a world which is subordinate to the ups and downs of global economy, the Stock Market constitutes the main creative strength and becomes its true shaper.Starting from such a tough but unfortunately real premise, the German artist has created a series of photographic sculptures inspired by the neoliberal fantasy of infinite economic growth inside a finite world. The artist has created a series of 6 photographic sculptures based on the financial movements that offer a distorted point of view, just like capitalism does.</p><p><a href='https://www.facebook.com/events/1263789110311493/' target='_blank'>+info</a></p>",09/15/2016,,"Exposición, Espacios alternativos",La Plataforma,La Plataforma,0,1,1,1,,
https://www.facebook.com/events/1194988703878166/,Instalación Artística // Contexto de Jorge Rodríguez Gerada,"<p><img src='http://scontent.xx.fbcdn.net/t31.0-8/s720x720/14241591_1063225443799170_4996247371810286670_o.jpg' width='228' height='182' alt='Instalación Artística // Contexto de Jorge Rodríguez Gerada' />El reconocido artista cubano – americano Jorge Rodriguez-Gerada, hará una intervención artística en el espacio público, que consistirá en una obra de gran formato. La obra se realiza con la colaboración de Poblenou Urban District, Fab Lab Barcelona e IAAC > Institute for Advanced Architecture of Catalonia en la SUPERILLA de Poblenou. 

El artista utilizará para la obra la sombra que proyecta el recorrido del sol, y con ella se representará un mensaje que alude al impacto en favor del medioambiente.

CITA // Viernes 16 de 17h a 21h y Sábado 17 de 10h a 14h a través de la participación de Open Walls, se invitará a diferentes artistas plásticos a intervenir la obra junto con Rodríguez Gerada. 

La obra  estará ubicada en la calle Roc Boronat 117, frente al edificio MediaTIC y podrá visitarse del 12 al 22 de septiembre.</p><p><a href='https://www.facebook.com/events/1194988703878166/' target='_blank'>+info</a></p>",09/16/2016,09/17/2016,"Exposición, Espacios alternativos",Poblenou Urban District,"Carrer de Roc Boronat, 117, 08018 Barcelona (Barcelona), Espanya",0,1,1,1,,
https://www.facebook.com/events/1581778535460388/,Génesis Chapter V. Animales by SADDO,"<p><img src='http://scontent.xx.fbcdn.net/v/t1.0-9/s720x720/14264069_1176540615724965_1515517124058848720_n.jpg?oh=8fb326acb3e52fd39204a3a384afe9cb&oe=58795966' width='228' height='182' alt='Génesis Chapter V. Animales by SADDO' />Génesis V - ¨Animales¨

Después de 4 días duros de trabajo, en plena creación, viene el momento de presentaros el capítulo en el que Dios decidió crear el mundo de los animales. Volvemos a lo salvaje, donde ojo por ojo y diente por diente es la ley principal, donde nos convertimos en territoriales y defendemos nuestros instintos con una mirada que habla más que miles de palabras. Nos dirigimos al Este para encontrar nuestro próximo invitado - Saddo de Rumania. Él es uno de los primeros artistas de su país, donde creó un colectivo para artistas de la escena de arte urbano. Su estilo es como un balanceo al borde entre lo dulce y lo amargo, muerte y vida, animales y humanos… que nos lleva a una dimensión surrealista - medio Balcánica, medio europea. El día 28 de septiembre compartirá su arte en Metric Market, interpretando el quinto día de la creación con una obra interactiva de arte urbano en las paredes del espacio.</p><p><a href='https://www.facebook.com/events/1581778535460388/' target='_blank'>+info</a></p>",09/28/2016,,"Exposición, Espacios alternativos",Metric Market,Metric Market,0,1,1,1,,
https://www.facebook.com/events/643507665831045/,"Inauguració ""La música dels 60 dins i fora dels escenaris""","<p><img src='http://scontent.xx.fbcdn.net/v/t1.0-9/s720x720/14183902_902518309854508_286576991222765563_n.png?oh=7d32dc08d2c440a938b0126bd37e15d1&oe=5876CD3B' width='228' height='182' alt='Inauguració ""La música dels 60 dins i fora dels escenaris""' />Us convidem a la inauguració de la primera exposició de la temporada a la Casa Golferichs, ""La música dels 60 dins i fora dels escenaris"", una retrospectiva sobre l'etapa com a fotograf musical d'Horacio Seguí.

A través de la seva càmera, Seguí ha testimoniat durant dècades la vida esportiva al nostre país. Pocs coneixen que abans de la seva intensa i prolífica etapa com a fotògraf futbolístic, Seguí va retratar els músics i cantants més destacats dels anys seixanta, tant els de la Nova Cançó com els artistes internacionals que feien escala a la grisa Espanya del moment. 

“La música dels 60 dins i fora dels escenaris” serà la primera vegada que s’exposaran al públic les fotografies musicals d’Horacio Seguí - Archivo fotográfico. I per celebrar aquest esdeveniment únic, hem preparat activitats que no et voldràs perdre:

UNA CONVERSA AMB HORACIO SEGUÍ
Dijous 15 de setembre, 19 h
Conversa amb l’autor i la comissària, Gemma Fàbregas, on es farà un recorregut per la trajectòria professional de Seguí i explicarà algunes de les apassionants històries que amaguen les seves millors imatges.

ACTUACIONS MUSICALS
Dijous 15 de setembre, 20.30 h
Una de les idees que recorre l’exposició és la familiaritat de fotògraf i artistes. Gràcies a aquests vincles, alguns dels músics participaran a la inauguració de l’exposició, com l’Agustí de Los Diablos (Oficial) o en Santi de LOS MUSTANG

L'exposició es podrà visitar del 15 de setembre al 5 de novembre a la Casa Golferichs. De 17 a 21 h. Dissabtes, de 10.30 a 13.30 h. Entrada lliure.

Organitza: Espai de fotografia Francesc Català-Roca
Comissària: Gemma Fabregas
Amb la col·laboració de l’Arxiu Nacional de Catalunya  i VM FOTO</p><p><a href='https://www.facebook.com/events/643507665831045/' target='_blank'>+info</a></p>",09/15/2016,,"Exposición, Espacios alternativos",Espai de fotografia Francesc Català-Roca,Casa Golferichs,0,1,1,1,,
https://www.facebook.com/events/558650790989400/,Exposición: Proyecto Eclipse,"<p><img src='http://scontent.xx.fbcdn.net/t31.0-8/s720x720/14195193_1648609728785222_3111435820030076671_o.jpg' width='228' height='182' alt='Exposición: Proyecto Eclipse' />""Proyecto Eclipse es una plataforma creativa que nace de la comunión de nuestros afanes estéticos. Después de conocernos al trabajar juntos durante años en la profesión del tattoo en Barcelona, decidimos crear este proyecto colectivo para dar a conocer nuestra obra más personal y comercializar así nuestros propios productos. A pesar de nuestras diferencias creativas, compartimos una conexión especial a la hora de acercarnos a nuestra obra. Ese vínculo viene reforzado por la amistad que nos une, el interés por temáticas comunes y un sentido del humor bien memo y espantoso.""

Este será el evento de presentación del Proyecto Eclipse en sociedad, que es sinónimo del conjunto poderoso de los tatuadores Carlo, Rotor y David Tejero. Se exibirán y venderán obras originales de cada artista, así como otras piezas de merch únicamente disponibles el día de la inauguración.

Como siempre, los amigos de Moritz nos amenizarán con buen sabor, esta velada. 

¿Te apuntas? ;)

*** Aforo limitado ***</p><p><a href='https://www.facebook.com/events/558650790989400/' target='_blank'>+info</a></p>",10/20/2016,,"Exposición, Espacios alternativos","The Gallery, by Error","The Gallery, by Error",0,1,1,1,,
https://www.facebook.com/events/1632222373774493/,Inauguración de la expo de Sara Bea,"<p><img src='http://scontent.xx.fbcdn.net/t31.0-8/s720x720/14231214_586979641502391_6113527976977063799_o.jpg' width='228' height='182' alt='Inauguración de la expo de Sara Bea' />Volvemos a la carga con las exposiciones en ROOM 28  después de las vacaciones.
Esta vez inauguramos la exposición de la artista Sara Bea, que adornará nuestras paredes el mes de septiembre con sus cuadros. 
Os esperamos a todos!
Aquí tenéis más información sobre Sara Bea:
http://sarabea.com/</p><p><a href='https://www.facebook.com/events/1632222373774493/' target='_blank'>+info</a></p>",09/10/2016,,"Exposición, Espacios alternativos",ROOM 28,ROOM 28,0,1,1,1,,