https://www.facebook.com/events/310426015986642/,XIII Exposició Internacional d’Art Contemporani de Petit Format,"<p><img src='http://scontent.xx.fbcdn.net/t31.0-8/s720x720/14241580_1006182122838567_8003114524607569033_o.jpg' width='228' height='182' alt='XIII Exposició Internacional d’Art Contemporani de Petit Format' />MXESPAI presenta a LA XINA A.R.T.
XIII Exposició Internacional d’Art Contemporani de Petit Format


El Llibre dels passatges de Walter Benjamin ens situa en el París de principis del segle XX, un nou territori urbà en el qual s'està i pel qual es circula reflectint, una vegada i una altra, una quotidianitat passada, plena d'assoliments convertits avui en deixalles d'una modernitat a la deriva. El París de Benjamin és un exemple de com una ciutat es recorre a través de les seves cites i els seus textos fragmentaris.

El nostre lema, aquesta vegada, és el que apel·la a la lectura d'una ciutat a través de les seves petites produccions, els seus creadors i creadores i els seus textos.

Amb aquesta proposta posem en marxa la XIII Exposició Internacional d’Art Contemporani de Petit Format, amb la mirada posada en la ciutat com la porta d’entrada a preguntes, carregades de reflexions, sobre el paper de l’art, interpel·lant-nos-en sobre la nostra realitat com a artistes, sobre les nostres responsabilitats com a professionals d’una activitat cada vegada més desterritorialitzada i emmarcada en l’espai social comú.

Talment com en convocatòries anteriors el nostre objectiu és que sigui, una vegada més, no pas només una exposició d’art, sinó una suma de gestos d’art actual. Per aquest motiu oferim un tema, amb la finalitat de contextualitzar-lo i de donar coherència i sentit a l’exposició. Treballar amb una idea ens obliga a pensar en un sentit, en una direcció, fent una reflexió més intensiva sobre el perquè d’allò que fem.

Cada obra és un petit espai de temps suspès. Una cartografia de temps dibuixats. Un espai artificial que a través del llenguatge visual ordena el nostre pensament i ens adverteix perquè no confiem en la seva bellesa. Són instruments, estructures i esquemes de caràcter interdisciplinari. Els jugadors d’aquest joc han desplegat el seu quefer creatiu com si es tractés d’una llei inexorable que els situa en la investigació del propi joc.

Per a nosaltres és un plaer donar a artistes de tot arreu l’oportunitat de mostrar llurs treballs a Barcelona. Des de la I Exposició Internacional d’Art Contemporani de Petit Format i fins ara, hem comptat amb les obres de més de 500 artistes de més de 50 països diferents.

Participants com Ane Henriksen, Goro Nagano, Gyöngy Laky, Hannelle Ollakka, Junko Suzuki, Benxamín Álvarez, Hideho Tanaka, Helga Borisch, Carles Pujol, Benet Rossell, Carles Hac Mor, Carlos Martínez, Lone Villaume, Maija Paavola, Martí Ribas, Aurèlia Muñoz, Hee Oh Myung, Akiko Kotani, Carmen de los Llanos, Ursula Gerber Senger, Yuu Izaki, Pere Noguera, Cecilia Postiglioni, Katharina Gun Oehlert, Marina Ramoneda, Yukimaro, Ade Boyle, Ester Xargay, Marta Darder, Jordi Benito i un llarg etcètera, han fet exposicions individuals en el que va ser el nostre espai fins ara, des de l'any 1999: l’MX ESPAI 1010 del carrer Llibreteria.

Però és en aquesta edició en què MXESPAI 1010, amb la col·laboració de La Xina A.R.T. de Barcelona, la galeria Artèria d'Igualada i la galeria Himmelreich de Magdeburg, presenta aquesta exposició amb la participació de més de 150 artistes, dels quals presentem els 43 escollits pel nostre jurat.

Entre ells, podrem trobar obres de Mireia Clotet, Babette Werth, Pia Remedios, Xesco Mercé, Joseph Warren, Anne Moreno, Kioko Kumai, Marta Ballvé, Tito Inchaurralde, Úrsula Gerber, Ana Pulido o Helga Borish, artistes que treballen un cop més, obres amb tècniques multidisciplinaris, han fet que enguany aquesta exposició sigui un lloc de reflexió, on el teixit és part de la revelació de la idea i la trama és matèria, concepte i part del relat.

MXESPAI 1010 / Marga Ximenez / Nora Ancarola


Títol: “XIII Exposició Internacional d’Art Contemporani de Petit Format”
Autors: VV.AA. (organitza MXESPAI 1010)
Espai: La Xina A.R.T., Hort de la bomba 6, 08001 Barcelona
Dates: del 16 de Setembre al 14 d'Octubre de 2016
Horari: De dijous a dissabte de 17:30 a 20:30 h. També visites concertades: 678452653
Inauguració: divendres 16 de Setembre a les 19:30 h 


	 
  	

El Libro de los pasajes, de Walter Benjamin nos sitúa en el París de principios del siglo XX, un nuevo territorio urbano en el que se está y por el que se circula reflejando, una y otra vez, una cotidianidad pasada, llena de logros convertidos hoy en desechos de una modernidad a la deriva. El París de Benjamin es un ejemplo de cómo una ciudad se recorre a través de sus citas y sus textos fragmentarios.

Nuestro lema, esta vez, es el que apela a la lectura de una ciudad a través de sus pequeñas producciones, sus creadores y sus textos.

Con esta propuesta ponemos en marcha la XIII Exposició Internacional d’Art Contemporani de Petit Format, con la mirada puesta en la ciudad como la puerta de entrada a preguntas, cargadas de reflexiones, sobre el papel del arte, interpelándonos sobre nuestra realidad como artistas, sobre nuestras responsabilidades como profesionales de una actividad cada vez más desterritorializada y enmarcada en el espacio social común.

Tal como en convocatorias anteriores, nuestro objetivo es que sea, una vez más, no sólo una exposición de arte, sino una suma de gestos de arte actual. Por este motivo ofrecemos un tema, con el fin de contextualizarlo y de dar coherencia y sentido a la exposición. Trabajar con una idea nos obliga a pensar en un sentido, en una dirección, haciendo una reflexión más intensiva sobre el porqué de lo que hacemos.

Cada obra es un pequeño espacio de tiempo suspendido. Una cartografía de tiempo dibujados. Un espacio artificial que a través del lenguaje visual ordena nuestro pensamiento y nos advierte que no confiamos en su belleza. Son instrumentos, estructuras y esquemas de carácter interdisciplinario. Los jugadores de este juego han desplegado su quehacer creativo como si se tratara de una ley inexorable que los sitúa en la investigación del propio juego.

Para nosotros es un placer dar a artistas de todas partes la oportunidad de mostrar sus trabajos en Barcelona. Desde la I Exposició Internacional d’Art Contemporani de Petit Format hasta ahora, hemos contado con las obras de más de 500 artistas de más de 50 países diferentes.

Participantes como Ane Henriksen, Goro Nagano, Gyöngyi Laky, Hannelle Ollakka, Junko Suzuki, Benxamí Álvarez, Hideho Tanaka, Helga Borisch, Carles Pujol, Benet Rossell, Carles Hac Mor, Carlos Martínez, Lone Villaume, Maija Paavola, Martí Ribas, Aurèlia Muñoz, Hee Oh Myung, Akiko Kotani, Carmen de los Llanos, Ursula Gerber Senger, Yuu Izaka, Pere Noguera, Cecilia Postiglioni, Katharina Gun Oehlert, Marina Ramoneda, Yukimaro, Ade Boyle, Ester Xargay, Marta Darder, Jordi Benito y un largo etcétera, han hecho exposiciones individuales en el que fue nuestro espacio hasta ahora, desde el año 1999: el MXESPAI 1010 de la calle Llibreteria.

Pero es en esta edición en la que MXESPAI 1010, con la colaboración de La Xina A.R.T. de Barcelona, la galería Arteria de Igualada y la galería Himmelreich de Magdeburgo, presenta esta exposición con la participación de más de 150 artistas, de los que presentamos los 43 escogidos por nuestro jurado.

Entre ellos, podemos encontrar obras de Mireia Clotet, Babette Werth, Pia Remedios, Xesco Mercé, Joseph Warren, Anne Moreno, Kioko Kumai, Marta Ballvé, Tito Inchaurralde, Úrsula Gerber, Ana Pulido o Helga Borish, artistas que trabajan una vez más, obras con técnicas multidisciplinares, han hecho que este año esta exposición sea un lugar de reflexión, donde el tejido es parte de la revelación de la idea y la trama es materia, concepto y parte del relato.

MXESPAI 1010 / Marga Ximenez / Nora Ancarola

Título: “XIII Exposició Internacional d’Art Contemporani de Petit Format”
Autores: VV.AA. (organiza MXESPAI 1010)
Espacio: La Xina A.R.T., Hort de la bomba 6, 08001 Barcelona
Fechas: del 16 de Septiembre al 14 de Octubre de 2016
Horario: De dijous a dissabte de 17:30 a 20:30 h. También visitas concertadas: 678452653
Inauguración: viernes 16 de Septiembre a las 19:30 h</p><p><a href='https://www.facebook.com/events/310426015986642/' target='_blank'>+info</a></p>",09/16/2016,09/17/2016,"Exposición, Espacios alternativos",La Xina A.R.T,La Xina Art,0,1,1,1,,
https://www.facebook.com/events/638597999637905/,"Art and Speculative Futures - International Conference, Barcelon","<p><img src='http://scontent.xx.fbcdn.net/t31.0-8/s720x720/14206010_1074983789265163_349859021409852219_o.jpg' width='228' height='182' alt='Art and Speculative Futures - International Conference, Barcelon' />Thinking about art from the prism of speculation may involve the creation of alternative futures. Introducing doubt, babbling, the “what ifs”, counter-memory against the ideal need of a primal origin (or source of meaning where we recognise each other) and being open to discontinuity, chance and materiality in history means asking ourselves if it is possible to both make and think about art in different ways. If it is possible to envision another history from other horizons of meaning, not so much to pursuit its truth but to question the meaning and the value embedded in the stories of our truths. This conference thus proposes to speculate about futures as contemporary fables producing truth effects imbued with ethical and political significance.

This conference seeks to explore not only one but multiple senses, not one but multiple and diverse art histories, ignored or omitted, including artists, materials, technologies or excluded geopolitical zones of repeated and commonly accepted stories. Such histories of art are to be investigated and revealed from a cosmopolitical scope that is aimed at building a common space where no one can claim the right to choose the central point of view from which a subject must be addressed. A space of coexistence of the otherness without the need of articulating consensus: a space of coexistence in the divergence that accounts for our constitutive heterogeneity.

Organized by the the research groups Art Globalization Interculturality and AASD - Art, Architecture and Digital Society from the University of Barcelona (UB), the research group Mediaccions from the  Open University of Catalonia (UOC), CCCB and Arts Santa Mònica.  27th, 28th, and 29th October, 2016.

-------------------------------------------------------------------------------------------

Conference attendance is free! Please fill out this form to register: https://docs.google.com/forms/d/1Mh6-qyriODToaJkypcl124-8NSDM4Lt4LQAV3aAyGKk

Check out the programme and keynotes: https://artfuturesconference.wordpress.com/eng/programme/</p><p><a href='https://www.facebook.com/events/638597999637905/' target='_blank'>+info</a></p>",10/27/2016,10/29/2016,"Exposición, Espacios alternativos",Art and Speculative Futures,Centre de Cultura Contemporània de Barcelona,0,1,1,1,,
https://www.facebook.com/events/1097024983668603/,"Exposición ""Epílogo"" de Nathalie Rey+Adrián Pino&Concierto Pësh","<p><img src='http://scontent.xx.fbcdn.net/t31.0-8/s720x720/14207752_1840827836136638_5537071597595008177_o.jpg' width='228' height='182' alt='Exposición ""Epílogo"" de Nathalie Rey+Adrián Pino&Concierto Pësh' />Estimados ""vuelta y vuelta"" lacontrianos,

en los últimos deambuleos por rayos veraniegos, volvemos a los interiores de unas paredes que esperan cándidas y candescentes a vuestros cuerpos tostados y mentes de vida alegre. Este 9 de septiembre volvemos a abrir tras el descanso de agosto con la inauguración de la Exposición ""Epílogo"", pinturas y esculturas de Nathalie Rey + Performance de Adrián Pino + Concierto de ""Pësh"" (Rock & Soul), a la espera de que el descanso no se hastió en olvido.

- 19h. Inauguración del Exposición ""EPÍLOGO"" de Nathalie Rey.

Empezar el año por un punto final... Propósito extraño, pero atractivo…
 
Uno no escoge el momento de iniciar o cerrar un ciclo; es parte de las vicisitudes de la creación artística. A pesar de ya haber anunciado el final del ciclo de los apilamientos unos meses atrás, en esta exposición Nathalie Rey se desnuda y despoja en esta oportunidad de celebrarlo con todo el fausto necesario...
 
Los “Tas” nacieron de la necesidad de establecer una especie de catálogo de las ideas que le han obsesionado siempre. Hoy esta tarea está acabada, lo que le permite pasar con más seguridad a otra etapa de su trabajo que desea más libre.
 
De las 20 obras que constituyen la temática de los apilamientos, Nathalie Rey ha querido enseñar los 5 grandes formatos, por el placer de verlos expuestos juntos al menos una vez, y la instalación de los pingüinos de madera en una disposición nueva. El resto, algunas de las obras que le han permitido hacer la transición hacia el trabajo en curso...
 
http://nathalierey.canalblog.com/

-20h. ""MONA LISASS"". Performance de Adrián Pino.

-20:30h. Concierto de ""Pësh"" (Rock & Soul)

Pësh es el alter ego de Santi Carcasona, batería curtido en mil batallas y que ahora aparca los palos para rasgar el ukelele y cantar, con gusto indie y sonoridad cruda, sus composiciones recogidas en el disco “Where The Sidewalk Ends” (Petits Miracles, 2016).

El inicio de Pësh se debe a la inspiración que, por un lado, vinieron de los poemas del polifacético norteamericano Shel Silverstein y, por la otra, del universe compositivo que se esconde dentro de un ukulele. La influencia de artistas como Eels, The Beatles, Dave Matthews, The Who o Tom Waits ha permitido que Pësh consigan un sonido y un sello totalmente particular. Una fusión entre el carácter y el sonido crudo americano y toque británico.

El disco ha sido grabado en La Fusteria Estudi, produciso por Santi Carcasona y Toni Pagès, mezclado por Carles Ribera, y masterizado en Aurha Estudis por Mauricio Tonelli.  Pësh ha contado con la colaboración de Toni Pagès (batería), Sergi Riera (bajo), Santi Careta (guitarra), JJ Caro (teclado), Ona Pla y Nacho Melús (voces) y la contribución de Magí Batalla y Amadeu Casas (guitarra) y Mercè Martínez (voz).
​
https://www.youtube.com/watch?v=mW66MWAXhUM
https://www.youtube.com/watch?v=zhxXtjAKX1s
​https://www.youtube.com/watch?v=UHKR896bQdw

Entrada Libre y de Gorra
​</p><p><a href='https://www.facebook.com/events/1097024983668603/' target='_blank'>+info</a></p>",09/09/2016,,"Exposición, Espacios alternativos",Lacontra Artnocal,Lacontra,0,1,1,1,,