event_image-src,event_venue,event_link,event_link-href,event_title1,event_start,event_end,event_organizer,event_title2,event_text,event_cost__0,event_category__Exposición__Galerías,event_maplink__1,event_id
http://www.artbarcelona.es/wp-content/uploads/2016/04/marti-anson-se-vende-plaza-de-parking.jpg,Galería Estrany – de la Mota,,http://www.artbarcelona.es/es/exposiciones/se-vende-plaza-de-parking/,Martí Anson,,15.04.16 – 17.06.16,Galería Estrany – de la Mota,Se vende plaza de parking,"La Galeria Estrany–de la Mota tiene el placer de presentar la primera exposición individual del artista Martí Anson. El proyecto Se vende plaza de parking parte de un estudio del crecimiento urbano y como este ha propiciado progresivamente una carencia de suelo urbanizable en los núcleos urbanos. Mediante una instalación site-specific que modificará irónicamente la arquitectura y los usos habituales del espacio expositivo de la galería, el artista realizará una reflexión acerca de las transformaciones y la reutilización de los espacios arquitectónicos muertos mediante la utilización de estos para otras actividades temporales. Según los estudios recientes, el 79,20% del territorio de Barcelona está urbanizado, con el mismo ritmo de construcción, se pronostica que el territorio urbanizable de la ciudad se agotará entre 2018 y 2021. Frente a este fenómeno, los arquitectos abogan por otros modelos constructivos más enfocados en reformular los espacios existentes, sobretodo aquellos considerados muertos. Un ejemplo de este tipo de prácticas es la de aprovechar espacios urbanos como azoteas para la construcción de huertos o zonas verdes. Otro ejemplo, es como de forma inconsciente se han ido utilizando los garajes particulares de las viviendas unifamiliares para otro tipo de actividades como el almacenaje o el bricolaje. Estos espacios, como espacios que pertenecen a la vivienda, pero que por su naturaleza están lo suficientemente apartados de ella, también han sido el lugar idóneo para ser los primeros locales de ensayo o como los primeros despachos de lo que luego han sido grandes empresas, como es el caso del antiguo garaje de Palo Alto (California) donde se fundó la empresa Hewlett–Packard en 1939. Con el paso del tiempo este fenómeno de la reutilización de los espacios para guardar vehículos ha afectado también a los parkings de las grandes superficies. En Estados Unidos, por ejemplo, es habitual como se reutilizan para otras actividades como, por ejemplo, lugares en los que aprender a conducir o reapropiados como espacios de reunión para hacer barbacoas. Este marco es el punto de partida de Martí Anson para el proyecto Se vende plaza de parking, en el que sigue investigando sobre la modificación de los espacios arquitectónicos para generar un estado de incertidumbre. El artista levanta unas expectativas que siempre se ven frustradas, porque en realidad, su único fin es el de generar expectativas en si mismas. Crea situaciones paradógicas en las que aparentemente nunca pasa gran cosa generando, de este modo, espacios de suspensión. La instalación formalmente es una réplica pop de un garaje, en la que el artista reproduce en el espacio expositivo los diferentes elementos que, sin ser conscientes, tenemos interiorizados y nos permiten identificar este tipo de espacios. Una retícula blanca como elemento de ordenación que delimita el espacio que puede ocupar cada uno de los coches, el suelo gris que continúa en las paredes con una altura de un metro que protege la superficie de los golpes, la franja granate de unos quince centímetros que permite tener un referente visual para calcular las distancias con las paredes en el momento de aparcar o la presencia de un vehículo en el propio espacio de la galería. Copiando estos elementos arquitectónicos y desplazándolos de un lugar a otro genera en el espectador una situación de extra- ñeza, hace desconocido lo ordinario, aquello a lo que estamos acostumbrados. Un recurso que el artista ya ha utilizado con anterioridad en otros proyectos como Martí i la fàbrica de farina [Martí y la fábrica de harina] (2009). Al igual que plantean los arquitectos y los urbanistas, frente al fenómeno de falta de espacio urbanizable, el artista recupera un espacio en desuso de la galería (el hall de entrada) para darle una nueva función. A la vez que lo convierte en otra cosa, deja de ser un lugar de contemplación y las modificaciones espaciales que realiza intensifican su inutilidad, convirtiéndolo en un espacio para reflexionar sobre el significado del arte y su finalidad. Genera estados de suspensión en los que aparentemente no sucede nada, pero los pequeños detalles permiten abrir la reflexión a otros temas como el trabajo (Fizcarraldo, 2005), el patrimonio (Martí i la fàbrica de farina, 2009) o el cooperativismo (Pavelló Català. Arquitecte anònim [Pavellón Catalán. Arquitecto anónimo] 2013–2015). En Se vende plaza de parking recupera la condición discursiva de todo su trabajo y la tensión que este establece con la contemporaneidad. Nos habla de la paradoja del arte, el resultado de un gran esfuerzo por parte de un creador que muchas veces no tiene un efecto concreto, se trata de una obra que muchas veces solo es comprensible por si misma y que hace hincapié en la falta d’utilidad del propio arte.",null,null,null,http://www.artbarcelona.es/es/exposiciones/se-vende-plaza-de-parking/
http://www.artbarcelona.es/wp-content/uploads/2016/04/marti-anson-se-vende-plaza-de-parking.jpg,Galería Estrany – de la Mota,,,Martí Anson,15.04.16 – 17.06.16,15.04.16 – 17.06.16,Galería Estrany – de la Mota,Se vende plaza de parking,,null,null,null,http://www.artbarcelona.es/es/exposiciones/se-vende-plaza-de-parking/
http://www.artbarcelona.es/wp-content/uploads/2016/03/Joana-Pimentelagenda.jpg,Galería Alejandro Sales,,http://www.artbarcelona.es/es/exposiciones/mujeres/,"Carmen Calvo,  Esther Ferrer, Susi Gómez, Sara Huete, Cori Mercadé, Jane Mulfinger , Sonia Navarro i Joana Pimentel.",,10.03.16 – 29.04.16,Galería Alejandro Sales,Mujeres,"Coincidiendo que el día 8 de marzo es el día Internacional de la mujer, Galería Alejandro Sales presenta, el jueves 10, una selección de fondos de la galería con obras de mujeres artistas y que no se habían expuesto con anterioridad.
Esta selección es una muestra de la diversidad de técnicas que el arte contemporáneo hoy nos ofrece, desde la fotografía, el collage y por supuesto la pintura.
No voy hacer en esta nota de prensa una enumeración de las artistas que en la exposición estarán presentes porque es un homenaje a todas las mujeres artistas.
Alejandro Sales",null,null,null,http://www.artbarcelona.es/es/exposiciones/mujeres/
http://www.artbarcelona.es/wp-content/uploads/2016/04/7.jpg,RocioSantaCruz,,http://www.artbarcelona.es/es/exposiciones/il-y-a-bien-du-monde-aujourdhui-a-versailles/,LLuís Hortalà,,14.04.16 – 21.05.16,RocioSantaCruz,“Il y a bien du monde aujourd’hui a Versailles”,"Trampantojo o el ilusionismo del poder
Diálogo con Alejandro de la Sota:

- “sabe usted que es un trono papal?” me preguntó

- “no sabría qué decirle” contesté

- y responde Alejandro de la Sota “Es una silla elevada el cuadrado”.
De esta forma simple, como la magnífica propuesta arquitectónica de su iró- nico Gobierno Civil de Tarragona, De la Sota descubre cómo el poder actúa en la vida para crear boato, grandeza y ostentación, promoviendo obras artísticas legitimadoras de su poder. Ahora háganse la pregunta de si es posible conver- tir un trono papal en una silla. La respuesta es que no, no es posible. La razón de esta imposibilidad es que, cuando la pátina del poder alcanza un objeto, éste queda maldecido por la altura a la que es elevado, donde el escalador del poder acabará teniendo mal de altura al intentar alcanzarla, y se le será nega- do al objeto volver a su forma humilde y popular. Lo máximo que podremos hacer para combatir su grandeza es desposeerla de su capacidad de represen- tación del poder. Para conseguirlo tenemos en nuestras manos tres caminos: su destrucción, combatirla desde de la ironía y la sátira, o apropiándonos artísticamente de ella. Sólo de esta forma podemos despojarla de su mirada altiva, de su capacidad de seducción.
Lluis Hortalà, con sus dos chimeneas, habitantes destacados de Versalles, ha elegido el camino de la apropiación de la forma y el significado de poder para mostrarlas como espejos de nuestra condición humana. Las dos representa- ciones de chimeneas son reproducciones de las que podemos ver en el Salón du Jeu de Madame Dubarry y en el cabinet du billard de Marie Antoinette. Dos piezas recreadas por Hortalà para reflejar nuestras flaquezas, nuestras ansias de mostrarnos al mundo como perpetuos ganadores. Las dos chimeneas
de Lluis Hortalà son un magnífico exponente de cómo el poder pervierte la hoguera en la cueva o en el bosque para sobrevivir al frío invierno para con- vertirla, al elevarla al cuadrado, en una construcción ostentosa que alcanza a tener más luminosidad que las llamas del fuego a las que debería servir, con- virtiendo el fuego sagrado en un fuego fatuo. Incluso en no fuego pues están hechas, no para calentar y dar refugio, sino para exhibirse. En sus dos chi- meneas, el pesado mármol de las originales han sido sustituidos por simples planchas de madera y óleo. Y es que para Hortalà pesan más las ideas que el mármol. Son chimeneas trampantojos que engañan el ojo pero no la mirada,



pues tienen la capacidad de hacernos pensar que todo nace en el fuego de

las pasiones y, entre ellas, la pasión por el poder es una de las que más arde

y quema nuestros sueños de gloria. En ellas, en su quietud expositiva, se nos sugiere que, si no las comprendemos como artefactos críticos, sucumbiremos a su promesa de inmortalidad.
El poder representado en las Chimeneas es el poder que ninguna llama puede calentar. El cuerpo frío del que ha alcanzado la gloria, sea por nacimiento, mé- ritos, o carambolas de la vida no será calmado por la danza de las llamas . De la misma forma que en el mito de la caverna de Platón, los hombres observan las sombras proyectadas en la pared de las cosas que suceden delante del fuego y no les permite ver la realidad, quedando atrapados en una ilusión, la chimenea de Hortalà nos ofrece la ilusión del poder al que estamos encadena- dos.
Una crítica directa y luminosa a los monumentos levantados por los hombres alejados de la realidad, que celebran el poder de unos pocos. Todos los tiem- pos han levantado chimeneas totalitarias. Todas los tiempos han levantado escenografías para esconderse del contacto con la realidad y disfrutar de una plenitud estética que aleje de la incertezas de la vida. Como en los frescos de la Villa de Livia en Prima Porta en Roma, donde en su jardín mágico los pájaros pintados parecen volar y nosotros con ellos. Y, sin embargo, tras las monu- mentales chimeneas de Versalles, hay artesanos, artistas que le confieren una dignidad que las rescata de la ostentación y el vacío que habita en toda exhi- bición. Como denunció Giovanni Bellori “Pues si una obra magnífica está pri- vada de la industria de los nobles artistas, no podrá atraer los ojos para que la admiren, sino que sólo se verá la ostentación de riquezas y tesoros gastados inútilmente...”
Hortalà nos convoca a ver y tocar los mármoles que han tiranizado a los pode- rosos en su afán de poseerlos.
Fèlix Riera",null,null,null,http://www.artbarcelona.es/es/exposiciones/il-y-a-bien-du-monde-aujourdhui-a-versailles/
http://www.artbarcelona.es/wp-content/uploads/2016/04/7.jpg,RocioSantaCruz,,,LLuís Hortalà,14.04.16 – 21.05.16,14.04.16 – 21.05.16,RocioSantaCruz,“Il y a bien du monde aujourd’hui a Versailles”,,null,null,null,http://www.artbarcelona.es/es/exposiciones/il-y-a-bien-du-monde-aujourdhui-a-versailles/
http://www.artbarcelona.es/wp-content/uploads/2016/04/Dionysius-Ear.-show.JPG,Galeria silvestre,,http://www.artbarcelona.es/es/exposiciones/la-oreja-de-dioniso/,"Ella Littwitz, Klaas Vanhee",,09.04.16 – 01.06.16,Galeria silvestre,La Oreja de Dioniso,"La Oreja de Dioniso es la cueva que uno de los más sangrientos tiranos de la Antigüedad utilizó para encerrar a los disidentes políticos. Dionisio I, también conocido por Dionisio el Viejo, transformó un antiguo depósito de agua que anteriormente había sido excavado en la roca para este fin, en la ciudad de Siracusa hacia el año 400 aC.
Caravaggio fue quien bautizó la cueva como la oreja del tirano, el año 1586, motivado por la extremadamente buena cualidad de su acústica: su grieta, un corte vertical que se abre en forma de lágrima, hace que cualquier sonido reverbere a lo largo de toda la gruta, por pequeño que éste sea. Cuenta la leyenda que Dionisio I encerraba aquí sus cautivos precisamente con el afán de mantenerse informado de los planes conspirativos que se urdían en su contra.
Ahora bien, si se atiende a la obra de Ella Littwitz (Haifa, Israel, 1982) y Klaas Vanhee (Mechelen, Bélgica, 1982), se puede llegar a poner en duda si lo que realmente Dionisio se proponía era encerrar en la cueva a los disidentes políticos o bien la potencia del eco en sí mismo. Aun la disparidad de los procesos e intereses que se dan en la obra de ambos, por lo menos una reflexión plana en toda la exposición: ¿qué es lo que hace peligroso al arte, su contenido o bien su capacidad para la reverberación?
Para Vanhee la materia es la alternativa a la prisión. La materia es aquello que siempre consigue escapar. Mientras que según una dicotomía constitutiva del pensamiento Occidental el cuerpo es lo que se supone que encierra el alma, en el caso de este artista es el cuerpo que se descubre como una caja infinita para la reverberación y, por lo tanto, como la posibilidad primigenia para la acción: todo aparece con este artista como mínimo desdoblado y en un estado permanente de multiplicación y desbordamiento.
Vanhee posiblemente no es capaz de empezar un dibujo si no es haciéndolo a la vez con las dos manos, o bien rehaciéndolo sobre otro de anterior, o bien haciéndolo, en una palabra, por medio de la reverberación directa sobre su propio cuerpo y el mundo exterior. Aquí no hay sitio para un reencuentro con la unidad ni con cualquier principio fundamental o de corte trascendental –un alma–, sino que precisamente es ésta que se descubre como aquello que ha intentado aprisionar el cuerpo y su potencialidad para su constante diseminación a lo largo de los siglos.
Para Littwitz es igualmente el diálogo con lo material lo que hace posible la emergencia de la identidad y la misma imaginación política. Su aproximación a la formación del Estado de Israel es una suerte de arqueología en los estratos de formación de una ideología: los pobladores judíos han requerido a lo largo del siglo XX desplegar un conjunto de estrategias para imponer su razón en la tierra Palestina, entre las cuales la reforestación ha sido una de las favoritas: se han plantado bosques, se han desviado ríos y se han levantado nuevas montañas. Equipos de arqueólogos, arquitectos y científicos han examinado hasta la planta o la piedra más recóndita, a fin de apropiársela y bautizarla con un nombre hebreo o bien, contrariamente, erradicarla del paisaje.
Pero la arqueología de Littwitz no parece tener como finalidad dar con una capa de historia fundamental y que sea más cierta que otra. Pues en todos los sedimentos encontramos una estrecha interrelación entre la construcción de los hechos y las narrativas: la división fundacional de la historiografía positivista se desvanece por completo cuando se descubre aquí que el hecho histórico no anticipa la narrativa, sino que el uno con la otra se conforman estrechamente. La solución que escoge la artista es, pues, sumarse al mismo proceso de reverberación que también mueve la historia: sus objetos condensan narrativas que se hacen eco de voces disidentes, al mismo tiempo que, con su apariencia ornamental, buscan ganar cierta capacidad de actuación en el mismo flujo de la historia.
El pensamiento disidente siempre ha sido una amenaza para los tiranos. Pero aun más amenazante es su capacidad para reverberar entre los cuerpos y desparramarse por el mundo. Se puede encarcelar a un disidente, pero tal y como Dionisio I demostró con su cueva, el reto de un tirano siempre será encarcelar el mismo eco; esto es, la misma posibilidad de un pensamiento otro.
El eco hace imposible la unidad y encerrar un sistema sobre si mismo. Cada nueva repetición nunca es totalmente idéntica respecto a la anterior. El eco es la posibilidad de la diferencia por si misma, un estado persistente de duplicidad y, por lo tanto, de inadecuación de cualquier identidad o representación que se presuman como únicos.
Igual que La Oreja de Dioniso, la exposición de Littwitz y de Vanhee busca funcionar como una cámara de resonancias. Todas las piezas que la componen se basan en estrategias de repetición. Los artistas dan continuidad, así, a fenómenos que buscan comprender de manera crítica, a la vez que los retuerzan por medio de intervenir en su tiempo de reverberación. La peligrosidad del arte recae justamente en esta capacidad: no se debe sólo a la posibilidad de dar lugar a un pensamiento crítico, sino que sobretodo a su capacidad de enraizarlo y amplificar su reverberación en el mundo.
Oriol Fontdevila.",null,null,null,http://www.artbarcelona.es/es/exposiciones/la-oreja-de-dioniso/
http://www.artbarcelona.es/wp-content/uploads/2016/04/B.-Rossell.-Gla--o-cua-animada.-MR.JPG,PALMADOTZE,,http://www.artbarcelona.es/es/exposiciones/la-penultima-cena/,"Evru, Robert Llimós, Miralda, Muntadas, Rabascall, Àngels Ribé, Benet Rossell, Jaume Xifra, Plantalech",,16.04.16 – 31.07.16,PALMADOTZE,“La penúltima cena”,"PALMADOTZE se complace en presentar la exposición “La penúltima cena”, metáfora del encuentro con la obra de nueve artistas vinculados a la galería. Diferentes propuestas con las que los artistas cuestionan el mundo dónde vivimos, un mundo en permanente transformación, que en las cinco últimas décadas ha sido escenario de profundos cambios políticos, económicos y sociales.
Cambios que han hecho emerger una nueva sensibilidad y un “nuevo” mundo en las condiciones de vida o las libertades personales y colectivas: El desarrollo de la democracia, el capitalismo, la industria, la tecnología o los movimientos migratorios, entre muchos otros, han dado forma a una época “generosa” en transformaciones que han influido también la concepción y la práctica del arte. La herencia de las vanguardias o la irrupción de movimientos como el arte conceptual, comportaron multitud de nuevas actitudes, manifestaciones y medios de expresión como el arte de acción, el videoarte, el Body Art o el Net Art, que los artistas no dudaron utilizar para comprender, denunciar o aportar algo a favor del bienestar social. Es pues, la creatividad comprometida y reveladora, el ingrediente común de las propuestas de esta “penúltima cena”.",null,null,null,http://www.artbarcelona.es/es/exposiciones/la-penultima-cena/
http://www.artbarcelona.es/wp-content/uploads/2016/04/B.-Rossell.-Gla--o-cua-animada.-MR.JPG,PALMADOTZE,,,"Evru, Robert Llimós, Miralda, Muntadas, Rabascall, Àngels Ribé, Benet Rossell, Jaume Xifra, Plantalech",16.04.16 – 31.07.16,16.04.16 – 31.07.16,PALMADOTZE,“La penúltima cena”,,null,null,null,http://www.artbarcelona.es/es/exposiciones/la-penultima-cena/
http://www.artbarcelona.es/wp-content/uploads/2016/04/Dionysius-Ear.-show.JPG,Galeria silvestre,,,"Ella Littwitz, Klaas Vanhee",09.04.16 – 01.06.16,09.04.16 – 01.06.16,Galeria silvestre,La Oreja de Dioniso,,null,null,null,http://www.artbarcelona.es/es/exposiciones/la-oreja-de-dioniso/
