"EVENT NAME","VENUE NAME","ORGANIZER NAME","START DATE","START TIME","END DATE","END TIME","ALL DAY EVENT?","CATEGORIES","EVENT COST","EVENT WEBSITE","SHOW MAP LINK?","SHOW MAP?","EVENT DESCRIPTION","EVENT IMAGE"
"EnAct#24 / 15 Diciembre / The White Gallery / Bcn","The White Gallery","EnAct","12/15/2017","","","",1,"Exposición, Espacios alternativos","0","https://www.facebook.com/events/126118324841707/",1,1,"<p><img src='http://scontent.xx.fbcdn.net/v/t31.0-8/s720x720/25311113_1753592288008735_3221619950188062401_o.jpg?oh=13af84ce954eb03b735066402541d7df&oe=5AC7E18C' width='228' height='182' alt='EnAct#24 / 15 Diciembre / The White Gallery / Bcn' />And we are backkkk<br />El 15 de diciembre presentamos la edición 24 de EnAct... Hay que celebrarlo que además contamos con 3 años de labor artístico consecutivo en este mundillo tan encantador y avasallador como el Arte de las Acciones!!!<br /><br />Mirar este cartel y flipaaaa<br /><br />............<br /><br /><br />#Víctor López<br />PHONO SONUS<br /><br />""Víctor López es poeta y artista sonoro. En su actuación se fusionan Spoken Word, cantos y músicas ancestrales y atmósferas sonoras, a partir de la voz y el apoyo tecnológico de una pedalera de loops para la voz.""<br /><br />https://phonosonus.wordpress.com/<br /><br /><br />-----------------------<br /><br />#Topia<br />ESCAPA<br /><br />Topia es defineix com aquest lloc on qualsevol cosa pot succeir i, a més succeix. Som un grup obert de dones que es reuneix per treballar i jugar entorn la pràctica artística de l'art d'acció.<br /><br />La accion ""Escapa"" ha sido creada a partir del particular espacio expositor que The White Gallery nos ofrece.<br /><br /><br />------------------------<br /><br /><br />#Maria João Flôxo <br />MOVIMIENTO#2: OBJECTO <br /><br />El objecto como elemento de trabajo y estudio... que es? / como es? / sentirse en su espacio /  ser él objecto / su resistencia / <br />Serie de ejercicios de conocimiento del objecto e de uno con el objecto.<br /><br /><br />-------<br /><br />No te lo pierdas ya que es el último de 2017!! Ahahahahah ahahahah<br /><br />Viernes 15 diciembre<br />20h / Taquilla inversa<br /><br />The White Gallery<br />Carrer Entença 7, 08015 Barcelona <br />Www.thewhitegallery.org</p>","https://scontent.xx.fbcdn.net/v/t31.0-8/s720x720/25311113_1753592288008735_3221619950188062401_o.jpg?oh=13af84ce954eb03b735066402541d7df&oe=5AC7E18C"
"7º Aniversario de La Plataforma","La Plataforma","La Plataforma","12/15/2017","","12/16/2017","",1,"Exposición, Espacios alternativos","0","https://www.facebook.com/events/133821443945357/",1,1,"<p><img src='http://scontent.xx.fbcdn.net/v/t31.0-8/s720x720/25352180_2147242711967998_4559150683741501990_o.jpg?oh=c81fcce5a232b21306561f921b2bbea8&oe=5AD6CE73' width='228' height='182' alt='7º Aniversario de La Plataforma' />cast. Este fin de semana se cumplen 7 años desde que La Plataforma abrió sus puertas. Y esto hay que celebrarlo. Por eso, la galería presenta una programación doble. <br />El viernes 15 de diciembre de 19h a 22h ven a disfrutar de una sesión de Afterwork & Art, donde te invitamos a cerveza mientras visitas de la séptima edición de Arte & Venta, expo colectiva donde encontrarás arte de todos los formatos, disciplinas, tamaños, precios y gustos. <br />El sábado 16, de 11h a 14h, ven al Vermut & Art, donde te invitaremos a vermut y podrás conocer algunos de los artistas de la exposición, como Asis Percales Underground o Daniel Páez Fernández Ilustrador (autor de la obra de la portada, titulada ""Cumpleaños total""). <br /><br />cat. Aquest cap de setmana es compleixen 7 anys des que La Plataforma va obrir les seves portes. I això s'ha de celebrar. Per aquest motiu, la galeria presenta una programació doble. <br />El divendres 15 de desembre de 19h a 22h vine a gaudir d'una sessió d'Afterwork & Art, on et convidarem a cervesa mentre visites la setena edició d'Arte & Venta, expo col·lectiva on trobaràs art de tots els formats, disciplines, mides, preus i gustos. <br />El dissabte 16, de 11h a 14h, vine al Vermut & Art, on et convidarem a vermut i podràs conèixer alguns dels artistes de l'exposició, com ara Asis Percales Underground o Daniel Páez Fernández Ilustrador (autor de l'obra de la portada, titulada ""Cumpleaños total"").   <br /><br />eng. This weekend it'll be 7 years since La Plataforma opened its doors. And that implies a celebration. For that reason, the gallery presents a double program. <br />On Friday the 15th of December, from 7pm to 10pm, come and enjoy a session of Artwork & Art, in which we'll invite you to a beer while you visit the seventh edition of Arte & Venta, the collective show that gathers art in all formats, disciplines, sizes, prices and tastes. <br />On Saturday the 16th of December, from 11h to 14h, come to the Vermouth & Art, where we'll invite you to drink a vermouth and where you'll be able to meet some artists of the exhibition like Asis Percales Underground and Daniel Páez Fernández Ilustrador (author of the cover artwork, titled ""Cumpleaños total"").</p>","https://scontent.xx.fbcdn.net/v/t31.0-8/s720x720/25352180_2147242711967998_4559150683741501990_o.jpg?oh=c81fcce5a232b21306561f921b2bbea8&oe=5AD6CE73"
"Jordi Bernadó & Quimet Sabaté. The Spirit of Imagination","galeria SENDA","galeria SENDA","12/14/2017","","","",1,"Exposición, Espacios alternativos","0","https://www.facebook.com/events/148370862599544/",1,1,"<p><img src='http://scontent.xx.fbcdn.net/v/t31.0-8/s720x720/25073097_1538578432901350_8144940335631760135_o.jpg?oh=aaa37f54e58d21f05fa2f88ecf97b84f&oe=5AC9334C' width='228' height='182' alt='Jordi Bernadó & Quimet Sabaté. The Spirit of Imagination' />En The Spirit of Imagination, nos encontramos ante la historia del<br />cruce de caminos entre Jordi Bernadó y Quimet Sabaté a partir de un encuentro casual. La ambigüedad, la paradoja y la distorsión de Bernadó se combinan con las ficciones superpuestas por Sabaté y dan como resultado un juego de espejos que ahonda en el concepto de representación como simulacro y cuestiona los limites de autoría y de los derechos del uso de la imagen. <br />-<br />A The Spirit of Imagination, ens trobem davant la història de camins creuats entre Jordi Bernadó i Quimet Sabaté a partir d'una trobada casual. L'ambigüitat, la paradoxa i la distorsió de Jordi Bernadó es combinen amb les ficcions superposades per Quimet Sabaté i donen com resultat un joc de miralls que aprofundeix en el concepte de representació com a simulacre i qüestiona els limitis de l'autoria i dels drets de l'ús de la imatge.</p>","https://scontent.xx.fbcdn.net/v/t31.0-8/s720x720/25073097_1538578432901350_8144940335631760135_o.jpg?oh=aaa37f54e58d21f05fa2f88ecf97b84f&oe=5AC9334C"
"Inauguración 50 de Diciembre","Fifty Dots Gallery","Fifty Dots Gallery","12/14/2017","","","",1,"Exposición, Espacios alternativos","0","https://www.facebook.com/events/547997688880352/",1,1,"<p><img src='http://scontent.xx.fbcdn.net/v/t31.0-8/s720x720/25074825_2087743358138275_8028922468342759573_o.jpg?oh=7824c1844d3cff14e90585e6eaed42c9&oe=5A8A6297' width='228' height='182' alt='Inauguración 50 de Diciembre' />Este mes de diciembre celebramos la exposición 50 de Diciembre, una colectiva donde mostrar una pequeña selección del trabajo de nuestros artistas, un total de 50 obras seleccionadas que permanecerán expuestas en nuestra galería hasta el 8 de febrero de 2018, también podrás conocer nuestra nueva zona de Fifty Dots Editions, donde podrás encontrar una selección de fotolibros, láminas y ediciones especiales de nuestros artistas.</p>","https://scontent.xx.fbcdn.net/v/t31.0-8/s720x720/25074825_2087743358138275_8028922468342759573_o.jpg?oh=7824c1844d3cff14e90585e6eaed42c9&oe=5A8A6297"
"Instalación y presentación Libro artistas La Escocesa 2016","La Escocesa","La Escocesa","12/15/2017","","","",1,"Exposición, Espacios alternativos","0","https://www.facebook.com/events/1946590148890116/",1,1,"<p><img src='http://scontent.xx.fbcdn.net/v/t31.0-8/s720x720/23847177_10155352828434833_8948636751100492166_o.jpg?oh=201ee009f3ab6b37b448c5a6353ae5be&oe=5AD14CD1' width='228' height='182' alt='Instalación y presentación Libro artistas La Escocesa 2016' />[Instalación y presentación Libro artistas La Escocesa 2016]<br /><br />Para despedir el año en la fábrica celebramos una fiesta-presentación del Libro-catálogo de artistas La Escocesa 2016. <br /><br />Instalación · Conciertos · Pintura y Moritz bien fresquita!<br /><br />Conciertos:<br />Dry men<br />Extremo Nihilismo en Barcelona<br />https://barcelona.bandcamp.com/album/extremo-nihilismo-en-barcelona <br /><br />[ARTISTAS Catálogo La Escocesa]<br />Andrea Leria / Mireia TL / Guillermo Moreno Mirallas / Zosen / Mina Hamada / Hugo Orlandini / Òtica / Mazza Gianfranco / Montse Valls / Guillermo Carrion / Marla Jacarilla / Juan Francisco Segura Martinez / Llapispanc / Ricard Casabayo/  Tamara Zaitseva / Idoia Montón / Xavi Vilagut /Mike Swaney/ Chris Haslam/ Alejandra Hernandez /Alfredo Quiroz <br /><br />Os esperamos!<br /><br />Artwork by Zosen</p>","https://scontent.xx.fbcdn.net/v/t31.0-8/s720x720/23847177_10155352828434833_8948636751100492166_o.jpg?oh=201ee009f3ab6b37b448c5a6353ae5be&oe=5AD14CD1"
"Soundpainting","The White Gallery","The White Gallery","12/16/2017","","","",1,"Exposición, Espacios alternativos","0","https://www.facebook.com/events/1603617613060324/",1,1,"<p><img src='http://scontent.xx.fbcdn.net/v/t31.0-8/p720x720/25188801_955659067931960_2330572435317608518_o.jpg?oh=2fe9c76106e2f5057af50dd8acb94abe&oe=5A8935AF' width='228' height='182' alt='Soundpainting' />We come together for a collective impro of different performace arts. We learn a gesture based language (soundpainting) to compose music, dance, drawing, poetry or lectronics in a life setting. <br />Rule 1 -There is no mistake<br />Rule 2 -If you doubt if yes or no, its yes!<br />This is a collective improvisation attempts to connected different people with different histories. It creates a non-judgemental space for spontaneous expressions...<br />Everyone welcome. Free...<br />Bring instruments, paintining, light material, fabriks, vegetables, electronics, toys..whatever.<br />Soundpainting workshohp . 3 pm<br />Performace</p>","https://scontent.xx.fbcdn.net/v/t31.0-8/p720x720/25188801_955659067931960_2330572435317608518_o.jpg?oh=2fe9c76106e2f5057af50dd8acb94abe&oe=5A8935AF"
"The Invention of the New World - pinturas de Nicolas Freytag","Werner Thöni Artspace","Werner Thöni Artspace","12/14/2017","","","",1,"Exposición, Espacios alternativos","0","https://www.facebook.com/events/1890794537900764/",1,1,"<p><img src='http://scontent.xx.fbcdn.net/v/t31.0-8/s720x720/24837267_1570329823015159_5372363082308297585_o.jpg?oh=06bdfa9b8a9e8cf8785fd74dad98ebc5&oe=5ACDD13E' width='228' height='182' alt='The Invention of the New World - pinturas de Nicolas Freytag' />Nicols Freytag<br />The Invention of the New World<br /><br />Es el primer capítulo de una serie de pinturas, titulado The Age of Discovery. Las obras exploran el Nuevo Mundo, no topográficamente, sino a través de la iconografía que inspiró la Conquista.  <br /><br />The first chapter of a series called The Age of Discovery, these paintings explore the New World. Not so much its topography as the iconography that the Conquista inspired.</p>","https://scontent.xx.fbcdn.net/v/t31.0-8/s720x720/24837267_1570329823015159_5372363082308297585_o.jpg?oh=06bdfa9b8a9e8cf8785fd74dad98ebc5&oe=5ACDD13E"