event_title1,event_title2,event_image-src,event_text,event_start,event_end,event_venue,event_link,event_link-href,event_organizer__MACBA,event_category__Exposición__MACBA__Arte contemporáneo,event_maplink__1,event_cost__10,event_id
"Carlos Bunga","Carlos Bunga","http://www.macba.cat/uploads/20150515/8.6.JPG","Residente en Barcelona desde 2009, Carlos Bunga(Oporto, 1976) es uno de los artistas portugueses con mayor proyección internacional. Su obra consiste fundamentalmente en construcciones y arquitecturas efímeras realizadas con cartón y pintura que crean espacios de contraste, pieles interiores en edificios concretos.



Esta es la primera exposición del artista en su ciudad de acogida. La propuesta de Carlos Bunga para la Capella dels Àngels trata de establecer conexiones entre la función originaria de la Capella como espacio de culto religioso y el propio contexto urbano, invitando a reflexionar sobre los modelos de ciudad contemporánea, su validez y su utilidad.","null","null","MACBA","","http://www.macba.cat/es/expo-carlos-bunga/1/exposiciones/expo","null","null","null","null","/es/expo-carlos-bunga/1/exposiciones/expo"
"La bestia y el soberano","","http://www.macba.cat/uploads/20150319/La_bestia_i_el_sobira.2.4.png","Esta exposición explora cómo las prácticas artísticas contemporáneas cuestionan y deshacen la definición occidental y metafísica de la soberanía política: el modo en que estas proponen maneras de entender la libertad y la emancipación que exceden el marco de la autonomía individual, así como la forma moderna del Estado-nación.



La exposición toma el título del último seminario impartido por Jacques Derrida en 2002-2003, dedicado a analizar los límites de la soberanía política en la tradición metafísica. La bestia y el soberano encarnan, para el filósofo francés, las dos figuras alegóricas de lo político que se han situado históricamente más allá de la ley: la bestia supuestamente desconocedora del derecho y el soberano cuyo poder se define precisamente por su capacidad de suspender el derecho. Esta división ontoteológica produce una serie de oposiciones binarias de género, clase, especie, sexualidad, raza o discapacidad que estructuran relaciones de dominación. Por un lado, la bestia entendida como animalidad, naturaleza, feminidad, el sur, el esclavo, el sitio colonial, el sujeto no blanco, lo anormal. Por otro, el soberano que representa lo humano o incluso lo sobrehumano, Dios, el Estado, la masculinidad, el norte, el sujeto blanco y sexualmente normal. ¿Cómo pensar la soberanía más allá del poder? ¿Cómo producir soberanía cuestionando estas relaciones de dominación? 



Con obras de Efrén Álvarez, Ángela Bonadies y Juan José Olavarría, Peggy Buth, Martin Dammann, Ines Doujak y John Barker, Juan Downey, Edgar Endress, Oier Etxeberria, León Ferrari, Eiko Grimberg, Masist Gül (presentado por Banu Cennetoğlu y Philippine Hoegen), Ghasem Hajizadeh, Jan Peter Hammer, Geumhyung Jeong, Glenda León, Julia Montilla, Rabih Mroué, Ocaña, Genesis Breyer P-Orridge, Prabhakar Pachpute, Mary Reid Kelley, Jorge Ribalta, Hans Scheirl, Wu Tsang, Stefanos Tsivopoulos, Yelena Vorobyeva y Victor Vorobyev, Sergio Zevallos.



Comisarios: Hans D. Christ, Iris Dressler, Paul B. Preciado y Valentín Roma.

Exposición organizada y coproducida por el Museu d’Art Contemporani de Barcelona (MACBA) y el Württembergischer Kunstverein (WKV)  Stuttgart.","19 mar.","30 ago. 2015","MACBA","","http://www.macba.cat/es/expo-bestia-soberano/1/exposiciones/expo","null","null","null","null","/es/expo-bestia-soberano/1/exposiciones/expo"
"Bouchra Khalili","Presentación del film ""Garden Conversation""","http://www.macba.cat/uploads/20150317/KHALILI_GARDEN_CONVERSATION_2.3.jpg","Garden Conversation parte de un hecho histórico del que se ha hablado mucho, pero que no está documentado: el encuentro en la embajada marroquí en El Cairo, en enero de 1959, de Ernesto «Che» Guevara (1928-1967) con el exiliado marroquí, antiguo héroe de la Guerra del Rif, Abdelkrim El Khattabi (1882-1963). Precursor de la lucha anticolonialista, Khattabi se había enfrentado a dos ejércitos, el francés y el español, y había inventado y puesto a prueba modernas tácticas de guerrilla que inspiraron a muchos líderes independentistas, como Ho Chi Minh y el propio Che Guevara.



Cincuenta y cinco años después de aquel encuentro, y casi tres desde el inicio de la Primavera Árabe, Bouchra Khalili examina una hipótesis en forma de meditación poética: de qué hablarían los espectros de Guevara y de Khattabi si se encontrasen hoy en día. Siguiendo las tesis de Walter Benjamin en Sobre el concepto de historia y la idea de «fantología» (hantologie) tal como la definió Jacques Derrida en Espectros de Marx (1993), la artista entiende la historia como una constelación de vestigios del pasado que se ciernen sobre el presente y lo conforman, y acaban abriendo una ventana para la percepción de un potencial futuro.



En el caso de Garden Conversation, Khalili utiliza una serie de desplazamientos en términos de historia, geografía, lenguaje y planteamiento visual, que le permitan construir su hipótesis: «¿Qué sucedería si un chico y una chica árabes se encontrasen, encarnando literalmente las palabras de Guevara y de Khattabi, para hablar de la lucha, sus medios y sus objetivos? ¿Y si cada uno de ellos hablara en su lengua –árabe marroquí y árabe iraquí– y sin embargo se entendieran perfectamente? ¿Y decidieran encontrarse en un lugar que es todavía una posesión colonial, una de las más antiguas del mundo? ¿Y la conversación se produjese en un espacio heterópico –mitad jardín, mitad bosque– que limita, por un lado, con un campo de entrenamiento militar español; por otro, con el mar; y finalmente con una valla, que aísla la ciudad del territorio marroquí y que, desde hace casi veinte años, sirve para impedir que los migrantes alcancen este rincón de Europa dentro del continente africano?». Como dice uno de los personajes en la película:



Por eso lo más importante

es preparar las mentes para su anhelo más eterno,

el derecho de los pueblos a decidir.



La obra de Khalili nos recuerda que, desde la segunda mitad del siglo XX, los procesos de emancipación nacional han estado determinados por visiones radicales, de cambio profundo de la sociedad. Garden Conversation escenifica las condiciones en las que los ideales independentistas e ideales revolucionarios se perciben como sombras de la historia, confrontadas a la realidad del presente. 



Nacida en Marruecos en 1975, Bouchra Khalili realiza trabajos en vídeo, ya sea monocanal o en formato de instalación, desde 2002. Este medio le permite eludir las fronteras entre disciplinas y desarrollar su obra a medio camino entre el cine y las artes visuales, el documental y la obra experimental. Sus vídeos exploran el área mediterránea como un territorio dedicado a una existencia errante y nómada. La artista produce representaciones de la dimensión mental de esos espacios situándolos en una experiencia perceptiva insólita, y de este modo ofrece un testimonio de la realidad contemporánea de la emigración. 



Khalili ha mostrado su trabajo en numerosas exposiciones colectivas por todo el mundo. Ha recibido varios premios y distinciones, entre los que destacan el Abraaj Group Award en 2014, el DAAD de Berlín en 2012, el Premio al mejor proyecto en el Festival LOOP de Barcelona en 2011 y el Premio Louis Lumière en Francia, en 2005.","17 abr.","28 jun. 2015","MACBA","","http://www.macba.cat/es/expo-bouchra-khalili-garden-conversation/1/exposiciones/expo","null","null","null","null","/es/expo-bouchra-khalili-garden-conversation/1/exposiciones/expo"
"Deseos y necesidades","Nuevas incorporaciones a la Colección MACBA","http://www.macba.cat/uploads/20150515/3.6.jpg","Deseos y necesidades. Nuevas incorporaciones a la Colección MACBA presenta 86 obras que reúnen adquisiciones realizadas en los últimos tres años –de las que más de la mitad se muestran por primera vez al público– junto con obras que ya formaban parte de la Colección. 



La exposición Deseos y necesidades se articula en torno a ocho capítulos centrados en grupos de obras que abarcan un abanico cronológico de más de seis décadas. La Colección MACBA, que actualmente cuenta con casi 6.000 obras, ha incorporado trabajos de características muy diversas: desde la atención a nuestro clasicismo del arte contemporáneo –la pintura abstracta de los años cincuenta y sesenta, donde se sitúa el trabajo de Esteban Vicente– y la abstracción racional y no expresionista, de inspiración matemática o minimalista, con Esther Ferrer o Néstor Sanmiguel, hasta obras significativas de artistas centrales en el discurso construido por el Museo en las últimas décadas como son John Baldessari, Richard Hamilton, Pablo Palazuelo, Joan Brossa, Marcel Boodthaers, Öyvind Fahlström, Dieter Roth o Muntadas. 



También se incluyen en ella nuevas voces del arte actual como Patricia Dauder, Francesc Ruiz o Mireia Sallarès, y artistas consolidados como Gego, Antoni Llena, Dora García o Francesc Abad. Las propuestas de Younès Rahmoun, Sigalit Landau, Walid Raad y Wael Shawky 2 centran la atención en la creatividad en el norte de África y Oriente Medio. Otras obras, como las de Ali Cherri o Adrian Melis, nos invitan a plantearnos la vigencia de los medios de comunicación como auténtico poder que escribe la historia. Los trabajos de Richard Hamilton y João Maria Gusmão + Pedro Paiva reflejan la fascinación que la innovación científica ha ejercido sobre el arte moderno. Por otra parte, los cambios sociales y culturales que la economía global imprime en nuestra sociedad se evidencian en las aportaciones de Octavi Comeron y Marc Pataut. El papel de la fotografía también está presente con trabajos de Allan Sekula y Jorge Ribalta.



El título de esta presentación de la Colección MACBA se inspira en Algunos objetos de deseo, la obra de Lawrence Weiner que preside, desde 2009, el atrio del edificio Meier. Este espacio empieza a funcionar como pórtico o porche entre el Museo y la Plaça dels Àngels y articulará pronto uno de los museos más urbanos. La obra de Weiner nos avisa y nos invita a relativizar nociones tales como los valores que asignamos a la propiedad y la fragilidad de la vida y todo lo que nos rodea, cuando nos vemos sometidos a los efectos de las «fuerzas mayores» que parecen actuar en nuestro mundo. 



Deseos y necesidades está dedicada a la memoria de Richard Hamilton, uno de los artistas fundamentales para comprender el arte del siglo XX y, probablemente, de una gran parte del siglo XXI. Hamilton estuvo en el origen de la invención del término «pop art» a mediados de los años cincuenta. Gran amigo del MACBA, pasó largas temporadas en Cadaqués. Allí, a través de su amistad con Marcel Duchamp y con Lanfranco Bombelli, atrajo a numerosos miembros de las vanguardias internacionales y creó un vínculo con artistas de la escena local. En ella podrá verse una obra excepcional: la emblemática exposición Growth and Form, creada por el artista y presentada en el ICA de Londres en 1951.","null","null","MACBA","","http://www.macba.cat/es/expo-coleccion-macba-2015/1/exposiciones/expo","null","null","null","null","/es/expo-coleccion-macba-2015/1/exposiciones/expo"
"Iman Issa","Heritage Studies","http://www.macba.cat/uploads/20150428/PAMM_ISSA_LHOOQ_0012.6.jpg","Iman Issa (El Cairo, 1979) construye su obra con un material que no es físico: apoyándose en la ficción, exacerba la tensión entre los objetos y las palabras, los nombres y adjetivos que utiliza para describirlos. 



En palabras de la crítica de arte Kaelen Wilson-Goldie: «Podríamos decir que la obra de Issa trata de una sustracción radical. Coge el caso de una ciudad, una estructura, un monumento, un memorial, un cartel electoral, un conflicto político, un espacio abierto o una historia evocadora; luego suprime sus especificidades y borra los detalles que lo definen.» Issa utiliza procedimientos convencionales de presentación museológica, como vitrinas, pedestales, etiquetas, cartelas y textos en vinilos, para crear marcos para sus objetos y relatos que se sitúan fuera de un lugar o tiempo concretos. En su obra, la historia se convierte en un ejercicio de narración ahistórica  que puede concernirnos a todos.



Iman Issa vive y trabaja entre El Cairo y Nueva York. A finales de 2012 recibió el 1er Premio Fundación Han Nefkens - MACBA de Arte Contemporáneo. El propósito de este galardón es ayudar a consolidar la trayectoria de creadores que, a pesar de tener una carrera consistente, necesitan el reconocimiento de la comunidad artística internacional, así como fomentar la creación artística contemporánea internacional en Barcelona. El proyecto de Issa, que inicialmente debía ser ejecutado en un espacio público de la ciudad, se ha transformado en una exposición que presentará una nueva fase de su obra Heritage Studies.



Heritage Studies se inició en 2015. El título de este nuevo corpus escultórico procede del ámbito interdisciplinario de la investigación académica y del conocimiento aplicado en relación con la comprensión y el uso de la historia. En este proyecto, Issa explora los artefactos históricos que, a su juicio, tienen alguna repercusión en el momento actual. Poniendo énfasis en la escala y el material, sus esculturas reinterpretan los artefactos históricos a los que aluden las cartelas: un medio formal de explorar las implicaciones de los objetos originales y sus reverberaciones a lo largo del tiempo. Aunque las formas que propone Issa no son en absoluto réplicas, intentan conjurar un ethos compartido o un potencial comunicativo con sus puntos de referencia iniciales. En definitiva plantean la pregunta: ¿cómo puede un objeto servir o eludir un plan de acción oculto?



La exposición también incluye la pieza de audio The Revolutionary (2010), que teje un relato en torno al término «revolucionario» y el significado o significados que pueda evocar. Escrita por la artista y generada mediante un software de conversión texto-habla, la obra presenta un enigmático retrato biográfico de una figura política radical.



Las exposiciones más recientes de Iman Issa, ya sean individuales o colectivas, se han presentado en el Perez Art Museum, Miami; 12a Bienal de Sharjah; 8a Bienal de Berlín; MuHKA, Amberes; Tensta Konsthall, Spånga; New Museum, Nueva York; y KW Institute of Contemporary Art, Berlín. Sus libros incluyen Common Elements, publicado por el Glasgow Sculpture Studios en 2015, y Thirty-three Stories about Reasonable Characters in Familiar Places, publicado por el SculptureCenter de Nueva York en 2011. En 2013, Issa recibió el Abraaj Group Art Prize. La artista imparte clases en la Cooper Union School of Art de Nueva York.","21 mayo","28 jun. 2015","MACBA","","http://www.macba.cat/es/expo-iman-issa-heritage-studies/1/exposiciones/expo","null","null","null","null","/es/expo-iman-issa-heritage-studies/1/exposiciones/expo"
"Miserachs","Barcelona","http://www.macba.cat/uploads/20150514/4387_770x498.3.jpg","Xavier Miserachs. Barcelona es una muestra que culmina el trabajo de ordenación, catalogación y conservación del fondo del fotógrafo barcelonés (Barcelona, 1937 - Badalona, 1998), depositado al MACBA en 2011.



La exposición se centrará en la construcción de un imaginario visual que recorra la ciudad de Barcelona, articulado a partir del fotolibro Barcelona. Blanco y Negro (1964). El proyecto, comisariado por el historiador de la fotografía, ensayista y editor Horacio Fernández, se desarrollará a través de la propuesta museográfica del estudio de arquitectura Langarita-Navarro.



Esta muestra es un reconocimiento a la intensa relación de Xavier Miserachs con Barcelona y su influencia decisiva en la construcción de uno de los itinerarios fotográficos de la ciudad. Además, se presenta como un ejemplo del tratamiento y el cuidado del patrimonio fotográfico, que pone de manifiesto la voluntad de hacer visibles al público los materiales conservados en el Centro de Estudios y

Documentación MACBA.



El proyecto se acompañará de la publicación del fotolibro

Miserachs. Barcelona, en coedición con la editorial RM, y de un manual de ensayos sobre el fotógrafo.","18 sep. 2015","10 ene. 2016","MACBA","","http://www.macba.cat/es/expo-xavier-miserachs/1/exposiciones/expo","null","null","null","null","/es/expo-xavier-miserachs/1/exposiciones/expo"
"Especies de espacios","","http://www.macba.cat/uploads/20150420/2969.0.jpg","Si nos preguntamos sobre el marco por el que transcurre nuestra vida, podríamos convenir que, para obtener una explicación de nuestro mundo, debemos referirnos tanto a su realidad temporal como a su realidad espacial. Es decir, tanto a la categoría que se desarrolla entre un comienzo y un final –y que está sometida a una mutación constante– como a aquella donde todo sucede porque todo lo abarca y donde todo tiene lugar. En consecuencia, junto a la posibilidad de entender nuestra vida como lo que somos entre el nacimiento y la muerte, también es posible acercarse a ella de modo fragmentario y sobre los cimientos de los espacios por los que se desarrolla y evoluciona. 



Obviando que la linealidad de nuestra existencia depende de los dictados de un azar que, por mucho que nos apliquemos, nunca logramos dominar por completo, hemos establecido el punto de partida de nuestro proyecto basándonos en los lugares por los que transcurre. Es decir, en los espacios que nos pueden definir en función del uso que hacemos de ellos.



En el desarrollo de esta aventura, Georges Perec –conocido, entre otras cosas, por su tendencia obsesiva a listar lo que pasa cuando no pasa nada o lo que se nota y que nunca anotamos– se perfila a nuestro juicio como el guía más adecuado. Así, además de ser el autor del libro que da título a la exposición, Perec nos proporciona la pista de los espacios a los que queremos acceder, al margen de cualquier voluntad enciclopédica y abriendo interrogantes en torno a los significados que pudieran tener para cada uno de nosotros.



Concebida a la manera de un edificio fragmentado espacialmente según la tipología que Perec establece en su libro Especies de espacios, la exposición reúne una selección de obras escogidas por su capacidad de remitir a las áreas en las que actuamos, somos, nos movemos, pensamos y vivimos. Es decir, a unos espacios que, vistos a través de los ojos de un artista, nos aproximan al significado que pudieran tener para nosotros a través de producciones específicas, de obras pertenecientes a la Colección u otras que, por razones de diversa índole, se nos antojan como el contrapunto ideal para forzar a la imaginación a buscar lo que mejor defina el modo en que los usamos.



Más que una exposición de tesis, archivo o documentación, nuestra propuesta para Especies de espacios se debe entender como una interpretación libre de un libro en su deriva por algunos de los recovecos del espacio público y privado, la intimidad y la vida social, lo que somos y lo que ven de nosotros. En suma, como la deriva de la existencia humana, desde el espacio mínimo y acotado de una página hasta la imposibilidad de poner límites a una idea de espacio en general. 



Comisario: Frederic Montornés

Producción: Museu d'Art Contemporani de Barcelona","16 jul. 2015","31 ene. 2016","MACBA","","http://www.macba.cat/es/expo-especies-de-espacios/1/exposiciones/expo","null","null","null","null","/es/expo-especies-de-espacios/1/exposiciones/expo"
"Sergi Aguilar","Reverso / Anverso (1972-2015)","http://www.macba.cat/uploads/20150209/05.4.jpg","La trayectoria de Sergi Aguilar (Barcelona, 1946) cuestiona algunos de los principales paradigmas que, en el contexto español, han venido narrando el lenguaje de la escultura desde principios de los setenta hasta la actualidad. Al mismo tiempo, vista en perspectiva, su obra relativiza la vigencia que tienen hoy algunas interpretaciones de corte formalista. Esta posición incómoda con el relato historiográfico y con sus códigos de lectura, con las genealogías generales y con ciertos análisis específicos, no solo afecta al escultor barcelonés, sino a toda una generación de artistas cuyo trabajo evolucionó desbordando aquellas adscripciones que un día los identificaron.



Reverso / Anverso (1972-2015) es una exposición que recorre, como una suerte de travesía sinuosa, los más de cuarenta años de práctica escultórica de Aguilar, compilando sus investigaciones entre objeto y proceso, sus piezas de hierro y sus herramientas, sus experimentos con las nociones de escala y acumulación, sus homenajes a Blinky Palermo o Giovanni Anselmo, así como los conjuntos de dibujos, fotografías y secuencias audiovisuales desarrolladas durante toda su andadura. 



La muestra se articula a partir de cuatro episodios que invitan al diálogo entre obras y ciclos temáticos de distintas épocas. La idea de continuidad –opuesta a los tradicionales conceptos de inicio, evolución y corolario– preside esta puesta en valor museográfica, donde el artista ha tratado de «desnudar» la arquitectura del edificio del MACBA, recreando para ello las lógicas y la atmósfera de su propio espacio de trabajo.

 



Producción: Museu d'Art Contemporani de Barcelona","04 jun. 2015","31 ene. 2016","MACBA","","http://www.macba.cat/es/expo-sergi-aguilar/1/exposiciones/expo","null","null","null","null","/es/expo-sergi-aguilar/1/exposiciones/expo"
