web-scraper-order,web-scraper-start-url,event_title1,event_title2,event_image-src,event_text,event_start,event_end,event_venue,event_link,event_link-href,event_organizer__MACBA,event_category__Actividad__MACBA,event_maplink__1,event_cost__,event_id
1517593821-106,http://www.macba.cat/es/actividades,Parlem de... Brossa,"Con Oriol Vilanova, artista",https://www.macba.cat/uploads/20170921/Foto_19_9_17_9_59_07.2.jpg,"PARLEM DE… POESÍA BROSSA

Con Eduard Escoffet, Teresa Grandas, Oriol Vilanova, Ester Xargay y  Isabel de Naveran



El programa Parlem de quiere generar espacios de debate, a partir de las exposiciones del museo, entre distintos agentes y artistas de la ciudad y el público que nos visita. Es un espacio de encuentro que entiende las exposiciones como poderosos dispositivos activadores de la imaginación y generadores de discursos que a menudo exceden aquellos previstos por la institución o preconcebidos por el equipo curatorial.",07 oct. 2017,24 feb. 2018,MACBA,,https://www.macba.cat/es/parlem-de-joan-brossa/1/all/activ,null,null,null,null,/es/parlem-de-joan-brossa/1/all/activ
1517593769-78,http://www.macba.cat/es/actividades,Germán Labrador. Luces efímeras. Estéticas ciudadanas y orden neoliberal,Conferencia PEI Obert,https://www.macba.cat/uploads/20180108/imagen_german_labrador.4.jpg,"¿Cuáles son las formas de una crisis neoliberal? ¿Cómo se producen, formalizan, reconocen y circulan? ¿A qué sirven y por medio de qué estrategias? ¿Se encuentran en disputa? A partir del análisis de varias figuras surgidas de la última crisis global, Germán Labrador plantea una reflexión sobre qué puede significar actualmente una práctica estética emancipadora bajo el neoliberalismo y cuál puede ser el lugar de la crítica cultural en ese contexto. Nos interesarán experiencias artísticas civiles sucedidas en los últimos diez años, en diferentes escalas, así como posibles transferencias entre arte, información y activismo y entre culturas populares y dispositivos de dominio de carácter estatal, espectacular, y corporativo. 



Germán Labrador es profesor asociado en el departamento de Lenguas y Culturas Españolas y Portuguesa de la Universidad de Princeton desde 2008. Sus intereses incluyen la historia cultural y literaria, los estudios de la memoria, la poesía, los movimientos sociales y las culturas urbanas. Su área de investigación principal es la España moderna y contemporánea. Antes de Princeton impartió clases en la Universidad de Salamanca y en la Universidad de Hamburgo. Entre sus múltiples publicaciones, destacan Letras arrebatadas. Poesía y química en la transición española (2009) sobre un grupo de poetas clandestinos españoles y su relación con las utopías psicodélicas de 1968 hasta el consumo de heroína en los años ochenta, y Culpables por la literatura. Imaginación política y contracultura en la transición española (2014).",21 mar. 2018,null,Auditori Meier,,https://www.macba.cat/es/german-labrador--luces-efimeras-esteticas-ciudadanas-y-orden-neoliberal/1//activ,null,null,null,null,/es/german-labrador--luces-efimeras-esteticas-ciudadanas-y-orden-neoliberal/1//activ
1517593788-87,http://www.macba.cat/es/actividades,Jornada de puertas abiertas,Festividad de Santa Eulalia,https://www.macba.cat/uploads/20180131/MACBA_171212_126.1.jpg,"Con motivo de la festividad de Santa Eulalia, patrona de Barcelona, el MACBA celebra una jornada de puertas abiertas que permitirá la visita libre a las exposiciones en curso:



- Colección MACBA. Bajo la superficie 

- Poesía Brossa 

- Rosemarie Castoro. Enfocar al infinito 



Asimismo, de 12 a 13.30 h, las familias que lo deseen podrán participar gratuitamente en el taller familiar ¡Guau, bup, warf!, dirigido por la artista Laura Llaneli.",18 feb. 2018,null,,,https://www.macba.cat/es/jornada-de-puertas-abiertas-santa-eulalia/1//activ,null,null,null,null,/es/jornada-de-puertas-abiertas-santa-eulalia/1//activ
1517593775-81,http://www.macba.cat/es/actividades,FOCUS #2 Outfest UCLA Legacy Project,Comisariado por Cheryl Dunye,https://www.macba.cat/uploads/20171229/TWW_Alternative__1_.2.jpg,"En el año 2005, el UCLA Film and Television Archive, junto con Outfest ―organización formada por los estudiantes de UCLA en 1982―, fundaron el Outfest UCLA Legacy Project, un proyecto en torno a la preservación de la imagen LGTB en movimiento. El material disponible incluye trabajos experimentales, programas de televisión, anuncios y vídeos musicales, entre otros. Más de 35.000 piezas que hacen del Legacy Project uno de los principales archivos audiovisuales en torno a la cultura LGTB.



FOCUS #2 se centrará en el trabajo de selección de Cheryl Dunye sobre el Outfest UCLA Legacy Project. Dunye es la directora de The Watermelon Woman, considerado el primer largometraje de temática abiertamente queer dirigido por una directora negra y lesbiana. La película, que la propia Cheryl Dunye califica como «Dunyementary», nos muestra un híbrido entre el documental, la comedia y la autobiografía, intercalado todo ello con cabezas parlantes y entrevistas con transeúntes, que narran la búsqueda de Cheryl de Watermelon Woman (la mujer del melón), una actriz negra cuyas apariciones como sirvienta habían sido numerosas en el cine en blanco y negro de los años treinta.



Coincidiendo con su 20 aniversario, The Watermelon Woman, que abrirá el ciclo, ha sido restaurada y remasterizada digitalmente gracias al apoyo de Outfest UCLA Legacy Project, junto con 13th Gen, Toronto International Film Festival y First Run Features.",9,11 mar. 2018,,,https://www.macba.cat/es/focus-2-outfest-ucla-legacy-project/1//activ,null,null,null,null,/es/focus-2-outfest-ucla-legacy-project/1//activ
1517593765-76,http://www.macba.cat/es/actividades,Idiorritmias,"Programa de performance, música, laboratorio y texto",https://www.macba.cat/uploads/20180202/Asamble_Amalia_Pica_Idioritmies_18_fot_Dani_Canto.3.jpg,"En 1977 Roland Barthes inicia una serie de conferencias en el Collège de France que más tarde publicará bajo el título Cómo vivir juntos. En este curso Barthes explora el concepto de idiorritmia, que sirve de eje para este programa anual que ahora, cuarenta años después, tuvo su inicio. Con el término de idiorritmia, Barthes presenta su propuesta utópica de comunidad y explora el modo en que esta se podría configurar mediante la combinación del tiempo personal y el de la vivencia colectiva. Para ello, se basa en una idea de ritmo anterior a la de Platón: un ritmo no numérico que aspira más a la fluidez que a la ordenación. Este concepto sirve de punto de partida a Idiorritmias, un programa centrado en el trabajo en torno a las prácticas performativas e impulsado por el deseo poético de construir, desde la institución y a través de la acción, una comunidad imperfecta, efímera e inestable; de teorizar en colectivo y de reflexionar sobre el potencial del cuerpo en una esfera pública dominada por la palabra. 



Programa comisariado por Soledad Gutiérrez, comisaria independiente, y Pablo Martínez, jefe de Programas del MACBA.",2,05 mayo 2018,,,https://www.macba.cat/es/idiorritmias-2018/1//activ,null,null,null,null,/es/idiorritmias-2018/1//activ
1517593830-111,http://www.macba.cat/es/actividades,Parlem de... Rosemarie Castoro. Enfocar al infinito,"Con Carmelo Salazar, coreógrafo",https://www.macba.cat/uploads/20171106/Rosemarie_Castoro_Red_Pink_Green_Gray_1965.0.jpg,"PARLEM DE… ROSEMARIE CASTORO. ENFOCAR AL INFINITO

Con Tanya Barson, Mariana Cánepa y Carmelo Salazar



El programa Parlem de quiere generar espacios de debate, a partir de las exposiciones del museo, entre distintos agentes y artistas de la ciudad y el público que nos visita. Es un espacio de encuentro que entiende las exposiciones como poderosos dispositivos activadores de la imaginación y generadores de discursos que a menudo exceden aquellos previstos por la institución o preconcebidos por el equipo curatorial.",11 nov. 2017,31 mar. 2018,MACBA,,https://www.macba.cat/es/parlem-de-rosemarie-castoro-enfocar-al-infinito/1/all/activ,null,null,null,null,/es/parlem-de-rosemarie-castoro-enfocar-al-infinito/1/all/activ
1517593826-109,http://www.macba.cat/es/actividades,Parlem de... Colección. Bajo la supeficie,"Ángela de la Cruz, artista, conversa con Carolina Grau, comisaria independiente.",https://www.macba.cat/uploads/20170719/latifa_770.jpg,"PARLEM DE… COLECCIÓN MACBA. BAJO LA SUPERFICIE

Con Ignasi Aballí, Pep Agut, Ángela de la Cruz, Dora García, Antonia M. Perelló y Jordi Colomer



El programa Parlem de quiere generar espacios de debate, a partir de las exposiciones del museo, entre distintos agentes y artistas de la ciudad y el público que nos visita. Es un espacio de encuentro que entiende las exposiciones como poderosos dispositivos activadores de la imaginación y generadores de discursos que a menudo exceden aquellos previstos por la institución o preconcebidos por el equipo curatorial.",14 oct. 2017,17 mar. 2018,MACBA,,https://www.macba.cat/es/parlem-de-colleccion-macba-bajo-supeficie/1/all/activ,null,null,null,null,/es/parlem-de-colleccion-macba-bajo-supeficie/1/all/activ
