event_title1,event_title2,event_image-src,event_text,event_start,event_end,event_venue,event_link,event_link-href,event_organizer__MACBA,event_category__Actividad__MACBA,event_maplink__1,event_cost__,event_id
Alex Mendizabal y Judy Dunaway,Lorem Ipsum,http://www.macba.cat/uploads/20170623/Alex_Mendizabal.3.jpg,"ALEX MENDIZABAL

La práctica de Alex Mendizabal se caracteriza por la construcción de instrumentos y la espacialización sonora y a menudo adopta formas inusuales, como los filmes ciegos, los conciertos en movimiento o la música subacuática. Este músico y compositor donostiarra afincado en Roma lleva treinta años investigando distintos ámbitos de la música y el sonido. Sus propuestas van desde la música para orquesta a experimentos con notación gráfica, partituras de menos de un segundo o conciertos para movimientos geológicos. Cuenta que en 1996 decidió dejar de componer y dedicarse a la construcción de instrumentos e incorporar el espacio y la reflexión sobre la escucha como coordenadas básicas de sus propuestas.



En esta ocasión, Mendizabal ocupará el atrio del museo con globos, jabón, garbanzos y la intersección sonora que provoca su entrecruce. Coincidiendo con las fiestas del Raval, su instalación se podrá visitar gratuitamente durante todo el día.





JUDY DUNAWAY

Judy Dunaway empezó a experimentar con globos inspirada por John Cage e influenciada por el movimiento Fluxus, la improvisación libre y otras vanguardias. La crisis del sida de principios de los ochenta la llevó a explorar sin inhibición la extraordinaria paleta sonora que abre la inadvertida cualidad conductora de sonido del látex inflado. Un posicionamiento político y corporal que se ha convertido en su signatura, como ella misma apunta en su manifiesto online: «Mi trabajo no surge del vacío. Crear un gran corpus de obras para globos me ha permitido desarrollar un vocabulario fuera del opresivo legado clásico. Ha elevado lo ordinario y mundano a la condición de Arte en mayúscula. He fetichizado este juguete simple y barato en mi música, igual que los compositores influenciados por la música europea occidental han fetichizado durante siglos el violín. En una época en la que los avances en la lucha de la mujer por el control de su propio cuerpo se encuentran amenazados, me acompaño de un instrumento musical que expresa sensualidad, sexualidad y humanidad sin inhibiciones.»



La actuación de Dunaway está articulada en dos tiempos: un show en solitario con proyecciones preparadas específicamente para esta ocasión y una sinfonía de globos con el público.





Judy Dunaway - Hommage à Kenneth Noland",13 jul. 2017,null,MACBA,,http://www.macba.cat/es/alex-mendizabal-judy-dunaway-lorem-ipsum/1//activ,null,null,null,null,/es/alex-mendizabal-judy-dunaway-lorem-ipsum/1//activ
N.M.O.,Lorem Ipsum,http://www.macba.cat/uploads/20170623/NMO_IN_MEXICOo.3.jpg,"N.M.O.

El artista noruego Morten J. Olsen y el barcelonés Rubén Patiño cargan el legado de Fluxus de una práctica disciplinada cercana al ejercicio marcial y la ejercitación gimnástica extrema, con la misma naturalidad con que sus estructuras de rave, techno y derivados abrazan el tambor y la computer music.



Escondidos a menudo bajo iteraciones mutantes de su acrónimo, como Natalia Martínez Ordóñez, Nassau Molasses Office o Navngitt Mønster Opptog, sus trabajos han sido publicados en sellos como Diagonal, Anomia, The Vinyl Factory o Death of Rave. En cada uno de ellos, despliegan lo que ellos mismos denominan «space music militar y/o fluxus techno». Tamborileo extremo en directo yuxtapuesto con secuencias de SuperCollider en una aproximación al club poco ortodoxa, a base de patrones aparentemente repetitivos. En su actuación en el MACBA, N.M.O. lleva el test de Cooper al lenguaje del club en un «multi-stage fitness set» con luces estroboscópicas, ¡hasta que el cuerpo aguante!





N.M.O. (Morten J. Olsen & Rubén Patiño) at Sonic Protest Festival 2016",06 jul. 2017,null,Sala de exposiciones del Convent dels Àngels,,http://www.macba.cat/es/nmo-lorem-ipsum/1//activ,null,null,null,null,/es/nmo-lorem-ipsum/1//activ
Felofón y Goodiepal & Pals,Lorem Ipsum,http://www.macba.cat/uploads/20170703/parl_gdl.13.jpg,"FELOFÓN

Fela Borbone es autodidacta, exorcista de circuitos electrónicos e inventor del Mierdofón, un dispositivo construido a partir del ordenador personal Amstrad CPC que, mediante un programa escrito en BASIC, controla bastoncillos impulsados por electroimanes que golpean diferentes instrumentos de percusión (latas, bidones, bandejas). Utiliza también guitarras modificadas con pastillas de fabricación casera. Su actividad se extiende asimismo a la generación de manuales, como Rocanrol por el puto morro, en los que explica la fabricación y el funcionamiento de sus instrumentos, que a veces no pasan de ser meros prototipos. 



Fela empezó su carrera musical como parte de Los Borbones y Royal Canín. A partir de su conversión en Ulan Bator Trío, la formación empezó a editar discos. Su trabajo se caracterizó desde el principio por una puesta en escena provocadora, con letras irreverentes e instrumentos que ellos mismos fabricaban. Publicaron un LP, Vinilisimo (Alehop!, 1998). Pero es en su proyecto personal Felón y su Mierdofón, calificado por él mismo como «pachanga roboroquera», donde mejor pone de manifiesto sus capacidades como lutier. Fela ha participado en festivales y encuentros en contextos musicales y artísticos, en los que ha dado también charlas sobre la producción de artefactos sonoros.





Fela Borbone - ¿Fiesta? ¡SI! ¿Fiesta? ¡ASI!



GOODIEPAL & PALS

El danés Goodiepal ha invertido todo su tiempo y energía en huir de estereotipos y expectativas. Su cruzada por la pedagogía radical y la especulación sci-fi con notación gráfica para no aburrir a la inteligencia artificial por venir pasa ahora por su etapa más política, con intervenciones en campos de refugiados, lecturas incendiarias sobre la noción de Europa y formato banda. 



En el año en que él cumple cuarenta, el «embaucador de embaucadores» anunció en las redes que estaba «demasiado mayor para actuar en solitario», por lo que ha abierto la puerta a su nueva formación, compuesta por Oliver Laumann, Dønny Fortrængning, Nynne Roberta Pedersen Pedersen 1 & Nynne Roberta Pedersen 2, Sara Nigard Rosendal y Fie Auf Bathtub. En ella, en sus propias palabras, él hace casi como de «portero». El grupo, especialmente activo en Alemania, Escandinavia y los Balcanes, promete cruzar ahora el viejo continente en tren con su equipo a cuestas. 



Tratándose de alguien que publicó el año pasado un álbum pirata para Editions Mego, titulado EMEGO 211, disponible bajo dominio público usando Wikimedia Commons como plataforma y con tantas caras como letras tiene el abecedario, lo que finalmente pueda ocurrir sobre el escenario es difícil de prever... Más allá de la verbigracia, el desafío a las convenciones, el virtuosismo y la tecnofilia que son habituales en su trabajo.



Tal vez mejor que repetir la retahíla de etiquetas y descripciones que colecciona y regala en sus delirantes acciones en YouTube y otras estrategias virales varias, la mejor manera de aproximarse a su práctica es la que propone Felix Kubin: «Me vino a la cabeza como si me cayese un rayo: Goodiepal no es un artista. Es un crítico de arte. O para ser más preciso: un crítico de arte artístico, dado que usa su crítica de arte como una práctica artística. Pero, evidentemente, él criticaría esta definición. Ahoi!»







Goodiepal & Pals - Panik Panik Panik",20 jul. 2017,null,,,http://www.macba.cat/es/felofon-gp-pls-lorem-ipsum/1//activ,null,null,null,null,/es/felofon-gp-pls-lorem-ipsum/1//activ
