"EVENT NAME","VENUE NAME","ORGANIZER NAME","START DATE","START TIME","END DATE","END TIME","ALL DAY EVENT?","CATEGORIES","EVENT COST","EVENT WEBSITE","SHOW MAP LINK?","SHOW MAP?","EVENT DESCRIPTION","EVENT IMAGE"
"Exposició d'il·lustració creativa ""Don't Erase""","EINA, Espai Barra de Ferro","EINA Centre Universitari de Disseny i Art de Barcelona","07/12/2018","","07/12/2018","",1,"","","https://www.facebook.com/events/511160072632701/",1,1,"<p><img src='http://scontent-mad1-1.xx.fbcdn.net/v/t1.0-0/q86/s526x296/36486267_1904444786284759_626865771229741056_n.jpg?_nc_cat=0&oh=b3609c75db1daf70385407fa68c9c845&oe=5BE4AA6B' width='228' height='182' alt='Exposició d'il·lustració creativa ""Don't Erase""' />El proper dijous 12 de juliol s'inaugura l'exposició ""Don't Erase"", on es podrà veure un recull de projectes realitzats pels estudiants del Postgrau en il·lustració creativa i tècniques de comunicació visual d'EINA.<br /><br />Sota la consigna “No esborrar”, els alumnes plantegen la importància d’abraçar l’error i perdre-li la por a fi de trobar la manera única i intransferible d’il·lustrar, ja que els errors no són l’enemic, sinó companys de viatge. <br /><br />Il·lustrar és un procés d'assaig i error, de fer esbossos, proves de color, repetir, arrugar, llençar, passar-se, no arribar i sobretot: esborrar. <br /><br />A la mostra es podran veure les obres de Alexia Adrover, Lucas Amaral, Eugenia Anglès, Martín Azpilikueta, Berta Cervilla, Maria de Balanzó, Andrea de Castro, Raquel Díaz, Laia Ebert, Bernardo Ferro Bagulho, Varvara Fomina, Santiago Gómez, Alicia Jimenez, Claudie Linke, Catalina Mekis, Rosario Merello, Constanza Olea, Belén Olivera, Adriana Páramos, Júlia Puig, Marc Rodríguez, Arantxa Rueda, Valentina Silva, Rut Tena, Ariadna Veas i Shuang Zhang.<br />--<br />El próximo jueves 12 de julio se inaugura la exposición ""Don't Erase"", donde se podrá ver una selección de proyectos realizados por los estudiantes del Postgrado en Ilustración creativa y técnicas de comunicación visual, coordinado por Philip Stanton.<br /><br />Bajo la consigna ""No borrar"", los alumnos plantean la importancia de abrazar el error y perder el miedo a fin de encontrar la manera única e intransferible de ilustrar ya que los errores no son el enemigo, sino compañeros de viaje.<br /><br />Ilustrar es un proceso de ensayo y error, de hacer bocetos, pruebas de color, repetir, arrugar, tirar, pasar, no llegar y sobre todo: borrar.<br /><br />En la muestra se podran ver las obras de Alexia Adrover, Lucas Amaral, Eugenia Anglès, Martín Azpilikueta, Berta Cervilla, Maria de Balanzó, Andrea de Castro, Raquel Díaz, Laia Ebert, Bernardo Ferro Bagulho, Varvara Fomina, Santiago Gómez, Alicia Jimenez, Claudie Linke, Catalina Mekis, Rosario Merello, Constanza Olea, Belén Olivera, Adriana Páramos, Júlia Puig, Marc Rodríguez, Arantxa Rueda, Valentina Silva, Rut Tena, Ariadna Veas i Shuang Zhang.</p>","https://scontent-mad1-1.xx.fbcdn.net/v/t1.0-0/q86/s526x296/36486267_1904444786284759_626865771229741056_n.jpg?_nc_cat=0&oh=b3609c75db1daf70385407fa68c9c845&oe=5BE4AA6B"
"Pro-eject!: presentació i exposició dels TFG 2018","null","EINA Centre Universitari de Disseny i Art de Barcelona","07/17/2018","","07/20/2018","",1,"","","https://www.facebook.com/events/196380107690727/",1,1,"<p><img src='http://scontent-mad1-1.xx.fbcdn.net/v/t1.0-0/s526x296/36656601_1905826086146629_7967999636499595264_n.jpg?_nc_cat=0&oh=269298a2b3613ad4a7d9978654b9857b&oe=5BAB0F3C' width='228' height='182' alt='Pro-eject!: presentació i exposició dels TFG 2018' /></p>","https://scontent-mad1-1.xx.fbcdn.net/v/t1.0-0/s526x296/36656601_1905826086146629_7967999636499595264_n.jpg?_nc_cat=0&oh=269298a2b3613ad4a7d9978654b9857b&oe=5BAB0F3C"
"La Bombilla w/ Maurice Moeliker - Vernissage","La Bombilla","La Bombilla","07/05/2018","","07/05/2018","",1,"","","https://www.facebook.com/events/230994031008376/",1,1,"<p><img src='http://scontent-mad1-1.xx.fbcdn.net/v/t1.0-0/s526x296/36188920_647366628936213_906279395566551040_n.jpg?_nc_cat=0&oh=a4100f698b7ce8b516c54f37698ff6ca&oe=5BADC01A' width='228' height='182' alt='La Bombilla w/ Maurice Moeliker - Vernissage' />La Bombilla w/ Maurice Moeliker<br /><br />Opening Exhibition of Maurice Moeliker on Thursday, 5th of July from 7PM at La Bombilla 💥<br /><br />La Bombilla goes into a new era of Art.<br />Every month one artist will be the protagonist of the Art area of the bar.<br /><br />This month we will welcome the Dutch photographer Maurice Moeliker who will be pleased to present his street photographs during the opening of his exhibition!<br /><br />About the artist and his project: Maurice Moeliker<br /><br />Maurice is an urban and street photographer based in Barcelona and always looking for the non-typical Barcelona pictures that include some alienation, darkness and loneliness.<br /><br />As a scenery for the pictures he often uses the BCN subways and other (mostly undiscovered) architectural highlights of Barcelona.<br /><br />Come and discover it at La Bombilla!<br /><br />FREE ENTRANCE<br />Discounted drinks during the opening</p>","https://scontent-mad1-1.xx.fbcdn.net/v/t1.0-0/s526x296/36188920_647366628936213_906279395566551040_n.jpg?_nc_cat=0&oh=a4100f698b7ce8b516c54f37698ff6ca&oe=5BADC01A"
"El Futur ja no és el que Era","Centre Cívic Pere Pruna","Lluís Cadafalch","07/06/2018","","07/06/2018","",1,"","","https://www.facebook.com/events/1525716967540456/",1,1,"<p><img src='http://scontent-mad1-1.xx.fbcdn.net/v/t1.0-0/p235x350/36531920_10216588017076450_8115409073081417728_n.jpg?_nc_cat=0&oh=bb1f90a1039ef110b0fb6cb4f8449381&oe=5BAB53F9' width='228' height='182' alt='El Futur ja no és el que Era' />Exposició individual on es recull l’obra recent de l’artista plàstic Lluís Cadafalch. En un espai de reflexió i experimentació ens parla de les relacions humanes: el dubte, l’angoixa, la passió, la mentida i la hipocresia, però també l’amor i la tendresa. <br />T'espero!!!</p>","https://scontent-mad1-1.xx.fbcdn.net/v/t1.0-0/p235x350/36531920_10216588017076450_8115409073081417728_n.jpg?_nc_cat=0&oh=bb1f90a1039ef110b0fb6cb4f8449381&oe=5BAB53F9"
"La RODA Holidays EXPO, Domingueros Edition","null","Taller la Roda","07/07/2018","","07/07/2018","",1,"","","https://www.facebook.com/events/195763977795899/",1,1,"<p><img src='http://scontent-mad1-1.xx.fbcdn.net/v/t1.0-0/p280x280/36496785_2088309634765068_7718230258691866624_o.jpg?_nc_cat=0&oh=79b2db6c0e91d8d07ca439332f4a381b&oe=5BE1015E' width='228' height='182' alt='La RODA Holidays EXPO, Domingueros Edition' />Cansat de la rutina? Vine a envoltar-te de serigrafia i autoedició al Taller La Roda!!<br />Aquest dissabte 7 de juliol, expo de serigrafies i festa dominguera al taller. On presentarem una col·lecció de pósters de gran format fets per l'ocasió pels membres del taller, publicacions autoeditades, música en directe amb Alcón Tiki i molta patxanga.<br /><br />Refresca't amb 'La Roda Holidays'.<br />Welcome!!!!</p>","https://scontent-mad1-1.xx.fbcdn.net/v/t1.0-0/p280x280/36496785_2088309634765068_7718230258691866624_o.jpg?_nc_cat=0&oh=79b2db6c0e91d8d07ca439332f4a381b&oe=5BE1015E"
"Inauguración/Opening Pachi Santiago: Copying Claudia","Galería Zielinsky","Galería Zielinsky","07/05/2018","","07/05/2018","",1,"","","https://www.facebook.com/events/1039516479529827/",1,1,"<p><img src='http://scontent-mad1-1.xx.fbcdn.net/v/t1.0-0/p235x350/36554242_855295527994580_8994409155666116608_n.jpg?_nc_cat=0&oh=366ed6a34ee6667063a57b2c0770348f&oe=5BDE007A' width='228' height='182' alt='Inauguración/Opening Pachi Santiago: Copying Claudia' />📌 Después de siete años de exhaustivo trabajo y tras ser expuesto en Nueva York, Berlín, Uruguay, Monterrey, Madrid o México DF, el artista Pachi Santiago presenta por primera vez en Barcelona la exposición que recoge de manera global su proyecto Copying Claudia. La Galería Zielinsky reúne desde el 5 de julio más de 80 fotografías y videos, de los cuales 16 son inéditos, de este trabajo en el que el autor copia en primera persona imágenes icónicas protagonizadas por la super modelo alemana Claudia Schiffer, generando así su propio autorretrato a través de la ironía y el disfraz.<br /><br />📌 After seven years of exhaustive work and after being exhibited in New York, Berlin, Uruguay, Monterrey, Madrid or Mexico City, Pachi Santiago presents for the first time in Barcelona the exhibition that gathers his project Copying Claudia. Zielinsky gallery brings together more than 80 photographs and videos, of which 16 are unpublished. In these series, Pachi use himself as a model to represent iconic images starred by the German super model Claudia Schiffer, generating his self-portrait through irony and disguise.<br /><br />📌 Després de set anys d'exhaustiu treball i de ser exposat a Nova York, Berlín, Uruguai, Monterrey, Madrid o Mèxic DF, l'artista Pachi Santiago presenta per primera vegada a Barcelona l'exposició que recull de manera global el seu projecte Copying Claudia. La Galeria Zielinsky reuneix des del 5 de juliol més de 80 fotografies i vídeos, dels quals 16 són inèdits, d'aquest treball en el qual l'autor còpia en primera persona imatges icòniques protagonitzades per la super model alemanya Claudia Schiffer, generant així el seu propi autoretrat a través de la ironia i la disfressa.</p>","https://scontent-mad1-1.xx.fbcdn.net/v/t1.0-0/p235x350/36554242_855295527994580_8994409155666116608_n.jpg?_nc_cat=0&oh=366ed6a34ee6667063a57b2c0770348f&oe=5BDE007A"
"JAŠA: At the Dawn Of Yet Another Age of Absurdity: Composition 5","Espronceda","WE.ARE institute","07/04/2018","","07/04/2018","",1,"","","https://www.facebook.com/events/1862265254075287/",1,1,"<p><img src='http://scontent-mad1-1.xx.fbcdn.net/v/t1.0-9/s851x315/35841611_1042224195936723_4766637958746865664_n.jpg?_nc_cat=0&oh=700aba6ad9db626ba7c942f1d824d22f&oe=5BDC406F' width='228' height='182' alt='JAŠA: At the Dawn Of Yet Another Age of Absurdity: Composition 5' />At the Dawn Of Yet Another Age of Absurdity: Composition No. 5<br /><br />a spatial and performing intervention<br />by JAŠA<br /><br />performances by<br />Martina de Lugnani<br />Peter Furlan<br />and Isa-Bela Mrevlje<br /><br />Wednesday, 04/07/2018 from 18:00-22:00<br /><br />*<br /><br />The composition continues.<br />In light of our deep ambivalence about our global socio-economic situation, the question of the political commitment, in art and elsewhere, seems to be calling out for alternatives that do not shy away into the usual underground. The poetical, the individual act of defiance, a voice, sound, a repeating gesture as a poetical stance and standing resistance. Composition No. 1, 2, 3 & 4 saw JAŠA unravel in New York City, Folkestone, Atacama desert and Zagreb on his own, what he did for six days a week, for 29 weeks, with a group of people, during the duration of the performance, the same issues, the same questions.<br />In essence, the composition remains the same: ephemeral, gestural, a form of resistance, only now reacting to a different context, as it molds in response to a delicate and menacing political climate. The core is an architecture of resistance, which manifests actions through presence and language. Actions and interventions are spread throughout the eight-day performance, reacting to the local, the temporal, a simplicity is fueled by the urgency of the now, a repercussion in time and space, we must recoil quickly, react to what is happening around us, being immediate and relevant.<br /><br />(Reactionary—immediacy is the medium. Relevancy—say it out loud, now, instantly, perform,<br />proceed.)<br /><br />There is tension under the surface. Egocentrism has swallowed us. Today’s rapidly changing day-to-day necessitates action, comment, responsibility, response. We are in an urgent state of ideological crisis that has resulted in the psychological breakdown of society. The situation needs constant attention, it requires reaction, as individuals and as different groups as a whole. All of it was there from the beginning; it now depends on which elements will surface through, which emotions will become the generator for a particular ideology. Art has always had the responsibility of being both a catalyzer and generator. Punk as an attitude was a reaction to a stiffening tissue of the era; Dada was significant opposition to boiling extremes that brought humanity to meet its most monstrous<br />side. In each inch of our bodies lies a potential disaster; as we are facing the most existential dilemmas on every step, each cell can decide to deteriorate and bring out the worst in us while we are dreaming of beauty. At times, it may be better to limit yourself than to continue the illusion of all accessible freedom, which ends in nothing less than limitless ego. A lake of me-s to drown in, a lake of us to love me.<br />Alternative forms of communication do exist; visual, musical, symbols, patterns - what we need are regular executions, to be exercised regularly. An exchange of situations creates the uniqueness of experiences. A Beuysian gesture in its potential to transform society. A simple exchange; a catalyst for hope. An act that will be what it is. Through repetition, gesture, and embrace, we reach the shores of ones most authentic self. In his recent<br />composition’s, JAŠA limits himself into a reverse situation - an honest way to face the self in front of self. Every thought can deteriorate. Every character can have many shades. A manifestation of a contrasting process that embraces aggression as emotion to give birth to the poetic. The obscurity of space reveals the preciousness of each gesture, gestures that parallel and overlap in time and space. All in one body, a dance with gravity. Now. It is<br />time to scream in the face of absurdity. Only together can we erupt and break free. Openness. A dense cloud of energy and spontaneity. When all is said and done, we transition into memory; we leave no trace.<br />All in one body we walk…<br /><br />JAŠA (Mrevlje-Pollak, 1978) is one of the most prolific and influential contemporary Slovenian visual artists and the most prominent voice of the generation that with its educational process, art practice and project-related exhibitions has blown up the context of the domestic and foreign art scene and in this way secured visibility in the international art space. He has studied at the Academy in Venice (Accademia di Belle Arti di Venezia), where he graduated in 2004 with distinction and he obtained the second stage diploma at the same institution in 2007 (con elodee). Since 2008 he has headed the experimental training programmes at this institution. During his studies he was a member of the international art group Crash in Progress, a progressive and radical group that created an impressive reputation with art projects that aroused a great deal of attention. In 2005 he embarked on a completely autonomous path on which he has continued and created diversified and multi-media practice, based on the principles of “site specific” interventions and the interconnectedness of creative processes with other participants. In the decade of the high rhythm of integrated projects, both alone and with several other renowned artists, he thoroughly transformed the art scene in Ljubljana and then continued in the same way in European project and<br />exhibition spaces, until his first independent exhibition in New York in 2012. In 2015, he represented Slovenia at the 56 th Venice Biennale, one of the most important events of the contemporary art world. Trained as a painter, he combined within the embryonic phase the isolation of creativity in the studio with collaboration with other artists and groups from diverse fields (from contemporary multimedia visual practices, architectural approaches and principles, sound art and music, and, last but not least, performance) in multi-layered and integrated projects, where he has put the relationship to the audience and with the audience at the true centre of artistic creation. After intensive and fruitful years of creation in the Slovenian and European art space, since 2013 he has lived and worked between Ljubljana and New York and continues to be a constant in the international art space.<br /><br />The Composition series was established in 2017, curated by Mitra Korasheh.<br /><br />Composition No.1<br />kHORASHEH + gRUNERT, Tania Grunert Gallery<br />Supported by WE.ARE Institute<br />New York<br /><br />Composition No.2<br />HOP projects Folkestone<br />Supported by WE.ARE Institute, Performance space, Adelaide Bannerman and David Thorpe<br />Folkstone, UK<br /><br />Composition No.3<br />La Wayaka Current<br />Supported by WE.ARE Institute & Embassy of the Republic of Slovenia Buenos Aires<br />Atacama desert, Chile<br /><br />Composition No.4<br />Museum of Contemporary Art Zagreb<br />Supported by UGM + MSU<br />Zagreb, Croatia<br /><br />www.jasha.org</p>","https://scontent-mad1-1.xx.fbcdn.net/v/t1.0-9/s851x315/35841611_1042224195936723_4766637958746865664_n.jpg?_nc_cat=0&oh=700aba6ad9db626ba7c942f1d824d22f&oe=5BDC406F"
"Inauguració de l'exposició ""Heroes of War""","Goethe-Institut Barcelona","Goethe-Institut Barcelona","07/19/2018","","07/19/2018","",1,"","","https://www.facebook.com/events/653308618340026/",1,1,"<p><img src='http://scontent-mad1-1.xx.fbcdn.net/v/t1.0-0/p526x296/36447605_2169105433099866_1801727536447619072_n.jpg?_nc_cat=0&oh=1dd61230119578525c779325b1ca2d55&oe=5BDDAF00' width='228' height='182' alt='Inauguració de l'exposició ""Heroes of War""' /></p>","https://scontent-mad1-1.xx.fbcdn.net/v/t1.0-0/p526x296/36447605_2169105433099866_1801727536447619072_n.jpg?_nc_cat=0&oh=1dd61230119578525c779325b1ca2d55&oe=5BDDAF00"