http://www.macba.cat/es/en-transformacion/1/actividades/activ,En transformación - Actividad recomendada para niños y niñas de 1 a 5 años,"<p><img src='http://www.macba.cat/uploads/20170110/MACBA_en_Familia_El_festi_150dpi_031.3.jpg' width='228' height='182' alt='En transformación - Actividad recomendada para niños y niñas de 1 a 5 años' />Hay materiales que cambian con el paso del tiempo, las condiciones atmosféricas, el espacio que ocupan, etc. Estos cambios son en algunas ocasiones bastante imperceptibles y en otras todo lo contrario. En la Colección MACBA 31 encontramos obras en las que el artista ya no mira ni representa el entorno, sino que trabaja directamente con él experimentando con todo tipo de procesos físicos. A partir de materiales naturales, algunas obras de la exposición y nuestros propios cuerpos, generaremos acciones que nos permitirán experimentar y observar la transformación de las cosas y de nosotros mismos.



Taller a cargo de Experimentem amb l'Art.</p><p><a href='http://www.macba.cat/es/en-transformacion/1/actividades/activ' target='_blank'>+info</a></p>",02/25/2017,04/08/2017,"Actividad, MACBA",MACBA,Espai Taller  MACBA,,1,1,1,,
http://www.macba.cat/es/parlem-de-los-ochenta/1/actividades/activ,"Parlem de... los ochenta - A cargo de María Ruido, Marcelo Expósito y Tino Calabuig","<p><img src='http://www.macba.cat/uploads/20170127/la_ciudad_es_nuestra_1_Tino_Calabuig.3.jpg' width='228' height='182' alt='Parlem de... los ochenta - A cargo de María Ruido, Marcelo Expósito y Tino Calabuig' />El programa Parlem de quiere generar espacios de debate, a partir de las exposiciones del museo, entre distintos agentes y artistas de la ciudad y el público que nos visita. Es un espacio de encuentro que entiende las exposiciones como poderosos dispositivos activadores de la imaginación y generadores de discursos que a menudo exceden aquellos previstos por la institución o preconcebidos por el equipo curatorial. En esta ocasión, compartiremos la visión de algunos de los artistas que participan en la exposición Gelatina dura. Historias escamoteadas de los 80. Los itinerarios no pretenden explicar de forma exhaustiva todas las obras expuestas, sino mostrar una selección que permita descubrir las particularidades y el contexto en el que fueron creadas y cómo son recibidas por cada grupo de visitantes.



HABLEMOS DE LOS OCHENTA

Tres recorridos de la mano de tres artistas presentes en la exposición Gelatina dura que permitirán una aproximación a la muestra desde perspectivas singulares.</p><p><a href='http://www.macba.cat/es/parlem-de-los-ochenta/1/actividades/activ' target='_blank'>+info</a></p>",02/18/2017,03/04/2017,"Actividad, MACBA",MACBA,MACBA,,1,1,1,,
http://www.macba.cat/es/parlem-de-amb-nancy-garin/1/actividades/activ,"Parlem de... Hablemos de imágenes, memoria y decolonialidad - A cargo de Nancy Garín","<p><img src='http://www.macba.cat/uploads/20170127/2694_004_lighbox.0.jpg' width='228' height='182' alt='Parlem de... Hablemos de imágenes, memoria y decolonialidad - A cargo de Nancy Garín' />El programa Parlem de...  quiere generar espacios de debate, a partir de las exposiciones del museo, entre distintos agentes y artistas de la ciudad y el público que nos visita. Es un espacio de encuentro que entiende las exposiciones como poderosos dispositivos activadores de la imaginación y generadores de discursos que a menudo exceden aquellos previstos por la institución o preconcebidos por el equipo curatorial.



HABLEMOS DE IMÁGENES, MEMORIA Y DECOLONIALIDAD

«La historia de los oprimidos, un discontinuum» W. Benjamin

Un recorrido por las obras expuestas en el MACBA que pretende poner al descubierto las relaciones entre arte, poder y visualidad. Las imágenes controladas por el poder como productoras de subjetividades estandarizadas y algunas prácticas artísticas como dispositivos para desvelar el oscuro entramado que se oculta bajo la socialización mediatizada de la historia.



En las últimas décadas, con el desarrollo vertiginoso de las nuevas tecnologías, nuestras miradas, la construcción de nuestras vidas, recuerdos y relatos se han visto transformadas por el tráfico acelerado de imágenes, su intencionada combinación y manipulación. 



De forma paralela, se ha generado un creciente interés por revisar nuestro pasado reciente. La construcción de las imágenes, especialmente las del campo de la representación y el arte, ha estado permanentemente en manos del poder. Pero las sociedades responden, cada tanto, activando la memoria que el poder quiere hacer desaparecer, siendo crucial su respuesta en el sostenimiento de las producciones artísticas –y las que desbordan el campo del arte.



Recorrer imágenes activa la memoria, tanto propia como colectiva; nos ayuda a pensar el presente, a decodificar las tramas de las experiencias pasadas para comprender y superar los hechos presentes, entendiendo el contexto y la subjetividad de quienes las han producido.



Walter Benjamin afirma que la memoria, así como la escritura, son estructuras basadas en capas no necesariamente lineales. Las imágenes que articulan la memoria se estructuran en constelaciones donde se cruzan líneas temporales, y el límite entre la subjetividad propia y su sociedad se difumina.



En esta serie de visitas a las exposiciones del museo proponemos reactivar esa memoria colectiva, iniciar ese viaje infinito de la memoria personal/individual de quien confronta las imágenes: el visitante, gatillando en el recorrido sus ideas, pensamientos y sentires, con un otro, el artista, que a través de su obra construye o deconstruye sus propias ideas, pensamientos y sentires. 



Del mismo modo, buscamos problematizar las diferentes formas de «narración» de la memoria propuestas por las obras a transitar, así como la «imagen» de la otredad planteada desde dichos procesos artísticos, desde una perspectiva decolonial.



Las primeras visitas proponen un recorrido por la exposición Gelatina dura. Historias escamoteadas de los 80, comentando obras de Joaquim Jordà, María Ruido, Isaías Griñolo, Miguel Benlloch y Las Pekinesas, Rogelio López Cuenca o Alan Carrasco entre otras. A partir del 18 de marzo, la visita se centrará en algunas de las obras que forman parte de la presentación actual de la Colección, como por ejemplo las de Carlos Garaicoa, Alice Creischer, León Ferrari o Pedro G. Romero.



A cargo de Nancy Garín, investigadora y miembro del colectivo de arte Etcétera ..., de la Internacional Errorista, de Península. Procesos coloniales y prácticas artísticas y curatoriales, y del Equipo re.</p><p><a href='http://www.macba.cat/es/parlem-de-amb-nancy-garin/1/actividades/activ' target='_blank'>+info</a></p>",02/04/2017,04/01/2017,"Actividad, MACBA",MACBA,MACBA,,1,1,1,,