"EVENT NAME","VENUE NAME","ORGANIZER NAME","START DATE","START TIME","END DATE","END TIME","ALL DAY EVENT?","CATEGORIES","EVENT COST","EVENT WEBSITE","SHOW MAP LINK?","SHOW MAP?","EVENT DESCRIPTION","EVENT IMAGE"
"Workshop Cianotípia con Andrea Martínez","Carrer de Ferran Turné, 11 08027 Barcelona (Barcelona), Espanya","PIAC","09/10/2017","","","",1,"Exposición, Espacios alternativos","0","https://www.facebook.com/events/333733793734779/",1,1,"<p><img src='http://scontent.xx.fbcdn.net/v/t31.0-8/s720x720/20248432_467818103575174_7182907016474861476_o.jpg?oh=d4412801960b6b64d1d62288ab1c0fea&oe=59FA714D' width='228' height='182' alt='Workshop Cianotípia con Andrea Martínez' />Workshop de cianotipia amb l’artista Andrea Martínez.<br />Activitat transversal de l’exposició Sinèrgia.<br />Coneix la tècnica fotogràfica de la cianotipia, apren a fer tot el procés i a crear les teues propies obres.<br />L’artista Andrea Martínez aportarà negatius de la seva propia obra, amb els que hi podreu intervindre i crear noves obres sobre diferents materials.<br />Podràs trobar tota la informació sobre aquest workshop i el formulari d’inscripció al següent link:<br />https://www.piacproject.com/taller-andrea<br />Cal inscripció previa per confirmar que cobrim les places.<br /><br />[30€ MATERIALES INCLUIDOS]<br /><br />Més informació: exposicionespiac@gmail.com</p>","https://scontent.xx.fbcdn.net/v/t31.0-8/s720x720/20248432_467818103575174_7182907016474861476_o.jpg?oh=d4412801960b6b64d1d62288ab1c0fea&oe=59FA714D"
"Workshop: Transmedia en el arte","Carrer de Ferran Turné, 11 08027 Barcelona (Barcelona), Espanya","PIAC","09/23/2017","","","",1,"Exposición, Espacios alternativos","0","https://www.facebook.com/events/318477115244814/",1,1,"<p><img src='http://scontent.xx.fbcdn.net/v/t31.0-8/s720x720/20247827_467824086907909_4881700907457673450_o.jpg?oh=e5863a400dbc95ec2a2ee3c10e769b4b&oe=59F976FF' width='228' height='182' alt='Workshop: Transmedia en el arte' />Workshop: Disseny de narratives transmedia per a l’art contemporani.<br />Ja siguis artista, comisari, comunicador o aficionat a l’art, les narrativas transmedia poden obrir-te un gran ventall de possibilitats a l’hora de produir o de mostrar obra.<br />¿Qué és una narrativa transmedia? ¿Quins elements la conformen? ¿Quin nou rol adquereix l’espectador? ¿Com afavoreix a l’art?<br />Totes aquestes preguntes i moltes més acompanyades d’una part pràctica, en la que creareu l’univers transmèdia d’una obra d’art (propia o aliena) junt a la directora del projecte transmèdia PIAC.<br />Hi podeu trobar tota la informació del programa de l’activitat i el formulari d’inscripció al següent link:<br />https://www.piacproject.com/taller-piac<br />Cal inscripció previa per confirmar el número de places.</p>","https://scontent.xx.fbcdn.net/v/t31.0-8/s720x720/20247827_467824086907909_4881700907457673450_o.jpg?oh=e5863a400dbc95ec2a2ee3c10e769b4b&oe=59F976FF"
"Street Art Tour and Workshop","Barcelona","Alternative Barcelona","08/19/2017","","","",1,"Exposición, Espacios alternativos","0","https://www.facebook.com/events/142692502993522/",1,1,"<p><img src='http://scontent.xx.fbcdn.net/v/t1.0-9/s720x720/20767795_268109763674255_5103732376515961642_n.jpg?oh=8a23cbc596b613dc69513548b91246f7&oe=5A30498B' width='228' height='182' alt='Street Art Tour and Workshop' />Experience Barcelona’s street art scene! We'll begin by explaining the historical background of street art followed by a walk through the streets of Gràcia where we'll view and discuss the creations of internationally renowned urban artists. Afterwards we'll visit an underground art studio for a workshop led by Secle Style where you’ll create your own stencil, paste-up, or hand-made sticker.<br /><br />Price: €35.00 p/p<br />All materials included!<br /><br />You may add, for extra €5.00, a crêpe and beverage option!<br /><br />Photograph's work of art by Konair.</p>","https://scontent.xx.fbcdn.net/v/t1.0-9/s720x720/20767795_268109763674255_5103732376515961642_n.jpg?oh=8a23cbc596b613dc69513548b91246f7&oe=5A30498B"
"Street Art Tour and Workshop","Barcelona","Alternative Barcelona","08/30/2017","","","",1,"Exposición, Espacios alternativos","0","https://www.facebook.com/events/324886167955117/",1,1,"<p><img src='http://scontent.xx.fbcdn.net/v/t1.0-9/s720x720/20638987_268109883674243_5600546063991545708_n.jpg?oh=9bf460d194d5196a1bb0e67626ec27ab&oe=5A3659F8' width='228' height='182' alt='Street Art Tour and Workshop' />Experience Barcelona’s street art scene! We'll begin by explaining the historical background of street art followed by a walk through the streets of Gràcia where we'll view and discuss the creations of internationally renowned urban artists. Afterwards we'll visit an underground art studio for a workshop led by Secle Style where you’ll create your own stencil, paste-up, or hand-made sticker.<br /><br />Price: €35.00 p/p<br />All materials included!<br /><br />You may add, for extra €5.00, a crêpe and beverage option!<br /><br />Photograph's work of art by Konair.</p>","https://scontent.xx.fbcdn.net/v/t1.0-9/s720x720/20638987_268109883674243_5600546063991545708_n.jpg?oh=9bf460d194d5196a1bb0e67626ec27ab&oe=5A3659F8"
"The Takeover","Nau Bostik","Alternative Barcelona","08/12/2017","","","",1,"Exposición, Espacios alternativos","0","https://www.facebook.com/events/494407567565034/",1,1,"<p><img src='http://scontent.xx.fbcdn.net/v/t31.0-8/s720x720/20451747_263895364095695_3947774899503936388_o.jpg?oh=61e9f3a7ea260bcd7abba7e886b9bd4a&oe=59EE7730' width='228' height='182' alt='The Takeover' />The Takeover is a street art event that brings together Barcelona and Berlin artists to takeover an urban space and transform it into an urban oasis. This space is located within The Nau Bostik at the heart of La Sagrera.<br /><br />The event will be held throughout the week, but we invite you to come join us on the 12th for a series of live paintings, some of the artists will be selling their works, we'll have cold beer, funky music, and most importantly a good vibe!<br /><br />Check out our website here: http://www.thetakeover.eu/#sponsors<br /> <br />This is a free event! <br />---- <br /><br />The Takeover es un evento de arte urbano que se llevará a cabo durante la primera semana de agosto en la nave industrial de la Nay Bostik localizada en el corazón de La Sagrera. Los invitamos a uniros el sábado 12 de agosto.<br /><br />El objetivo principal del evento es crear un espacio en el que artistas de Berlin y de Barcelona trabajan en conjunto para convertir un espacio urbano en un oasis artístico.<br /><br />Habrá pintura en vivo, algunos artistas estarán vendiendo su obra, cerveza fría, buena música y sobre todo, buena vibra!<br /><br />Este evento es Gratis!</p>","https://scontent.xx.fbcdn.net/v/t31.0-8/s720x720/20451747_263895364095695_3947774899503936388_o.jpg?oh=61e9f3a7ea260bcd7abba7e886b9bd4a&oe=59EE7730"
"Exposición arte: Sinèrgia","Carrer de Ferran Turné, 11 08027 Barcelona (Barcelona), Espanya","PIAC","09/09/2017","","09/23/2017","",1,"Exposición, Espacios alternativos","0","https://www.facebook.com/events/476549792705281/",1,1,"<p><img src='http://scontent.xx.fbcdn.net/v/t31.0-8/s720x720/20545582_471183716571946_2936787878355063653_o.jpg?oh=fee4a6e8946e7ce2fa34c4adb00c2422&oe=5A24075E' width='228' height='182' alt='Exposición arte: Sinèrgia' />EXPOSICIÓN COLECTIVA MULTIDISCIPLINAR <br />Artistas:<br />Ana Císcar, Andrea Martínez, Bàrbara Ruiz, Judith Mayor, Laia Vidal, Mar Juan Tortosa, Maria Marchirant, Marina E.G<br /><br />Sinèrgia no tiene un diseño expositivo convencional ya que queremos que salgas de esta exposición entendiendo cada una de las obras que hayas visto. Para ello nos ayudaremos de contenidos audivisuales y textos explicativos llanos, a los cuales podrás acceder desde delante de la propia obra mediante código QR.<br /><br />IMPORTANTE: para tener una experiencia más inmersiva recuerda traer auriculares y lector QR en tu móvil o tablet. (Ya que las obras de las artistas irán complementadas con contenido audiovisual)<br />Queremos agradecer la colaboración a Estudi Esteve con la cartelería y vinilos, a cerveza Moritz que pondrá barra a vuestra disposición el día de la inauguración y por último y más importante a Nau Bostik que nos ha acogido en su espacio y nos ha prestado mucha ayuda.<br /><br />¡Nos vemos pronto!<br />+info: www.piacproject.com<br /><br />¡NO TE PIERDAS TAMPOCO LAS ACTIVIDADES TRANSVERSALES!</p>","https://scontent.xx.fbcdn.net/v/t31.0-8/s720x720/20545582_471183716571946_2936787878355063653_o.jpg?oh=fee4a6e8946e7ce2fa34c4adb00c2422&oe=5A24075E"
"Imperi del Mig: Mediació artística i colonialisme","La Virreina Centre de la Imatge","La Virreina Centre de la Imatge","09/12/2017","","","",1,"Exposición, Espacios alternativos","0","https://www.facebook.com/events/338694146560413/",1,1,"<p><img src='http://scontent.xx.fbcdn.net/v/t1.0-9/q84/p720x720/20264759_1879145365739839_3747845878274349022_n.jpg?oh=7f1bbf0dfbff5f9c25885c28eca95749&oe=5A2E09F5' width='228' height='182' alt='Imperi del Mig: Mediació artística i colonialisme' />Carmen Mörsch<br />Traducció simultània anglès – català<br />Espai 4<br />Entrada gratuïta. Aforament limitat <br /><br />Aquest seminari tractarà de les formes en què s’han establert històricament la feminització i el paternalisme en la mediació artística. En aquest sentit, es plantejaran un seguit de consideracions sobre a) el fet que aquesta disciplina encara la dominen les professionals femenines, i b) el fet que el discurs hegemònic de la disciplina sobre un proïsme deficient que es pot rectificar/rescatar per mitjà de l’educació artística es basa en el corrent de la modernitat, és a dir, en l’establiment dels estats nació, l’imperi colonial i el capitalisme. De manera interdependent, des del seu naixement, la disciplina ha ofert també espais de resistència, apropiació i subversió. Per tant, és un espai en què pren forma la lluita per l’hegemonia. Aquest semin ari és una invitació a tenir en compte col·lectivament les possibilitats i els potencials de la mediació artística entesa com una pràctica crítica, descolonial i transformadora en els temps actuals i des d’una perspectiva global.<br /><br />La professora Carmen Mörsch és cap de l’Institut de Recerca d’Educació Artística de la Universitat de les Arts de Zuric, Suïssa: http://iae.zhdk.ch. Els seus interessos de recerca inclouen la història i el present dels artistes en l’educació; les pràctiques de col·laboració i transformació en l’art i l’educació; l’educació artística i la teoria queer/postcolonial. És membre de la xarxa «Another Roadmap for Art Education», que aplega investigadors i professionals interessats a analitzar i desenvolupar l’educació artística des d’una perspectiva emancipadora i descolonitzadora: http://another.zhdk.ch/</p>","https://scontent.xx.fbcdn.net/v/t1.0-9/q84/p720x720/20264759_1879145365739839_3747845878274349022_n.jpg?oh=7f1bbf0dfbff5f9c25885c28eca95749&oe=5A2E09F5"
"Workshop escultura: Territorios Ocupados","Carrer de Ferran Turné, 11 08027 Barcelona (Barcelona), Espanya","PIAC","09/10/2017","","","",1,"Exposición, Espacios alternativos","0","https://www.facebook.com/events/135804963675474/",1,1,"<p><img src='http://scontent.xx.fbcdn.net/v/t31.0-8/s720x720/20424317_467821756908142_7481995183787375112_o.jpg?oh=7496c00be1fe0499b81b57c17e87d395&oe=5A2DCBB9' width='228' height='182' alt='Workshop escultura: Territorios Ocupados' />Workshop d’escultura amb l’artista Mar Juan Tortosa.<br />Activitat transversal de l’exposició Sinèrgia.<br />Dialoga amb el teu cos a través de l’escultura, retroba el teu cos com a territori junt a una gran artista de l’escultura i la joieria com ho és Mar Juan.<br />Podràs trobar el programa complet de l’activitat i el formulari d’inscripció a aquest link:<br />https://www.piacproject.com/taller-mar<br />Inscripció previa necessària per asegurar-nos cobrir les places.<br /><br />[30€ MATERIALES INCLUIDOS]</p>","https://scontent.xx.fbcdn.net/v/t31.0-8/s720x720/20424317_467821756908142_7481995183787375112_o.jpg?oh=7496c00be1fe0499b81b57c17e87d395&oe=5A2DCBB9"